timestamp	hypothesis	baseline	metric	status
1774417761.76	Conduct a detailed analysis of the VM's inter-subsystem interaction mechanisms, including any potential misconfigurations or bugs that might be leading to improper execution. Modify identified configurations and ensure proper subsystem collaboration to improve inter-subsystem efficiency.	60	0	REVERT
1774417826.344	Conduct a detailed analysis of the VM's cache coherence mechanism, including any potential misconfigurations or bugs that might be leading to improper execution. Modify identified configurations and ensure proper subsystem collaboration to improve cache coherence efficiency.	60	0	REVERT
1774417891.055	Conduct a detailed analysis of the VM's task scheduling and resource allocation mechanisms, including any potential misconfigurations or bugs that might be leading to improper execution. Modify identified configurations and ensure proper subsystem collaboration to improve task scheduling and resource management efficiency.	60	0	REVERT
1774417955.813	Conduct a detailed analysis of the VM's resource contention and locking mechanisms, including any potential misconfigurations or bugs that might be leading to improper execution. Modify identified configurations and ensure proper subsystem collaboration to improve resource contention and locking efficiency.	60	0	REVERT
1774418020.499	Conduct a detailed analysis of the VM's memory management mechanism, including any potential misconfigurations or bugs that might be leading to improper execution. Modify identified configurations and ensure proper subsystem collaboration to improve memory management efficiency.	60	0	REVERT
1774418085.135	Conduct a detailed analysis of the VM's interrupt handling mechanism, including any potential misconfigurations or bugs that might be leading to improper execution. Modify identified configurations and ensure proper subsystem collaboration to improve interrupt handling efficiency.	60	0	REVERT
1774418149.931	Conduct a detailed analysis of the VM's inter-subsystem interaction mechanism, including any potential misconfigurations or bugs that might be leading to improper execution. Modify identified configurations and ensure proper subsystem collaboration to improve inter-subsystem communication and synchronization efficiency.	60	0	REVERT
1774418214.627	Conduct a detailed analysis of the VM's system call handling mechanism, including any potential misconfigurations or bugs that might be leading to improper execution. Modify identified configurations and ensure proper subsystem collaboration to improve system call handling efficiency.	60	0	REVERT
1774418279.334	Conduct a detailed analysis of the VM's cache coherence mechanism, including any potential misconfigurations or bugs that might be leading to improper execution. Modify identified configurations and ensure proper subsystem collaboration to improve cache coherence efficiency.	60	0	REVERT
1774418343.887	Conduct a detailed analysis of the VM's task scheduling mechanism, including any potential misconfigurations or bugs that might be leading to improper execution. Modify identified configurations and ensure proper subsystem collaboration to improve task scheduling efficiency.	60	0	REVERT
1774418408.588	Conduct a detailed analysis of the VM's resource allocation mechanism, including any potential misconfigurations or bugs that might be leading to improper execution. Modify identified configurations and ensure proper subsystem collaboration to improve resource allocation efficiency.	60	0	REVERT
1774418473.241	Conduct a detailed analysis of the VM's resource contention mechanism, including any potential misconfigurations or bugs that might be leading to improper execution. Modify identified configurations and ensure proper subsystem collaboration to improve resource contention efficiency.	60	0	REVERT
1774418537.822	Conduct a detailed analysis of the VM's memory management mechanism, including any potential misconfigurations or bugs that might be leading to improper execution. Modify identified configurations and ensure proper subsystem collaboration to improve memory management efficiency.	60	0	REVERT
1774418602.671	Conduct a detailed analysis of the VM's inter-subsystem communication mechanism, including any potential misconfigurations or bugs that might be leading to improper execution. Modify identified configurations and ensure proper subsystem collaboration to improve inter-subsystem communication efficiency.	60	0	REVERT
1774418667.532	Conduct a detailed analysis of the VM's system call handling mechanism, including any potential misconfigurations or bugs that might be leading to improper execution. Modify identified configurations and ensure proper subsystem collaboration to improve system call handling efficiency.	60	0	REVERT
1774418732.177	Conduct a detailed analysis of the VM's concurrency mechanism, including any potential misconfigurations or bugs that might be leading to improper execution. Modify identified configurations and ensure proper subsystem collaboration to improve concurrency efficiency.	60	0	REVERT
1774418796.842	Conduct a detailed analysis of the VM's task scheduling mechanism, including any potential misconfigurations or bugs that might be leading to improper execution. Modify identified configurations and ensure proper subsystem collaboration to improve task scheduling efficiency.	60	0	REVERT
1774418861.62	Conduct a detailed analysis of the VM's cache mechanism, including any potential misconfigurations or bugs that might be leading to improper execution. Modify identified configurations and ensure proper subsystem collaboration to improve cache efficiency and coherence.	60	0	REVERT
1774418926.648	Conduct a detailed analysis of the VM's resource allocation and contention handling mechanism, including any potential misconfigurations or bugs that might be leading to improper execution. Modify identified configurations and ensure proper subsystem collaboration to improve resource management efficiency and contention resolution.	60	0	REVERT
1774418991.467	Conduct a detailed analysis of the VM's file system mechanism, including any potential misconfigurations or bugs that might be leading to improper execution. Modify identified configurations and ensure proper subsystem collaboration to improve file system efficiency.	60	0	REVERT
1774419056.428	Conduct a detailed analysis of the VM's inter-subsystem communication mechanism, including any potential misconfigurations or bugs that might be leading to improper execution. Modify identified configurations and ensure proper subsystem collaboration to improve inter-subsystem communication efficiency.	60	0	REVERT
1774419121.068	Conduct a detailed analysis of the VM's system call mechanism, including any potential misconfigurations or bugs that might be leading to improper execution. Modify identified configurations and ensure proper subsystem collaboration to improve system call handling efficiency.	60	0	REVERT
1774419185.796	Conduct a detailed analysis of the VM's interrupt handling mechanism, including any potential misconfigurations or bugs that might be leading to improper execution. Modify identified configurations and ensure proper subsystem collaboration to improve interrupt handling efficiency.	60	0	REVERT
1774419250.477	Conduct a detailed analysis of the VM's task scheduling mechanism, including any potential misconfigurations or bugs that might be leading to improper execution. Modify identified configurations and ensure proper subsystem collaboration to improve task scheduling efficiency.	60	0	REVERT
1774419315.29	Conduct a detailed analysis of the VM's resource allocation mechanism, including any potential misconfigurations or bugs that might be leading to improper execution. Modify identified configurations and ensure proper subsystem collaboration to improve resource allocation efficiency.	60	0	REVERT
1774419380.087	Conduct a detailed analysis of the VM's memory management mechanism, including any potential misconfigurations or bugs that might be leading to improper execution. Modify identified configurations and ensure proper subsystem collaboration to improve memory management efficiency.	60	0	REVERT
1774419444.997	Conduct a detailed analysis of the VM's inter-subsystem communication mechanism, including any potential misconfigurations or bugs that might be leading to improper execution. Modify identified configurations and ensure proper subsystem collaboration to improve inter-subsystem communication efficiency.	60	0	REVERT
1774419509.646	Conduct a detailed analysis of the VM's file system mechanism, including any potential misconfigurations or bugs that might be leading to improper execution. Modify identified configurations and ensure proper subsystem collaboration to improve file system efficiency.	60	0	REVERT
1774419574.433	Conduct a detailed analysis of the VM's interrupt handling mechanism, including any potential misconfigurations or bugs that might be leading to improper execution. Modify identified configurations and ensure proper subsystem collaboration to improve interrupt handling efficiency.	60	0	REVERT
1774419639.332	Conduct a detailed analysis of the VM's task scheduling mechanism, including any potential misconfigurations or bugs that might be leading to improper execution. Modify identified configurations and ensure proper subsystem collaboration to improve task scheduling efficiency.	60	0	REVERT
1774419704.169	Conduct a detailed analysis of the VM's resource allocation and contention mechanism, including any potential misconfigurations or bugs that might be leading to improper execution. Modify identified configurations and ensure proper subsystem collaboration to improve resource management efficiency.	60	0	REVERT
1774419768.938	Conduct a detailed analysis of the VM's inter-subsystem interaction mechanisms, including any potential misconfigurations or bugs that might be leading to improper execution. Modify identified configurations and ensure proper subsystem collaboration to improve inter-subsystem interaction efficiency.	60	0	REVERT
1774419833.262	Conduct a detailed analysis of the VM's memory management mechanism, focusing on cache policies and page replacement algorithms. Modify identified configurations and ensure proper subsystem collaboration to improve memory management efficiency.	60	0	REVERT
1774419898.126	Conduct a detailed analysis of the VM's system call handling mechanism, including any potential misconfigurations or bugs that might be leading to improper execution. Modify identified configurations and ensure proper subsystem collaboration to improve system call efficiency.	60	0	REVERT
1774419962.685	Conduct a detailed analysis of the VM's cache coherence mechanism, including any potential misconfigurations or bugs that might be leading to improper execution. Modify identified configurations and ensure proper subsystem collaboration to improve cache coherence efficiency.	60	0	REVERT
1774420027.471	Conduct a detailed analysis of the VM's task scheduling and thread synchronization mechanism, including any potential misconfigurations or bugs that might be leading to improper execution. Modify identified configurations and ensure proper subsystem collaboration to improve task scheduling and thread synchronization efficiency.	60	0	REVERT
1774420091.969	Conduct a detailed analysis of the VM's resource allocation mechanism, focusing on any potential misconfigurations or bugs that might be leading to improper execution. Modify identified configurations and ensure proper subsystem collaboration to improve resource allocation efficiency.	60	0	REVERT
1774420156.141	Conduct a detailed analysis of the VM's interrupt handling mechanism, including any potential misconfigurations or bugs that might be leading to improper execution. Modify identified configurations and ensure proper subsystem collaboration to improve interrupt handling efficiency.	60	0	REVERT
1774420220.705	Conduct a detailed analysis of the VM's inter-subsystem communication and coordination mechanism, including any potential misconfigurations or bugs that might be leading to improper execution. Modify identified configurations and ensure proper subsystem collaboration to improve inter-subsystem communication and coordination efficiency.	60	0	REVERT
1774420285.381	Conduct a detailed analysis of the VM's memory management mechanism, including any potential misconfigurations or bugs that might be leading to improper execution. Modify identified configurations and ensure proper subsystem collaboration to improve memory management efficiency.	60	0	REVERT
1774420350.059	Conduct a detailed analysis of the VM's system call handling mechanism, including any potential misconfigurations or bugs that might be leading to improper execution. Modify identified configurations and ensure proper subsystem collaboration to improve system call handling efficiency.	60	0	REVERT
1774420414.811	Conduct a detailed analysis of the VM's context switching and process management mechanism, including any potential misconfigurations or bugs that might be leading to improper execution. Modify identified configurations and ensure proper subsystem collaboration to improve context switching and process management efficiency.	60	0	REVERT
1774420479.536	Conduct a detailed analysis of the VM's concurrency and parallelism mechanism, including any potential misconfigurations or bugs that might be leading to improper execution. Modify identified configurations and ensure proper subsystem collaboration to improve concurrency and parallelism efficiency.	60	0	REVERT
1774420543.675	Conduct a detailed analysis of the VM's inter-subsystem communication and coordination mechanism, identify any potential misconfigurations or bugs, and modify configurations to ensure proper subsystem collaboration. Investigate and optimize the efficiency of these mechanisms.	60	0	REVERT
1774420607.928	Conduct a detailed analysis of the VM's synchronization mechanism, including any potential misconfigurations or bugs that might be leading to improper execution. Modify identified configurations and ensure proper subsystem collaboration to improve synchronization efficiency.	60	0	REVERT
1774420672.904	Conduct a detailed analysis of the VM's error handling and recovery mechanism, including any potential misconfigurations or bugs that might be leading to improper execution. Modify identified configurations and ensure proper subsystem collaboration to improve error handling and recovery efficiency.	60	0	REVERT
1774420737.575	Conduct a detailed analysis of the VM's task scheduling mechanism, including any potential misconfigurations or bugs that might be leading to improper execution. Modify identified configurations and ensure proper subsystem collaboration to improve task scheduling efficiency.	60	0	REVERT
1774420802.705	Conduct a detailed analysis of the VM's resource allocation and management mechanism, including any potential misconfigurations or bugs that might be leading to improper execution. Modify identified configurations and ensure proper subsystem collaboration to improve resource allocation and management efficiency.	60	0	REVERT
1774420867.504	Conduct a detailed analysis of the VM's interrupt handling mechanism, including any potential misconfigurations or bugs that might be leading to improper execution. Modify identified configurations and ensure proper subsystem collaboration to improve interrupt handling efficiency.	60	0	REVERT
1774420932.519	Conduct a detailed analysis of the VM's inter-subsystem communication mechanism, including any potential misconfigurations or bugs that might be leading to improper execution. Modify identified configurations and ensure proper subsystem collaboration to improve inter-subsystem communication efficiency.	60	0	REVERT
1774420997.36	Conduct a detailed analysis of the VM's system call handling mechanism, including any potential misconfigurations or bugs that might be leading to improper execution. Modify identified configurations and ensure proper subsystem collaboration to improve system call handling efficiency.	60	0	REVERT
1774421062.227	Conduct a detailed analysis of the VM's context switching mechanism, including any potential misconfigurations or bugs that might be leading to improper execution. Modify identified configurations and ensure proper subsystem collaboration to improve context switching efficiency.	60	0	REVERT
1774421127.21	Conduct a detailed analysis of the VM's process management mechanism, including any potential misconfigurations or bugs that might be leading to improper execution. Modify identified configurations and ensure proper subsystem collaboration to improve process management efficiency.	60	0	REVERT
1774421192.008	Conduct a detailed analysis of the VM's memory management mechanism, including any potential misconfigurations or bugs that might be leading to improper execution. Modify identified configurations and ensure proper subsystem collaboration to improve memory management efficiency.	60	0	REVERT
1774421256.766	Conduct a detailed analysis of the VM's task scheduling mechanism, including any potential misconfigurations or bugs that might be leading to improper execution. Modify identified configurations and ensure proper subsystem collaboration to improve task scheduling efficiency.	60	0	REVERT
1774421321.668	Conduct a detailed analysis of the VM's inter-subsystem communication mechanism, including any potential misconfigurations or bugs that might be leading to improper execution. Modify identified configurations and ensure proper subsystem collaboration to improve inter-subsystem communication efficiency.	60	0	REVERT
1774421386.699	Conduct a detailed analysis of the VM's system call handling mechanism, including any potential misconfigurations or bugs that might be leading to improper execution. Modify identified configurations and ensure proper subsystem collaboration to improve system call handling efficiency.	60	0	REVERT
1774421451.711	Conduct a detailed analysis of the VM's context switching mechanism, including any potential misconfigurations or bugs that might be leading to improper execution. Modify identified configurations and ensure proper subsystem collaboration to improve context switching efficiency.	60	0	REVERT
1774421516.584	Conduct a detailed analysis of the VM's process management mechanism, including any potential misconfigurations or bugs that might be leading to improper execution. Modify identified configurations and ensure proper subsystem collaboration to improve process management efficiency.	60	0	REVERT
1774421581.35	Conduct a detailed analysis of the VM's resource allocation mechanism, including any potential misconfigurations or bugs that might be leading to improper execution. Modify identified configurations and ensure proper subsystem collaboration to improve resource allocation efficiency.	60	0	REVERT
1774421646.087	Conduct a detailed analysis of the VM's error handling mechanism, including any potential misconfigurations or bugs that might be leading to improper execution. Modify identified configurations and ensure proper subsystem collaboration to improve error handling efficiency.	60	0	REVERT
1774421710.694	Conduct a detailed analysis of the VM's task scheduling mechanism, including any potential misconfigurations or bugs that might be leading to improper execution. Modify identified configurations and ensure proper subsystem collaboration to improve task scheduling efficiency.	60	0	REVERT
1774421775.674	Conduct a detailed analysis of the VM's thread synchronization mechanism, including any potential misconfigurations or bugs that might be leading to improper execution. Modify identified configurations and ensure proper subsystem collaboration to improve thread synchronization efficiency.	60	0	REVERT
1774421840.667	Conduct a detailed analysis of the VM's system call handling mechanism, including any potential misconfigurations or bugs that might be leading to improper execution. Modify identified configurations and ensure proper subsystem collaboration to improve system call handling efficiency.	60	0	REVERT
1774421905.496	Conduct a detailed analysis of the VM's memory management mechanism, including any potential misconfigurations or bugs that might be leading to improper execution. Modify identified configurations and ensure proper subsystem collaboration to improve memory management efficiency.	60	0	REVERT
1774421970.354	Conduct a detailed analysis of the VM's concurrency mechanism, including any potential misconfigurations or bugs that might be leading to improper execution. Modify identified configurations and ensure proper subsystem collaboration to improve concurrency efficiency.	60	0	REVERT
1774422035.362	Conduct a detailed analysis of the VM's inter-subsystem communication mechanism, including any potential misconfigurations or bugs that might be leading to improper execution. Modify identified configurations and ensure proper subsystem collaboration to improve communication efficiency.	60	0	REVERT
1774422100.523	Conduct a detailed analysis of the VM's subsystem initialization and shutdown sequence. Identify any potential misconfigurations or bugs that might be leading to improper execution. Modify identified configurations and ensure proper subsystem collaboration during initialization and shutdown sequences to improve performance.	60	0	REVERT
1774422165.738	Conduct a detailed analysis of the VM's architecture, focusing on how subsystems interact with each other at a lower level. Identify any potential misconfigurations or bugs in inter-subsystem communication protocols that might be leading to improper execution. Modify identified configurations and ensure proper subsystem collaboration to improve architectural interactions.	60	0	REVERT
