timestamp	hypothesis	baseline	metric	status
1774435398.892	Conduct a comprehensive analysis of the VM's inter-component communication and file system operations. Identify any potential misconfigurations, inefficiencies, or bottlenecks that might be causing improper execution and modify them to ensure proper handling of these mechanisms to improve performance.	60	0	REVERT
1774435463.268	Modify the file system operations to implement parallel processing for concurrent read and write requests. This should help in reducing the time spent on waiting for disk I/O operations to complete, thus improving performance.	60	0	REVERT
1774435528.213	Conduct a comprehensive analysis of the VM's inter-component communication and file system operations. Identify any potential misconfigurations, inefficiencies, or bottlenecks that might be causing improper execution and modify them to ensure proper handling of these mechanisms to improve performance.	60	0	REVERT
1774435592.643	Conduct a comprehensive analysis of the VM's inter-component communication and file system operations. Identify any potential misconfigurations, inefficiencies, or bottlenecks that might be causing improper execution and modify them to ensure proper handling of these mechanisms to improve performance.	60	0	REVERT
1774435657.75	Conduct a comprehensive analysis of the VM's inter-component communication and file system operations. Identify any potential misconfigurations, inefficiencies, or bottlenecks that might be causing improper execution and modify them to ensure proper handling of these mechanisms to improve performance.	60	0	REVERT
1774435721.858	Add caching mechanisms to the file system operations. This should help in reducing the time spent on reading frequently accessed files from disk, thus improving performance.	60	0	REVERT
1774435785.783	Refactor the memory management code to simplify complex operations and reduce overhead. This should help in optimizing how resources are accessed and freed, thus improving performance.	60	0	REVERT
1774435849.94	Implement parallel processing for certain critical operations within the VM. This should help in speeding up the execution time by allowing multiple tasks to run concurrently.	60	0	REVERT
1774435914.382	Conduct a comprehensive analysis of the VM's inter-component communication and file system operations. Identify any potential misconfigurations, inefficiencies, or bottlenecks that might be causing improper execution and modify them to ensure proper handling of these mechanisms to improve performance.	60	0	REVERT
1774435977.896	Optimize the data structures used within the VM to reduce memory usage. This should help in reducing the time spent on accessing and managing resources, thus improving performance.	60	0	REVERT
1774436042.787	Conduct an experiment that combines caching mechanisms for frequently accessed files with simplified memory management. This should help in reducing the time spent on reading frequently accessed files from disk, while also optimizing how resources are accessed and freed.	60	0	REVERT
1774436106.241	Implement a more sophisticated scheduler within the VM that prioritizes tasks based on their importance and urgency, ensuring efficient resource allocation and minimizing delays.	60	0	REVERT
1774436170.63	Implement an advanced caching mechanism specifically tailored to the VM's file access patterns. This should help in reducing the time spent on reading frequently accessed files from disk, thereby improving performance.	60	0	REVERT
1774436234.428	Implement parallel processing capabilities within the VM's file system operations and other concurrent task handling mechanisms. This should help in reducing the total execution time by allowing multiple tasks to run simultaneously.	60	0	REVERT
1774436298.682	Implement an optimized memory allocation and deallocation mechanism within the VM to ensure efficient use of resources. This should help in reducing delays and improving performance during concurrent operations.	60	0	REVERT
1774436363.295	Implement a more coherent and synchronized coordination mechanism among different components of the VM, including file system operations and memory management. This should help in reducing inter-component communication delays by ensuring that these components work together efficiently.	60	0	REVERT
1774436428.019	Simplify the code paths for file system operations, focusing on removing redundant checks and optimizing critical sections of the code. This should help in reducing complexity and improving performance during concurrent file access operations.	60	0	REVERT
1774436492.265	Optimize data structures and algorithms used in the virtual machine to reduce memory usage. This should help in improving overall performance by minimizing resource consumption during concurrent operations.	60	0	REVERT
1774436556.07	Implement a caching mechanism within the VM's file system to cache frequently accessed files in memory. This should help in improving overall performance by reducing redundant disk accesses and memory usage.	60	0	REVERT
1774436620.32	Implement parallel processing capabilities for specific operations within the VM, such as file access and memory management. This should help in improving overall performance by utilizing multiple CPU cores effectively.	60	0	REVERT
1774436685.582	Implement a caching mechanism combined with parallel processing capabilities for specific operations within the VM, such as file access and memory management. This should help in improving overall performance by reducing redundant disk accesses and efficiently utilizing multiple CPU cores.	60	0	REVERT
1774436749.984	Implement an optimized scheduling algorithm within the VM that takes into account task priorities, resource availability, and system load. This should help in improving overall performance by ensuring fair and efficient resource allocation across multiple tasks.	60	0	REVERT
1774436816.044	Simplify the code paths within the virtual machine to remove unnecessary complexity. This should help in improving overall performance by reducing resource consumption and increasing efficiency.	60	0	REVERT
1774436879.636	Optimize data structures within the virtual machine to reduce memory usage. This should help in improving overall performance by minimizing resource consumption and increasing efficiency.	60	0	REVERT
1774436944.145	Implement mutex synchronization around shared resources accessed by multiple threads within the VM. This should help in improving overall performance by preventing race conditions and ensuring thread safety.	60	0	REVERT
1774437008.378	Implement a caching mechanism combined with parallel processing capabilities for specific operations within the VM, such as file access and memory management. This should help in improving overall performance by reducing redundant disk accesses and efficiently utilizing multiple CPU cores.	60	0	REVERT
1774437072.668	Optimize memory allocation and layout within the virtual machine to reduce cache misses. This should help in improving overall performance by reducing latency and increasing CPU utilization.	60	0	REVERT
1774437136.395	Implement parallel processing capabilities for specific operations within the VM, such as file access and memory management. This should help in improving overall performance by efficiently utilizing available CPU resources.	60	0	REVERT
1774437201.539	Simplify code paths for specific operations within the VM, such as file access and memory management. This should help in improving overall performance by reducing complexity and improving efficiency.	60	0	REVERT
1774437266.318	Optimize data structures and remove unnecessary variables within the file system access routines and memory management code to reduce memory usage. This should help in improving overall performance by reducing resource consumption and potentially freeing up more CPU cycles for other tasks.	60	0	REVERT
1774437330.599	Implement an improved memory allocation algorithm, such as a hybrid of best-fit and first-fit strategies, within the file system access routines to manage virtual memory pages more efficiently. This should help in improving overall performance by reducing fragmentation and optimizing resource utilization.	60	0	REVERT
1774437395.727	Implement caching mechanisms for frequently accessed data within the virtual machine. This should help in improving overall performance by reducing disk I/O and memory access times.	60	0	REVERT
1774437460.243	Implement a refined scheduler for the VM that prioritizes critical tasks and improves task scheduling. This should help in improving overall performance by ensuring that high-priority tasks are executed efficiently.	60	0	REVERT
1774437524.151	Implement parallel processing mechanisms for memory management operations within the file system access routines. This should help in improving overall performance by reducing latency and potentially freeing up more CPU cycles for other tasks.	60	0	REVERT
1774437588.902	Optimize the file system's access routines to reduce contention and improve data locality. This should help in improving overall performance by reducing latency and potentially freeing up more CPU cycles for other tasks.	60	0	REVERT
1774437653.144	Optimize existing data structures and algorithms used in the virtual machine to reduce memory usage. This should help in improving overall performance by freeing up more resources for other tasks.	60	0	REVERT
1774437685.062	Remove the duplicate function body and fix the incomplete first implementation by consolidating into the correct multi-line layout version. This will fix the GPU OFFLINE status caused by shader compilation errors.	5	1	KEEP
1774437717.289	Replace the current memory allocator with a more sophisticated one that implements techniques such as buddy allocation or slab allocation. This should help in reducing memory fragmentation and improving overall VM performance by providing more efficient access to resources.	60	0	REVERT
1774437721.602	Fixing the function signature to properly declare all parameters (row, col, width) and the return type (vec3<u32>) will restore INPUT ZONE text rendering, enabling the vision model to extract user commands from rows 450-479.	5	1	KEEP
1774437781.926	Implement a caching mechanism within the file system that stores recently accessed files in memory. This should help in improving overall performance by reducing latency associated with disk I/O operations.	60	0	REVERT
1774437803.392	Adding boundary marker rendering before the row range check will enable cyan lines at rows 449 and 480, giving qwen3-vl-8b clear visual anchors for 100% accurate INPUT ZONE extraction.	5	1	KEEP
1774437846.168	Implement parallel processing mechanisms for memory management operations within the file system access routines and introduce a caching mechanism to store recently accessed files in memory. This should help in improving overall performance by reducing latency associated with disk I/O operations and concurrently managing memory resources.	60	0	REVERT
1774437910.923	Replace the current task scheduling algorithm with a more sophisticated one, such as Shortest Job First (SJF) or Round Robin (RR), to optimize resource allocation. This should help in improving overall performance by reducing contention and ensuring efficient use of resources during concurrent operations.	60	0	REVERT
1774437975.739	Refactor the VM's codebase to simplify complex code paths, particularly in memory management, file system operations, and task scheduling. This should help in improving overall performance by reducing complexity and overhead associated with managing resources during concurrent operations.	60	0	REVERT
1774438039.748	Implement an automated garbage collection mechanism that detects and cleans up unused memory allocations. This should help in improving overall performance by reducing manual intervention and potential errors in resource management during concurrent operations.	60	0	REVERT
1774438065.846	Optimize the text rendering function by reducing redundant calculations and simplifying conditional logic. This should improve performance without compromising functionality.	5	1	KEEP
1774438103.931	Implement an LRU-based caching mechanism within the file system. This should help in improving overall performance by efficiently managing memory and reducing disk I/O latency associated with frequently accessed files.	60	0	REVERT
1774438168.482	Refactor the VM's data structures, particularly those used in memory management, file system operations, and task scheduling, to optimize space usage and access times. This should help in improving overall performance by reducing overhead and making resource management more efficient during concurrent operations.	60	0	REVERT
1774438217.202	Simplify the text rendering logic by removing redundant checks and optimizing the font rendering process.	5	1	KEEP
1774438232.747	Modify the VM's execution model to support parallel processing, particularly for file system operations and task scheduling. This should help in improving overall performance by allowing multiple tasks to run concurrently on different CPU cores, thereby reducing contention and increasing efficiency.	60	0	REVERT
1774438297.138	Refactor the VM's synchronization mechanisms, particularly those used in memory management, file system operations, and task scheduling, to optimize contention reduction and improve resource management during concurrent operations. This should help in improving overall performance by reducing overhead associated with managing resources during concurrent operations.	60	0	REVERT
1774438361.122	Refactor the VM's execution model, simplifying complex code paths and removing unnecessary abstractions. This should help in improving overall performance by reducing overhead associated with managing resources during concurrent operations.	60	0	REVERT
1774438425.972	Implement an LRU-based caching mechanism within the file system and modify the VM's execution model to support parallel processing, particularly for file system operations and task scheduling. This should help in improving overall performance by efficiently managing memory and reducing disk I/O latency while allowing multiple tasks to run concurrently on different CPU cores.	60	0	REVERT
1774438462.814	Consolidate the duplicate input zone rendering logic into a single coherent function that: (1) renders boundary markers first, (2) handles multi-line text layout properly, (3) maintains OCR-optimized contrast for qwen3-vl-8b extraction accuracy.	5	1	KEEP
1774438490.236	Refactor the VM's garbage collection mechanism, optimizing it to minimize pause times and improve resource utilization. This should help in improving overall performance by reducing overhead associated with managing resources during concurrent operations.	60	0	REVERT
1774438554.357	Optimize data structures used within the VM's execution model, particularly those related to file system operations and memory management. This should help in improving overall performance by reducing memory usage and making better use of available resources.	60	0	REVERT
1774438572.383	Complete the 5x7 bitmap font definitions for digits 1-9 to restore shader compilation and enable OCR-accurate numeric rendering in the INPUT ZONE.	5	1	KEEP
1774438618.695	Refactor the VM to include a JIT compiler that optimizes machine code at runtime. This should help in improving overall performance by reducing the overhead of interpreting and executing code directly from memory, making better use of CPU cycles during concurrent operations.	60	0	REVERT
1774438682.839	Refactor the VM's execution model, parallelizing operations to better distribute workload across multiple CPU cores. This should help in improving overall performance by reducing bottlenecks during concurrent operations.	60	0	REVERT
1774438746.837	Refactor the file system's concurrency control mechanism, implementing techniques such as fine-grained locks or reader-writer locks to reduce contention and improve scalability. This should help in improving overall performance by allowing more concurrent access operations without causing bottlenecks.	60	0	REVERT
1774438811.098	Refactor the VM's file system to include a caching mechanism for frequently accessed files. This should help in improving overall performance by reducing the number of disk I/O operations and making better use of available resources during concurrent access.	60	0	REVERT
1774438868.509	Simplify the text rendering logic and optimize the OCR extraction process to improve overall performance.	5	1	KEEP
1774438874.988	Refactor the VM's execution model, optimizing data structures used within it. Additionally, implement a caching mechanism for frequently accessed files. This should help in improving overall performance by reducing both memory usage and disk I/O operations.	60	0	REVERT
1774438938.991	Refactor the VM to include a thread pool for managing concurrent tasks. This should help in improving overall performance by reducing contention and making better use of CPU resources during high load demands.	60	0	REVERT
1774438998.228	Remove the broken stub body (which uses undefined variables) to allow the proper multi-line text rendering implementation with correctly defined line_index, char_row, and input_len to execute. This will restore text rendering for vision model OCR extraction.	5	1	KEEP
1774439003.117	Refactor the VM's execution model and file system code to use more memory-efficient data structures and algorithms. This should help in improving overall performance by reducing memory usage and making better use of available resources during concurrent access.	60	0	REVERT
1774439161.119	Increasing boundary marker thickness to 2 pixels and adding 4x4 corner brackets will significantly improve vision model detection accuracy while maintaining the 60 FPS render budget. Corner markers provide precise alignment points for OCR region extraction.	5	1	KEEP
1774439358.45	Simplify the `render_input_zone_text` function by removing redundant checks and optimizing boundary conditions.	5	1	KEEP
1774439439.634	Remove the incomplete first function definition that references 'line_index' and 'char_row' before declaration. Keep only the complete second implementation with proper multi-line layout (3 lines with gaps) and variable initialization.	5	1	KEEP
1774439819.847	Complete the 5x7 bitmap font function with proper ASCII character support (0-9, A-Z, operators +,-,*,/,=,@,_, space) to enable text rendering in INPUT ZONE rows 450-479 for qwen3-vl-8b OCR extraction.	5	1	KEEP
1774440103.836	We need to optimize the text rendering function by reducing redundant calculations and improving boundary check efficiency. Additionally, we should ensure that the font lookup is as fast as possible.	5	1	KEEP
1774441293.182	Move the boundary marker check to the START of render_input_zone_text and remove the orphaned duplicate code block to ensure cyan OCR alignment markers render correctly for qwen3-vl-8b vision model extraction.	5	1	KEEP
1774441408.121	Removing the duplicate orphaned code block will allow the shader to compile. The first complete render_input_zone_text function is valid - the second orphaned block is dead code causing parse failures.	5	1	KEEP
1774441503.63	Reduce corner bracket height from 4 pixels to 2 pixels, strictly aligned to the 2-pixel boundary lines (448-449 and 480-481). This ensures corners frame the INPUT ZONE without overlapping any text rows, improving OCR extraction accuracy for qwen3-vl-8b.	5	1	KEEP
1774441659.518	Add 2-pixel thick vertical edge markers along the left and right boundaries spanning the full INPUT ZONE (rows 450-479) to create a complete rectangular frame. This improves OCR alignment and extraction accuracy.	5	1	KEEP
1774441795.974	Complete the truncated render_patch_status function to enable proper patch feedback display, ensuring the host-to-GPU atomic memory patching confirmation is visible to users.	5	1	KEEP
1774441862.141	Completing the truncated render_patch_status function and adding a visible 'INPUT:' prefix label in the INPUT ZONE will restore GPU shader compilation and improve qwen3-vl-8b OCR extraction accuracy by providing clear visual context markers.	5	0	REVERT
1774442033.816	Completing the truncated render_patch_status function with proper vec3 return statements and closing brace will fix the syntax error, allowing the shader to compile and enabling the natural language input pipeline to function.	5	1	KEEP
1774442178.689	Complete the render_patch_status function to enable proper PATCH_SUCCESS/PATCH_FAILED visual feedback. Also add clear INPUT ZONE label rendering for improved OCR targeting by qwen3-vl-8b.	5	1	KEEP
1774442275.75	Completing the render_patch_status function will restore GPU shader compilation, enabling the PATCH_STATUS display (rows 475-479) to show green SUCCESS or red FAILED messages after the LLM generates opcodes and host patches memory atomically.	5	1	KEEP
1774442420.006	Completing the render_patch_status function will enable proper visual feedback for the vision-to-opcode patching loop, allowing users to see PATCH_SUCCESS/PATCH_FAILED status and completing the natural language control interface.	5	1	KEEP
1774442471.458	Completing the render_patch_status function will enable the host-to-GPU patch confirmation display, closing the natural language control loop. The red failure case and default background return are missing.	5	1	KEEP
1774442687.088	We need to add a pipeline that converts user input from English commands into valid VM opcodes using an LLM (tinyllama), and then update the agent's memory atomically based on these opcodes. This will involve integrating the OCR extraction, opcode generation, and memory patching logic.	5	1	KEEP
