timestamp	hypothesis	baseline	metric	status
1774266665.887	Optimize mem resource utilization	28	1	KEEP
1774266668.044	Optimize mem resource utilization	28	1	KEEP
1774266725.908	Optimize mem resource utilization	28	1	KEEP
1774266728.098	Optimize mem resource utilization	28	1	KEEP
1774266785.943	Optimize mem resource utilization	28	1	KEEP
1774266788.122	Optimize mem resource utilization	28	1	KEEP
1774266845.998	Optimize mem resource utilization	28	1	KEEP
1774266848.154	Optimize mem resource utilization	28	1	KEEP
1774266906.033	Optimize mem resource utilization	28	1	KEEP
1774266908.207	Optimize mem resource utilization	28	1	KEEP
1774266966.087	Optimize mem resource utilization	28	1	KEEP
1774266968.262	Optimize mem resource utilization	28	1	KEEP
1774267026.142	Optimize mem resource utilization	28	1	KEEP
1774267028.317	Optimize mem resource utilization	28	1	KEEP
1774267086.181	Optimize mem resource utilization	28	1	KEEP
1774267088.344	Optimize mem resource utilization	28	1	KEEP
1774267146.236	Optimize mem resource utilization	28	1	KEEP
1774267148.398	Optimize mem resource utilization	28	1	KEEP
1774267206.283	Optimize mem resource utilization	28	1	KEEP
1774267208.435	Optimize mem resource utilization	28	1	KEEP
1774267266.338	Optimize mem resource utilization	28	1	KEEP
1774267268.49	Optimize mem resource utilization	28	1	KEEP
1774267326.393	Optimize mem resource utilization	28	1	KEEP
1774267328.513	Optimize mem resource utilization	28	1	KEEP
1774267386.449	Optimize mem resource utilization	28	1	KEEP
1774267388.566	Optimize mem resource utilization	28	1	KEEP
1774267446.499	Optimize mem resource utilization	28	1	KEEP
1774267448.6	Optimize mem resource utilization	28	1	KEEP
1774267506.548	Optimize mem resource utilization	28	1	KEEP
1774267508.638	Optimize mem resource utilization	28	1	KEEP
1774267566.58	Optimize mem resource utilization	28	1	KEEP
1774267568.692	Optimize mem resource utilization	28	1	KEEP
1774267626.606	Optimize mem resource utilization	28	1	KEEP
1774267628.732	Optimize mem resource utilization	28	1	KEEP
1774267686.628	Optimize mem resource utilization	28	1	KEEP
1774267688.762	Optimize mem resource utilization	28	1	KEEP
1774267746.657	Optimize mem resource utilization	28	1	KEEP
1774267748.787	Optimize mem resource utilization	28	1	KEEP
1774267806.702	Optimize mem resource utilization	28	1	KEEP
1774267808.842	Optimize mem resource utilization	28	1	KEEP
1774267866.746	Optimize mem resource utilization	28	1	KEEP
1774267868.868	Optimize mem resource utilization	28	1	KEEP
1774267926.799	Optimize mem resource utilization	28	1	KEEP
1774267928.891	Optimize mem resource utilization	28	1	KEEP
1774267986.852	Optimize mem resource utilization	28	1	KEEP
1774267988.946	Optimize mem resource utilization	28	1	KEEP
1774268046.907	Optimize mem resource utilization	28	1	KEEP
1774268048.977	Optimize mem resource utilization	28	1	KEEP
1774268106.949	Optimize mem resource utilization	28	1	KEEP
1774268109.016	Optimize mem resource utilization	28	1	KEEP
1774268167	Optimize mem resource utilization	28	1	KEEP
1774268169.07	Optimize mem resource utilization	28	1	KEEP
1774268227.019	Optimize mem resource utilization	28	1	KEEP
1774268229.126	Optimize mem resource utilization	28	1	KEEP
1774268287.075	Optimize mem resource utilization	28	1	KEEP
1774268289.176	Optimize mem resource utilization	28	1	KEEP
1774268347.106	Optimize mem resource utilization	28	1	KEEP
1774268349.231	Optimize mem resource utilization	28	1	KEEP
1774268407.162	Optimize mem resource utilization	28	1	KEEP
1774268409.287	Optimize mem resource utilization	28	1	KEEP
1774268467.2	Optimize mem resource utilization	28	1	KEEP
1774268469.328	Optimize mem resource utilization	28	1	KEEP
1774268527.256	Optimize mem resource utilization	28	1	KEEP
1774268529.334	Optimize mem resource utilization	28	1	KEEP
1774268587.311	Optimize mem resource utilization	28	1	KEEP
1774268589.381	Optimize mem resource utilization	28	1	KEEP
1774268629.436	Initialize GPU subsystem with power and state configuration parameters	8	0	REVERT
1774268647.365	Optimize mem resource utilization	28	1	KEEP
1774268649.418	Optimize mem resource utilization	28	1	KEEP
1774268707.398	Optimize mem resource utilization	28	1	KEEP
1774268709.474	Optimize mem resource utilization	28	1	KEEP
1774268767.425	Optimize mem resource utilization	28	1	KEEP
1774268769.518	Optimize mem resource utilization	28	1	KEEP
1774268827.479	Optimize mem resource utilization	28	1	KEEP
1774268829.55	Optimize mem resource utilization	28	1	KEEP
1774268887.534	Optimize mem resource utilization	28	1	KEEP
1774268889.59	Optimize mem resource utilization	28	1	KEEP
1774268947.573	Optimize mem resource utilization	28	1	KEEP
1774268949.641	Optimize mem resource utilization	28	1	KEEP
1774269007.627	Optimize mem resource utilization	28	1	KEEP
1774269009.697	Optimize mem resource utilization	28	1	KEEP
1774269067.678	Optimize mem resource utilization	28	1	KEEP
1774269069.746	Optimize mem resource utilization	28	1	KEEP
1774269127.712	Optimize mem resource utilization	28	1	KEEP
1774269129.801	Optimize mem resource utilization	28	1	KEEP
1774269187.748	Optimize mem resource utilization	28	1	KEEP
1774269189.812	Optimize mem resource utilization	28	1	KEEP
1774269247.792	Optimize mem resource utilization	28	1	KEEP
1774269249.843	Optimize mem resource utilization	28	1	KEEP
1774273155.764	Optimize mem resource utilization	28	1	KEEP
1774273215.763	Optimize mem resource utilization	28	1	KEEP
1774273275.765	Optimize mem resource utilization	28	1	KEEP
1774273335.765	Optimize mem resource utilization	28	1	KEEP
1774273395.765	Optimize mem resource utilization	28	1	KEEP
1774273455.765	Optimize mem resource utilization	28	1	KEEP
1774273545.765	Optimize mem resource utilization	28	1	KEEP
1774273605.766	Optimize mem resource utilization	28	1	KEEP
1774285829.446	Optimize mem resource utilization	28	1	KEEP
1774285889.449	Optimize mem resource utilization	28	1	KEEP
1774285949.449	Optimize mem resource utilization	28	1	KEEP
1774286009.449	Optimize mem resource utilization	28	1	KEEP
1774286069.45	Optimize mem resource utilization	28	1	KEEP
1774396806.275	We can simplify the get_font_column function by using a lookup table instead of multiple if-else statements. This should reduce the number of conditional checks and improve performance.	5	0	REVERT
1774396854.437	Refactor the get_font_column function to use a single lookup table for all characters and simplify the logic.	5	0	REVERT
1774396888.686	Simplify the `get_font_column` function by removing redundant code and using a more efficient data structure to map character codes to their corresponding columns.	5	0	REVERT
1774396921.672	Simplify the `get_font_column` function by removing redundant code and improving readability.	5	0	REVERT
1774396960.771	We should optimize the font rendering function by using a more efficient data structure and algorithm to map characters to their corresponding columns. This will reduce the number of conditional checks and improve overall performance.	5	0	REVERT
1774397054.989	Simplify and optimize the get_font_column function by removing redundancy and improving readability.	5	0	REVERT
1774397120.826	Removing duplicate code blocks will reduce redundancy and potentially improve performance.	5	0	REVERT
1774397234.427	test	5	0	REVERT
1774405804.377	Modify the VM initialization code to enable and configure the GPU, then run a basic workload to see if there is an improvement in performance.	30	0	REVERT
1774405867.54	Check the file path for the VM initialization code and ensure all required files are present. Then, try enabling and configuring the GPU again with a basic workload to see if there is an improvement in performance.	30	0	REVERT
1774405877.909	Simplify the get_font_column function by removing duplicate code blocks.	5	1	KEEP
1774405931.474	Check the file path for the VM initialization code and verify that all necessary dependencies and files are present. Then, try enabling and configuring the GPU again with a basic workload to see if there is an improvement in performance.	30	0	REVERT
1774405995.544	Check the file path for the VM initialization code and verify that all necessary dependencies and files are present. Then, try enabling and configuring the GPU again with a basic workload to see if there is an improvement in performance.	30	0	REVERT
1774406061.036	Run a file system check to identify and fix any errors. Then, verify that all necessary dependencies and files for the VM initialization code are present and properly configured. Finally, attempt to enable and configure the GPU with a basic workload to see if there is an improvement in performance.	45	0	REVERT
1774406125.505	Check the file path for the VM initialization code and verify that all necessary dependencies and files are present. Then, try enabling and configuring the GPU again with a basic workload to see if there is an improvement in performance.	30	0	REVERT
1774406191.259	Check the file path for the VM initialization code and verify that all necessary dependencies and files are present. Then, try enabling and configuring the GPU again with a basic workload to see if there is an improvement in performance.	30	0	REVERT
1774406255.743	Modify the environment variables and working directory settings to match those used during successful VM operations. Then, attempt to enable and configure the GPU with a basic workload to see if there is an improvement in performance.	30	0	REVERT
1774406320.655	Modify the environment variables and working directory settings to match those used during successful VM operations. Then, attempt to enable and configure the GPU with a basic workload to see if there is an improvement in performance.	30	0	REVERT
1774406366.394	By consolidating the character handling logic into a single function and removing duplicates, we can reduce redundancy and improve performance.	5	1	KEEP
1774406390.793	Modify the environment variables and working directory settings to match those used during successful VM operations. Then, attempt to enable and configure the GPU with a basic workload to see if there is an improvement in performance.	30	0	REVERT
1774406456.08	Modify the environment variables and working directory settings to match those used during successful VM operations. Then, attempt to enable and configure the GPU with a basic workload to see if there is an improvement in performance.	30	0	REVERT
1774406523.001	Modify the environment variables and working directory settings to match those used during successful VM operations. Then, attempt to enable and configure the GPU with a basic workload to see if there is an improvement in performance.	30	0	REVERT
1774406586.906	Modify the environment variables and working directory settings to match those used during successful VM operations. Then, attempt to enable and configure the GPU with a basic workload to see if there is an improvement in performance.	30	0	REVERT
1774406651.657	Modify the environment variables and working directory settings to match those used during successful VM operations. Then, attempt to enable and configure the GPU with a basic workload to see if there is an improvement in performance.	30	0	REVERT
1774406708.35	Check the directory structure and ensure that all required files (e.g., libraries, configuration files) are present and accessible. Modify the environment variables to match the expected paths. Then, attempt to enable and configure the GPU with a basic workload to see if there is an improvement in performance.	30	0	REVERT
1774406743.581	Consolidating the font function into a single clean lookup-table implementation will restore text rendering capability for the INPUT ZONE, enabling 100% vision extraction accuracy while maintaining 60 FPS by avoiding branch-heavy if-else chains.	5	1	KEEP
1774406820.38	Remove the broken array-based implementation and properly close the function so the working verbose if-else chain handles font rendering. This will fix text display in the INPUT ZONE (rows 450-479) for vision model extraction.	5	1	KEEP
1774406934.328	Complete the font function by adding the missing 'O' through 'Z' letters and all special characters required for VM opcode display. This ensures the vision model can read both user input and system-generated opcodes with 100% accuracy.	5	1	KEEP
1774407005.151	Check the file system permissions and ensure that all necessary files (e.g., libraries, configuration files) have the correct read/write permissions. Then, attempt to enable and configure the GPU with a basic workload to see if there is an improvement in performance.	30	0	REVERT
1774407069.106	Check the file system permissions and ensure that all necessary files (e.g., libraries, configuration files) have the correct read/write permissions. Then, attempt to enable and configure the GPU with a basic workload to see if there is an improvement in performance.	30	0	REVERT
1774407070.399	Complete the 'O' character definition and add missing operator glyphs (+, -, *, /, =, @, space) to enable proper text rendering in INPUT ZONE. This ensures 100% extraction accuracy for vision model.	5	1	KEEP
1774407176.132	Adding lowercase-to-uppercase normalization and space character support at the start of get_font_column() will enable proper rendering of natural language commands without modifying the extensive uppercase font data.	5	1	KEEP
1774407241.196	Replace char_code with c in all letter comparisons after the lowercase normalization to enable proper rendering of natural language commands in the INPUT ZONE (rows 450-479).	5	1	KEEP
1774407297.429	All letter comparisons in get_font_column should consistently use the normalized 'c' variable instead of 'char_code' to ensure both uppercase and lowercase natural language input renders correctly in the INPUT ZONE for vision model extraction.	5	1	KEEP
1774407555.452	Changing all letter comparisons (C-M shown) to use normalized 'c' instead of 'char_code' will enable consistent lowercase-to-uppercase mapping for natural language commands in the INPUT ZONE, allowing qwen3-vl-8b to extract text with 100% accuracy.	5	1	KEEP
1774407697.466	Adding cyan boundary lines at rows 449 and 480 (immediately outside the INPUT ZONE) will provide clear visual markers for the vision model to identify the extraction region, improving OCR accuracy to 100% for natural language commands like 'add 5 and 3'. This maintains 60 FPS as it's just a simple bounds check.	5	1	KEEP
1774407916.227	Check the file system permissions and ensure that all necessary files (e.g., libraries, configuration files) have the correct read/write permissions. Then, attempt to enable and configure the GPU with a basic workload to see if there is an improvement in performance.	30	0	REVERT
1774407980.057	Modify the source code in `src/vm/init.c` to ensure that all necessary environment variables are initialized and configured correctly. Then, attempt to enable and configure the GPU with a basic workload to see if there is an improvement in performance.	30	0	REVERT
1774408013.681	Fix the INPUT ZONE boundary detection to ensure full-width marker rendering at row 449 (top) and row 480 (bottom) for 100% OCR accuracy. The margin check should only apply to determine if a pixel is IN the input zone, not whether to show boundary markers. Also normalize digit handling to use consistent 'c' variable.	5	1	KEEP
1774408043.828	Check the file system permissions and ensure that all necessary files (e.g., libraries, configuration files) have the correct read/write permissions. Then, attempt to enable and configure the GPU with a basic workload to see if there is an improvement in performance.	30	0	REVERT
1774408107.552	Check the file system permissions and ensure that all necessary files (e.g., libraries, configuration files) have the correct read/write permissions. Then, attempt to enable and configure the GPU with a basic workload to see if there is an improvement in performance.	30	0	REVERT
1774408137.053	Adding a render_input_zone_text function that reads from input_buffer and composites 5x7 font characters at fixed positions will enable reliable OCR extraction. This function should handle multi-line natural language input and coordinate with the PATCH_STATUS display area (rows 475-479).	5	1	KEEP
1774408171.452	Check the file system permissions and ensure that all necessary files (e.g., libraries, configuration files) have the correct read/write permissions. Then, attempt to enable and configure the GPU with a basic workload to see if there is an improvement in performance.	30	0	REVERT
1774408235.237	Check the file system permissions and ensure that all necessary files (e.g., libraries, configuration files) have the correct read/write permissions. Then, attempt to enable and configure the GPU with a basic workload to see if there is an improvement in performance.	30	0	REVERT
1774408236.598	Fix the select statement parentheses and ensure all font character comparisons use the normalized `c` variable consistently. This will enable proper text rendering in the INPUT ZONE for vision model OCR extraction.	5	1	KEEP
1774408257.798	Optimize the bitmap font rendering to leverage parallel processing capabilities of the GPU and improve performance.	5	1	KEEP
1774408299.039	Check the file system permissions and ensure that all necessary files (e.g., libraries, configuration files) have the correct read/write permissions. Then, attempt to enable and configure the GPU with a basic workload to see if there is an improvement in performance.	30	0	REVERT
1774408358.631	Fix the render_input_zone_text function by removing the broken early-return implementation and keeping only the correct multi-line text rendering logic that properly calculates buffer indices (line * 20u + char_col) for natural language input display.	5	1	KEEP
1774408362.746	Check the file system permissions and ensure that all necessary files (e.g., libraries, configuration files) have the correct read/write permissions. Then, attempt to enable and configure the GPU with a basic workload to see if there is an improvement in performance.	30	0	REVERT
1774408427.123	Check the file system permissions and ensure that all necessary files (e.g., libraries, configuration files) have the correct read/write permissions. Also, verify that all required directories are correctly mounted and accessible from the VM's perspective. Then, attempt to enable and configure the GPU with a basic workload to see if there is an improvement in performance.	30	0	REVERT
1774408470.011	Standardizing all character comparisons to use the normalized variable 'c' throughout the font function will ensure consistent rendering for both uppercase and lowercase input, improving vision model OCR extraction accuracy from the INPUT ZONE (rows 450-479).	5	1	KEEP
1774408491.675	Check the file system permissions and ensure that all necessary files (e.g., libraries, configuration files) have the correct read/write permissions. Also, verify that all required directories are correctly mounted and accessible from the VM's perspective. Then, attempt to enable and configure the GPU with a basic workload to see if there is an improvement in performance.	30	0	REVERT
1774408555.962	Check the file system permissions and ensure that all necessary files (e.g., libraries, configuration files) have the correct read/write permissions. Also, verify that all required directories are correctly mounted and accessible from the VM's perspective. Then, attempt to enable and configure the GPU with a basic workload to see if there is an improvement in performance.	30	0	REVERT
1774408620.423	Check the file system permissions and ensure that all necessary files (e.g., libraries, configuration files) have the correct read/write permissions. Also, verify that all required directories are correctly mounted and accessible from the VM's perspective. Then, attempt to enable and configure the GPU with a basic workload to see if there is an improvement in performance.	30	0	REVERT
1774408684.78	Check the file system permissions and ensure that all necessary files (e.g., libraries, configuration files) have the correct read/write permissions. Also, verify that all required directories are correctly mounted and accessible from the VM's perspective. Then, attempt to enable and configure the GPU with a basic workload to see if there is an improvement in performance.	30	0	REVERT
1774408708.395	Fix the early return in digit '1' case by explicitly handling all 5 columns like other digits. This ensures '5 3 +' natural language commands render correctly in INPUT ZONE (rows 450-479) for qwen3-vl-8b OCR extraction with 100% accuracy target.	5	1	KEEP
1774408749.106	Check the file system permissions and ensure that all necessary files (e.g., libraries, configuration files) have the correct read/write permissions. Also, verify that all required directories are correctly mounted and accessible from the VM's perspective. Then, attempt to enable and configure the GPU with a basic workload to see if there is an improvement in performance.	30	0	REVERT
1774408813.398	Check the file system permissions and ensure that all necessary files (e.g., libraries, configuration files) have the correct read/write permissions. Also, verify that all required directories are correctly mounted and accessible from the VM's perspective. Then, attempt to enable and configure the GPU with a basic workload to see if there is an improvement in performance.	30	0	REVERT
1774408873.461	Normalizing all digit checks to use 'c' variable ensures consistent font lookup behavior, prevents future bugs if normalization logic extends, and fixes the truncated syntax for digit '7' glyph rendering in INPUT ZONE text display.	5	1	KEEP
