timestamp	hypothesis	baseline	metric	status
1774431056.935	Conduct a detailed analysis of the VM's instruction scheduling and execution mechanisms. Identify any potential misconfigurations or inefficiencies that might be causing improper execution and modify them to ensure proper handling of these mechanisms to improve performance.	60	0	REVERT
1774431121.94	Conduct a detailed analysis of the VM's overall architecture, focusing on how it handles inter-component communication and synchronization. Identify any potential misconfigurations or inefficiencies that might be causing improper execution and modify them to ensure proper handling of these mechanisms to improve performance.	60	0	REVERT
1774431186.555	Conduct a detailed analysis of the VM's thread management and synchronization mechanisms. Identify any potential misconfigurations or inefficiencies that might be causing improper execution and modify them to ensure proper handling of these mechanisms to improve performance.	60	0	REVERT
1774431251.116	Conduct a detailed analysis of the VM's cache mechanism, focusing on how it handles data caching and retrieval. Identify any potential misconfigurations or inefficiencies that might be causing improper execution and modify them to ensure proper handling of these mechanisms to improve performance.	60	0	REVERT
1774431316.035	Conduct a detailed analysis of the VM's memory management and allocation mechanisms. Identify any potential misconfigurations or inefficiencies that might be causing improper execution and modify them to ensure proper handling of these mechanisms to improve performance.	60	0	REVERT
1774431380.864	Conduct a detailed analysis of the VM's interrupt handling mechanism, focusing on how it manages resources and responds to interrupts during heavy workload demands. Identify any potential misconfigurations or inefficiencies that might be causing improper execution and modify them to ensure proper handling of these mechanisms to improve performance.	60	0	REVERT
1774431445.844	Conduct a detailed analysis of the VM's overall architecture, focusing on how it handles inter-component communication and synchronization. Identify any potential misconfigurations or inefficiencies that might be causing improper execution and modify them to ensure proper handling of these mechanisms to improve performance.	60	0	REVERT
1774431510.409	Conduct a detailed analysis of the VM's synchronization primitives (mutexes and semaphores). Identify any potential misconfigurations or inefficiencies that might be causing improper execution and modify them to ensure proper handling of these mechanisms to improve performance.	60	0	REVERT
1774431574.997	Conduct a detailed analysis of the VM's task scheduling algorithm. Identify any potential misconfigurations or inefficiencies that might be causing improper execution and modify them to ensure proper handling of these mechanisms to improve performance.	60	0	REVERT
1774431639.616	Conduct a detailed analysis of the VM's memory allocation and deallocation mechanisms. Focus on optimizing memory fragmentation reduction techniques and enhancing cache usage to improve overall performance under heavy workload demands.	60	0	REVERT
1774431704.339	Conduct a detailed analysis of the VM's context switching mechanism. Identify any potential misconfigurations or inefficiencies that might be causing improper execution and modify them to ensure proper handling of these mechanisms to improve performance.	60	0	REVERT
1774431769.035	Conduct a detailed analysis of the VM's overall architecture, focusing on how it handles inter-component communication and synchronization. Identify any potential misconfigurations or inefficiencies that might be causing improper execution and modify them to ensure proper handling of these mechanisms to improve performance.	60	0	REVERT
1774431833.779	Conduct a detailed analysis of the VM's inter-component communication and coordination mechanisms. Identify any potential misconfigurations or inefficiencies that might be causing improper execution and modify them to ensure proper handling of these mechanisms to improve performance.	60	0	REVERT
1774431898.576	Conduct a detailed analysis of the VM's inter-component communication and coordination mechanisms. Identify any potential misconfigurations or inefficiencies that might be causing improper execution and modify them to ensure proper handling of these mechanisms to improve performance.	60	0	REVERT
1774431963.191	Conduct a detailed analysis of the VM's inter-component communication and coordination mechanisms. Identify any potential misconfigurations or inefficiencies that might be causing improper execution and modify them to ensure proper handling of these mechanisms to improve performance.	60	0	REVERT
1774432028.429	Conduct a detailed analysis of the VM's inter-component communication and coordination mechanisms. Identify any potential misconfigurations or inefficiencies that might be causing improper execution and modify them to ensure proper handling of these mechanisms to improve performance.	60	0	REVERT
1774432033.559	Simplify the render_input_zone_text function by removing redundant checks and optimizing the character rendering loop.	5	1	KEEP
1774432092.938	Conduct a detailed analysis of the VM's inter-component communication and coordination mechanisms. Identify any potential misconfigurations or inefficiencies that might be causing improper execution and modify them to ensure proper handling of these mechanisms to improve performance.	60	0	REVERT
1774432157.626	Conduct a detailed analysis of the VM's inter-component communication and coordination mechanisms. Identify any potential misconfigurations or inefficiencies that might be causing improper execution and modify them to ensure proper handling of these mechanisms to improve performance.	60	0	REVERT
1774432222.576	Optimize file system operations in the VM. Specifically, focus on enhancing the speed of accessing and modifying internal data structures, such as memory management, task scheduling, and resource allocation.	60	0	REVERT
1774432286.9	Optimize file system operations in the VM. Specifically, focus on enhancing the speed of accessing and modifying internal data structures, such as memory management, task scheduling, and resource allocation.	60	0	REVERT
1774432351.103	Conduct a comprehensive analysis of the VM's inter-component communication and file system operations. Identify any potential misconfigurations, inefficiencies, or bottlenecks that might be causing improper execution and modify them to ensure proper handling of these mechanisms to improve performance.	60	0	REVERT
1774432416.245	Conduct a comprehensive analysis of the VM's inter-component communication and file system operations. Identify any potential misconfigurations, inefficiencies, or bottlenecks that might be causing improper execution and modify them to ensure proper handling of these mechanisms to improve performance.	60	0	REVERT
1774432480.908	Conduct a comprehensive analysis of the VM's inter-component communication and file system operations. Identify any potential misconfigurations, inefficiencies, or bottlenecks that might be causing improper execution and modify them to ensure proper handling of these mechanisms to improve performance.	60	0	REVERT
1774432545.438	Conduct a comprehensive analysis of the VM's inter-component communication and file system operations. Identify any potential misconfigurations, inefficiencies, or bottlenecks that might be causing improper execution and modify them to ensure proper handling of these mechanisms to improve performance.	60	0	REVERT
1774432610.43	Conduct a comprehensive analysis of the VM's inter-component communication and file system operations. Identify any potential misconfigurations, inefficiencies, or bottlenecks that might be causing improper execution and modify them to ensure proper handling of these mechanisms to improve performance.	60	0	REVERT
1774432675.564	Conduct a comprehensive analysis of the VM's inter-component communication and file system operations. Identify any potential misconfigurations, inefficiencies, or bottlenecks that might be causing improper execution and modify them to ensure proper handling of these mechanisms to improve performance.	60	0	REVERT
1774432740.192	Conduct a comprehensive analysis of the VM's inter-component communication and file system operations. Identify any potential misconfigurations, inefficiencies, or bottlenecks that might be causing improper execution and modify them to ensure proper handling of these mechanisms to improve performance.	60	0	REVERT
1774432805.422	Conduct a comprehensive analysis of the VM's inter-component communication and file system operations. Identify any potential misconfigurations, inefficiencies, or bottlenecks that might be causing improper execution and modify them to ensure proper handling of these mechanisms to improve performance.	60	0	REVERT
1774432870.528	Conduct a comprehensive analysis of the VM's inter-component communication and file system operations. Identify any potential misconfigurations, inefficiencies, or bottlenecks that might be causing improper execution and modify them to ensure proper handling of these mechanisms to improve performance.	60	0	REVERT
1774432934.895	Conduct a comprehensive analysis of the VM's inter-component communication and file system operations. Identify any potential misconfigurations, inefficiencies, or bottlenecks that might be causing improper execution and modify them to ensure proper handling of these mechanisms to improve performance.	60	0	REVERT
1774432999.503	Conduct a comprehensive analysis of the VM's inter-component communication and file system operations. Identify any potential misconfigurations, inefficiencies, or bottlenecks that might be causing improper execution and modify them to ensure proper handling of these mechanisms to improve performance.	60	0	REVERT
1774433065.203	Conduct a comprehensive analysis of the VM's inter-component communication and file system operations. Identify any potential misconfigurations, inefficiencies, or bottlenecks that might be causing improper execution and modify them to ensure proper handling of these mechanisms to improve performance.	60	0	REVERT
1774433129.702	Conduct a comprehensive analysis of the VM's inter-component communication and file system operations. Identify any potential misconfigurations, inefficiencies, or bottlenecks that might be causing improper execution and modify them to ensure proper handling of these mechanisms to improve performance.	60	0	REVERT
1774433195.724	Conduct a comprehensive analysis of the VM's inter-component communication and file system operations. Identify any potential misconfigurations, inefficiencies, or bottlenecks that might be causing improper execution and modify them to ensure proper handling of these mechanisms to improve performance.	60	0	REVERT
1774433261.445	Conduct a comprehensive analysis of the VM's inter-component communication and file system operations. Identify any potential misconfigurations, inefficiencies, or bottlenecks that might be causing improper execution and modify them to ensure proper handling of these mechanisms to improve performance.	60	0	REVERT
1774433325.985	Conduct a comprehensive analysis of the VM's inter-component communication and file system operations. Identify any potential misconfigurations, inefficiencies, or bottlenecks that might be causing improper execution and modify them to ensure proper handling of these mechanisms to improve performance.	60	0	REVERT
1774433391.102	Conduct a comprehensive analysis of the VM's inter-component communication and file system operations. Identify any potential misconfigurations, inefficiencies, or bottlenecks that might be causing improper execution and modify them to ensure proper handling of these mechanisms to improve performance.	60	0	REVERT
1774433455.973	Conduct a comprehensive analysis of the VM's inter-component communication and file system operations. Identify any potential misconfigurations, inefficiencies, or bottlenecks that might be causing improper execution and modify them to ensure proper handling of these mechanisms to improve performance.	60	0	REVERT
1774433520.625	Conduct a comprehensive analysis of the VM's inter-component communication and file system operations. Identify any potential misconfigurations, inefficiencies, or bottlenecks that might be causing improper execution and modify them to ensure proper handling of these mechanisms to improve performance.	60	0	REVERT
1774433585.694	Conduct a comprehensive analysis of the VM's inter-component communication and file system operations. Identify any potential misconfigurations, inefficiencies, or bottlenecks that might be causing improper execution and modify them to ensure proper handling of these mechanisms to improve performance.	60	0	REVERT
1774433650.096	Conduct a comprehensive analysis of the VM's inter-component communication and file system operations. Identify any potential misconfigurations, inefficiencies, or bottlenecks that might be causing improper execution and modify them to ensure proper handling of these mechanisms to improve performance.	60	0	REVERT
1774433714.688	Conduct a comprehensive analysis of the VM's inter-component communication and file system operations. Identify any potential misconfigurations, inefficiencies, or bottlenecks that might be causing improper execution and modify them to ensure proper handling of these mechanisms to improve performance.	60	0	REVERT
1774433779.836	Conduct a comprehensive analysis of the VM's inter-component communication and file system operations. Identify any potential misconfigurations, inefficiencies, or bottlenecks that might be causing improper execution and modify them to ensure proper handling of these mechanisms to improve performance.	60	0	REVERT
1774433844.442	Conduct a comprehensive analysis of the VM's inter-component communication and file system operations. Identify any potential misconfigurations, inefficiencies, or bottlenecks that might be causing improper execution and modify them to ensure proper handling of these mechanisms to improve performance.	60	0	REVERT
1774433909.488	Conduct a comprehensive analysis of the VM's inter-component communication and file system operations. Identify any potential misconfigurations, inefficiencies, or bottlenecks that might be causing improper execution and modify them to ensure proper handling of these mechanisms to improve performance.	60	0	REVERT
1774433974.655	Conduct a comprehensive analysis of the VM's inter-component communication and file system operations. Identify any potential misconfigurations, inefficiencies, or bottlenecks that might be causing improper execution and modify them to ensure proper handling of these mechanisms to improve performance.	60	0	REVERT
1774434039.273	Conduct a comprehensive analysis of the VM's inter-component communication and file system operations. Identify any potential misconfigurations, inefficiencies, or bottlenecks that might be causing improper execution and modify them to ensure proper handling of these mechanisms to improve performance.	60	0	REVERT
1774434103.924	Conduct a comprehensive analysis of the VM's inter-component communication and file system operations. Identify any potential misconfigurations, inefficiencies, or bottlenecks that might be causing improper execution and modify them to ensure proper handling of these mechanisms to improve performance.	60	0	REVERT
1774434168.296	Conduct a comprehensive analysis of the VM's inter-component communication and file system operations. Identify any potential misconfigurations, inefficiencies, or bottlenecks that might be causing improper execution and modify them to ensure proper handling of these mechanisms to improve performance.	60	0	REVERT
1774434232.974	Conduct a comprehensive analysis of the VM's inter-component communication and file system operations. Identify any potential misconfigurations, inefficiencies, or bottlenecks that might be causing improper execution and modify them to ensure proper handling of these mechanisms to improve performance.	60	0	REVERT
1774434298.184	Conduct a comprehensive analysis of the VM's inter-component communication and file system operations. Identify any potential misconfigurations, inefficiencies, or bottlenecks that might be causing improper execution and modify them to ensure proper handling of these mechanisms to improve performance.	60	0	REVERT
1774434362.708	Conduct a comprehensive analysis of the VM's inter-component communication and file system operations. Identify any potential misconfigurations, inefficiencies, or bottlenecks that might be causing improper execution and modify them to ensure proper handling of these mechanisms to improve performance.	60	0	REVERT
1774434427.812	Conduct a comprehensive analysis of the VM's inter-component communication and file system operations. Identify any potential misconfigurations, inefficiencies, or bottlenecks that might be causing improper execution and modify them to ensure proper handling of these mechanisms to improve performance.	60	0	REVERT
1774434492.229	Conduct a comprehensive analysis of the VM's inter-component communication and file system operations. Identify any potential misconfigurations, inefficiencies, or bottlenecks that might be causing improper execution and modify them to ensure proper handling of these mechanisms to improve performance.	60	0	REVERT
1774434557.388	Conduct a comprehensive analysis of the VM's inter-component communication and file system operations. Identify any potential misconfigurations, inefficiencies, or bottlenecks that might be causing improper execution and modify them to ensure proper handling of these mechanisms to improve performance.	60	0	REVERT
1774434622.533	Conduct a comprehensive analysis of the VM's inter-component communication and file system operations. Identify any potential misconfigurations, inefficiencies, or bottlenecks that might be causing improper execution and modify them to ensure proper handling of these mechanisms to improve performance.	60	0	REVERT
1774434687.529	Conduct a comprehensive analysis of the VM's inter-component communication and file system operations. Identify any potential misconfigurations, inefficiencies, or bottlenecks that might be causing improper execution and modify them to ensure proper handling of these mechanisms to improve performance.	60	0	REVERT
1774434751.969	Conduct a comprehensive analysis of the VM's inter-component communication and file system operations. Identify any potential misconfigurations, inefficiencies, or bottlenecks that might be causing improper execution and modify them to ensure proper handling of these mechanisms to improve performance.	60	0	REVERT
1774434817.141	Conduct a comprehensive analysis of the VM's inter-component communication and file system operations. Identify any potential misconfigurations, inefficiencies, or bottlenecks that might be causing improper execution and modify them to ensure proper handling of these mechanisms to improve performance.	60	0	REVERT
1774434881.805	Conduct a comprehensive analysis of the VM's inter-component communication and file system operations. Identify any potential misconfigurations, inefficiencies, or bottlenecks that might be causing improper execution and modify them to ensure proper handling of these mechanisms to improve performance.	60	0	REVERT
1774434946.885	Conduct a comprehensive analysis of the VM's inter-component communication and file system operations. Identify any potential misconfigurations, inefficiencies, or bottlenecks that might be causing improper execution and modify them to ensure proper handling of these mechanisms to improve performance.	60	0	REVERT
1774435011.505	Conduct a comprehensive analysis of the VM's inter-component communication and file system operations. Identify any potential misconfigurations, inefficiencies, or bottlenecks that might be causing improper execution and modify them to ensure proper handling of these mechanisms to improve performance.	60	0	REVERT
1774435075.939	Conduct a comprehensive analysis of the VM's inter-component communication and file system operations. Identify any potential misconfigurations, inefficiencies, or bottlenecks that might be causing improper execution and modify them to ensure proper handling of these mechanisms to improve performance.	60	0	REVERT
1774435140.888	Conduct a comprehensive analysis of the VM's inter-component communication and file system operations. Identify any potential misconfigurations, inefficiencies, or bottlenecks that might be causing improper execution and modify them to ensure proper handling of these mechanisms to improve performance.	60	0	REVERT
1774435205.678	Conduct a comprehensive analysis of the VM's inter-component communication and file system operations. Identify any potential misconfigurations, inefficiencies, or bottlenecks that might be causing improper execution and modify them to ensure proper handling of these mechanisms to improve performance.	60	0	REVERT
1774435270.261	Conduct a comprehensive analysis of the VM's inter-component communication and file system operations. Identify any potential misconfigurations, inefficiencies, or bottlenecks that might be causing improper execution and modify them to ensure proper handling of these mechanisms to improve performance.	60	0	REVERT
1774435334.522	Implement a simple caching mechanism in the file system operations to store frequently accessed data in memory, reducing the need for repeated disk reads.	60	0	REVERT
