timestamp	hypothesis	baseline	metric	status
1774466067.527	Refactor the VM's code to simplify code paths. This should help in improving overall performance by reducing complexity, thereby making better use of available resources during high load demands involving concurrent file access operations.	60	0	REVERT
1774466071.689	Removing the duplicated function body will restore shader compilation. The first complete function definition (lines 38-76) is correct; the duplicate fragment (lines 77-100) must be excised.	5	1	KEEP
1774466131.713	Refactor the VM's code to simplify code paths. This should help in improving overall performance by reducing complexity, thereby making better use of available resources during high load demands involving concurrent file access operations.	60	0	REVERT
1774466196.317	Integrate caching mechanisms within the VM, optimize the data structures used for concurrent access, and enable parallel execution of tasks. This should help in improving overall performance by reducing redundant calculations and data retrieval times, thereby making better use of available resources during high load demands.	60	0	REVERT
1774466260.388	Refactor the VM's code to optimize memory management. This should help in improving overall performance by reducing memory usage, thereby making better use of available resources during high load demands involving concurrent file access operations.	60	0	REVERT
1774466324.242	Integrate a highly efficient file system caching mechanism within the VM. This should help in improving overall performance by reducing redundant disk access times, thereby making better use of available resources during high load demands involving concurrent file access operations.	60	0	REVERT
1774466388.722	Integrate caching mechanisms within the VM, optimize the data structures used for concurrent access, and enable parallel execution of tasks. This should help in improving overall performance by reducing redundant calculations and data retrieval times, thereby making better use of available resources during high load demands involving concurrent file access operations.	60	0	REVERT
1774466453.101	Refactor the VM's code to optimize concurrent access handling. This should help in improving overall performance by reducing bottlenecks and making better use of available resources during high load demands involving multiple tasks with heavy concurrent file access.	60	0	REVERT
1774466517.814	Integrate caching mechanisms within the VM, optimize the data structures used for concurrent access, and enable parallel execution of tasks. This should help in improving overall performance by reducing redundant calculations and data retrieval times, thereby making better use of available resources during high load demands involving concurrent file access operations.	60	0	REVERT
1774466582.031	Refactor the VM's scheduling algorithm to optimize task prioritization and resource allocation. This should help in improving overall performance by reducing bottlenecks and making better use of available resources during high load demands involving multiple tasks with heavy concurrent file access.	60	0	REVERT
1774466595.085	Simplify the logic by removing redundant checks and optimizing the character extraction process.	5	1	KEEP
1774466646.637	Integrate a highly efficient file system caching mechanism within the VM and optimize the scheduling algorithm to enhance task prioritization and resource allocation. This should help in improving overall performance by reducing redundant disk access times and optimizing task prioritization and resource allocation during high load demands involving concurrent file access operations.	60	0	REVERT
1774466709.863	Simplify the `render_input_zone_text` function by removing redundant checks, optimizing font rendering, and ensuring it handles the entire 5x7 bitmap font correctly.	5	1	KEEP
1774466711.947	Integrate a highly efficient file system caching mechanism within the VM, optimize data structures for concurrent access, enable parallel execution of tasks, and refactor the scheduling algorithm to enhance task prioritization and resource allocation. This should help in improving overall performance by reducing redundant disk access times and optimizing task prioritization and resource allocation during high load demands involving concurrent file access operations.	60	0	REVERT
1774466776.093	Refactor the file system access layer to enhance its caching mechanism. This should help in reducing redundant disk accesses, thereby improving overall performance during high load demands involving concurrent file access operations.	60	0	REVERT
1774466797.779	Remove the two duplicate/incorrect render_input_zone_text definitions. Keep only the third version which correctly: (1) maps input zone rows 9-15 to font rows 0-6, (2) includes blinking cursor support, (3) has proper 5-pixel column gap handling for OCR accuracy.	5	1	KEEP
1774466840.866	Integrate caching mechanisms within the VM, optimize the data structures used for concurrent access, and enable parallel execution of tasks. This should help in improving overall performance by reducing redundant calculations and data retrieval times, thereby making better use of available resources during high load demands involving concurrent file access operations.	60	0	REVERT
1774466905.995	Refactor the file system access layer to enhance its caching mechanism. This should help in reducing redundant disk accesses, thereby improving overall performance during high load demands involving concurrent file access operations.	60	0	REVERT
1774466920.195	By optimizing the early-out checks and simplifying the logic for determining the character row and column, we can improve performance and reduce ALU usage.	5	1	KEEP
1774466970.785	Integrate a highly efficient file system caching mechanism within the VM, optimize the scheduling algorithm, and enable parallel execution of tasks. This should help in improving overall performance by reducing redundant disk access times and optimizing task prioritization and resource allocation during high load demands involving concurrent file access operations.	60	0	REVERT
1774467035.063	Refactor the memory allocation mechanism within the VM to optimize memory usage. This should help in reducing redundant memory allocations, thereby improving overall performance during high load demands involving concurrent file access operations.	60	0	REVERT
1774467059.234	Removing the duplicate code block will restore GPU ONLINE status and enable the INPUT ZONE rendering pipeline. This is a critical syntax fix that blocks all downstream functionality including the 5x7 font rendering and vision model OCR extraction.	5	1	KEEP
1774467101.345	Integrate a highly efficient file system caching mechanism, optimize the scheduling algorithm, enable parallel execution of tasks, and refactor the memory allocation mechanism within the VM. This should help in improving overall performance by reducing redundant disk access times, optimizing task prioritization and resource allocation, and efficiently managing memory during high load demands involving concurrent file access operations.	60	0	REVERT
1774467168.392	Refactor the task scheduling algorithm within the VM to optimize task prioritization and resource allocation. This should help in improving overall performance during high load demands involving concurrent file access operations.	60	0	REVERT
1774467173.613	By improving the early-out checks and optimizing the font rendering logic, we can reduce the computational overhead and improve performance.	5	1	KEEP
1774467234.071	Integrate a highly efficient file system caching mechanism, optimize the scheduling algorithm, enable parallel execution of tasks, refactor the memory allocation mechanism within the VM, and refactoring the task scheduling algorithm within the VM. This should help in improving overall performance by reducing redundant disk access times, optimizing task prioritization and resource allocation, efficiently managing memory, and ensuring that tasks are executed in the most efficient order.	60	0	REVERT
1774467236.155	Removing the duplicated code block will allow the shader to compile successfully, enabling GPU initialization. This single surgical fix addresses the root cause of gpu_status: OFFLINE and will unblock the natural language control interface for the INPUT ZONE (rows 450-479).	5	1	KEEP
1774467299.118	Refactor the task scheduling algorithm within the VM to optimize task prioritization and resource allocation. This should help in improving overall performance during high load demands involving concurrent file access operations.	60	0	REVERT
1774467366.777	Integrate a detailed logging and monitoring system that tracks interactions between the file system caching mechanism and the task scheduling algorithm. This should help in identifying if they are contributing to performance bottlenecks and suggest potential optimizations.	60	0	REVERT
1774467371.717	By optimizing the early-out checks and reducing redundant computations, we can improve the performance of the INPUT ZONE rendering and font handling.	5	1	KEEP
1774467431.795	Integrate a detailed logging and monitoring system that tracks interactions between the file system caching mechanism and the task scheduling algorithm. This should help in identifying if they are contributing to performance bottlenecks and suggest potential optimizations.	60	0	REVERT
1774467432.052	Removing the duplicate code block will restore WGSL compilation, enabling GPU initialization and allowing the vision-to-opcode pipeline to function. The 5x7 font rendering logic is otherwise correct for OCR extraction.	5	1	KEEP
1774467497.401	Integrate a detailed logging and monitoring system that tracks interactions between the file system caching mechanism and the task scheduling algorithm. This should help in identifying if they are contributing to performance bottlenecks and suggest potential optimizations.	60	0	REVERT
1774467536.203	Simplify the boundary check and optimize the cursor blinking logic to improve performance.	5	1	KEEP
1774467563.619	Refactor the file system caching mechanism within the VM to optimize data storage and retrieval. This should help in improving overall performance during high load demands involving concurrent file access operations.	60	0	REVERT
1774467628.654	Integrate a comprehensive profiling tool that tracks interactions between the task scheduler, file system caching mechanism, and memory management. This should help in identifying if they are contributing to performance bottlenecks and suggest potential optimizations.	60	0	REVERT
1774467656.152	Fix the boundary early-out condition to include marker rows (448-481), and replace the orphaned incomplete code with a complete multi-line text rendering implementation for the INPUT ZONE that supports 3 lines of natural language input with proper OCR-optimized contrast.	5	1	KEEP
1774467694.099	Implement a more sophisticated locking protocol that ensures safe interaction between the file system caching mechanism, task scheduler, and memory management. This should help in reducing conflicts and improving overall VM performance during high load demands involving concurrent file access operations.	60	0	REVERT
1774467760.142	Integrate a comprehensive profiling tool that tracks detailed interactions between the file system caching mechanism, task scheduler, memory management, and logging system. This should help in identifying if they are contributing to performance bottlenecks and suggest potential optimizations.	60	0	REVERT
1774467825.871	Refactor the task scheduler algorithm to optimize its efficiency. This should help in reducing conflicts and improving overall VM performance during high load demands involving concurrent file access operations.	60	0	REVERT
1774467890.701	Develop a unified resource manager that coordinates access to shared resources among the task scheduler, file system caching mechanism, memory management, and logging system. This should help in reducing conflicts and improving overall VM performance during high load demands involving concurrent file access operations.	60	0	REVERT
1774467955.984	Integrate a comprehensive profiling tool that tracks interactions between the VM and any available GPU. This should help in identifying if they are contributing to performance bottlenecks and suggest potential optimizations.	60	0	REVERT
1774468021.462	Optimize GPU resource management within the pxOS VM by implementing more efficient algorithms and data structures for managing GPU resources. This should help in reducing conflicts and improving overall VM performance during high load demands involving concurrent file access operations.	60	0	REVERT
1774468077.721	Optimize the boundary check logic in `render_input_zone_text` and simplify the `get_font_column` function to improve performance.	5	1	KEEP
1774468086.6	Optimize the interaction between the file system caching mechanism and the task scheduler by implementing a more efficient algorithm for managing cache invalidation and task prioritization. This should help in reducing conflicts and improving overall VM performance during high load demands involving concurrent file access operations.	60	0	REVERT
1774468152.303	Optimize the interaction between the memory management subsystem and the virtual machine by implementing a more efficient algorithm for managing memory allocation and deallocation. This should help in reducing conflicts and improving overall VM performance during high load demands involving concurrent file access operations.	60	0	REVERT
1774468216.726	Develop and implement a caching mechanism for frequently accessed files within the file system. This should help in reducing disk I/O operations and improve overall VM performance during high load demands involving concurrent file access operations.	60	0	REVERT
1774468282.497	Optimize the interaction between the CPU and the GPU by implementing more efficient algorithms for task scheduling and resource allocation. This should help in reducing conflicts and improving overall VM performance during high load demands involving concurrent file access operations.	60	0	REVERT
1774468338.333	Removing the orphaned duplicate function body will restore shader compilation, enabling GPU ONLINE status and proper INPUT ZONE rendering for vision model OCR extraction.	5	1	KEEP
1774468347.53	Optimize the interaction between the task scheduler and the file system by implementing a more efficient algorithm for managing task prioritization and file caching. This should help in reducing conflicts and improving overall VM performance during high load demands involving concurrent file access operations.	60	0	REVERT
1774468412.94	Optimize the interaction between the CPU and memory subsystem by implementing a more efficient algorithm for managing cache coherence and data consistency. This should help in reducing conflicts and improving overall VM performance during high load demands involving concurrent file access operations.	60	0	REVERT
1774468477.528	Parallelize operations within the pxOS VM by implementing a multi-threaded or multi-process architecture. This should help in reducing bottlenecks and improving overall VM performance during high load demands involving concurrent file access operations.	60	0	REVERT
1774468543.149	Optimize the interaction between the CPU and disk I/O operations by implementing a more efficient algorithm for managing disk buffer cache and data read/write patterns. This should help in reducing conflicts and improving overall VM performance during high load demands involving concurrent file access operations.	60	0	REVERT
1774468599.909	Integrate the orphaned multi-line layout into render_input_zone_text() to support 3 lines of ~106 chars each, improving natural language command display and OCR accuracy. Remove orphaned code and fix declaration order.	5	1	KEEP
1774468608.401	Optimize the interaction between the CPU and GPU by implementing more efficient algorithms for task scheduling and resource allocation during low load demands. This should help in identifying any potential bottlenecks that might not be apparent under high load conditions, as well as improving overall VM stability and readiness.	60	0	REVERT
1774468674.449	Optimize the interaction between the CPU and network subsystem by implementing more efficient algorithms for managing network buffer cache and data transmission patterns. This should help in reducing conflicts and improving overall VM performance during high load demands involving concurrent file access operations over a network.	60	0	REVERT
1774468739.638	Optimize the interaction between the CPU and disk I/O operations by implementing a more efficient algorithm for managing disk buffer cache and data read/write patterns. This should help in reducing conflicts and improving overall VM performance during high load demands involving concurrent file access operations.	60	0	REVERT
1774468805.425	Optimize the interaction between the CPU and memory subsystem by implementing a more efficient algorithm for managing memory allocation and deallocation patterns. This should help in reducing conflicts and improving overall VM performance during high load demands involving concurrent file access operations.	60	0	REVERT
1774468870.444	Optimize the interaction between the CPU and disk I/O operations by implementing a more efficient algorithm for managing disk buffer cache and data read/write patterns. This should help in reducing conflicts and improving overall VM performance during high load demands involving concurrent file access operations.	60	0	REVERT
1774468936.119	Optimize the interaction between the CPU and network subsystem by implementing more efficient algorithms for managing network buffer cache and data transmission patterns. This should help in reducing conflicts and improving overall VM performance during high load demands involving concurrent file access operations over a network.	60	0	REVERT
1774469001.284	Optimize the interaction between the CPU and GPU subsystems by implementing more efficient algorithms for managing GPU buffer cache and data transmission patterns. This should help in reducing conflicts and improving overall VM performance during high load demands involving concurrent computations or graphics rendering operations.	60	0	REVERT
1774469067.058	Optimize the interaction between the CPU and memory subsystem by implementing a more efficient algorithm for managing memory allocation and deallocation patterns. This should help in reducing conflicts and improving overall VM performance during high load demands involving concurrent file access operations.	60	0	REVERT
1774469131.78	Optimize the current task scheduling algorithm by implementing a more efficient priority-based or round-robin scheduling mechanism. This should help in reducing conflicts and improving overall VM performance during high load demands involving concurrent file access operations.	60	0	REVERT
1774469197.802	Optimize the interaction between the CPU and disk I/O operations by implementing a more efficient algorithm for managing disk buffer cache and data read/write patterns. This should help in reducing conflicts and improving overall VM performance during high load demands involving concurrent file access operations with multiple tasks, including high load demands.	60	0	REVERT
1774469215.257	By optimizing the boundary check and reducing redundant calculations, we can improve the performance of the shader without breaking existing functionality.	5	1	KEEP
1774469263.838	Optimize the interaction between the CPU and network subsystem by implementing more efficient algorithms for managing network buffer cache and data transmission patterns. This should help in reducing conflicts and improving overall VM performance during high load demands involving concurrent file access operations over a network.	60	0	REVERT
1774469288.367	Remove the orphaned duplicate code block to restore shader compilation. The first function definition is complete and correct - the duplicate was likely a failed merge artifact. This single surgical removal will allow the shader to compile and enable the INPUT ZONE rendering for vision model OCR extraction.	5	1	KEEP
1774469329.102	Optimize the interaction between the CPU and GPU subsystems by implementing more efficient algorithms for managing GPU buffer cache and data transmission patterns. This should help in reducing conflicts and improving overall VM performance during high load demands involving concurrent computations or graphics rendering operations.	60	0	REVERT
1774469395.069	Optimize the interaction between the CPU and disk I/O operations by implementing a more efficient algorithm for managing disk buffer cache and data read/write patterns. This should help in reducing conflicts and improving overall VM performance during high load demands involving concurrent file access operations with multiple tasks, including high load demands.	60	0	REVERT
1774469460.397	Optimize the memory handling subsystem by implementing a more efficient algorithm for managing memory allocation and deallocation patterns. This should help in reducing conflicts and improving overall VM performance during high load demands involving concurrent file access operations with multiple tasks, including high load demands.	60	0	REVERT
1774469526.395	Optimize the interaction between the CPU and network subsystem by implementing more efficient algorithms for managing network buffer cache and data transmission patterns. This should help in reducing conflicts and improving overall VM performance during high load demands involving concurrent file access operations over a network.	60	0	REVERT
