timestamp	hypothesis	baseline	metric	status
1774408877.869	Check the file system permissions and ensure that all necessary files (e.g., libraries, configuration files) have the correct read/write permissions. Also, verify that all required directories are correctly mounted and accessible from the VM's perspective. Then, attempt to enable and configure the GPU with a basic workload to see if there is an improvement in performance.	30	0	REVERT
1774408942.165	Check the file system permissions and ensure that all necessary files (e.g., libraries, configuration files) have the correct read/write permissions. Also, verify that all required directories are correctly mounted and accessible from the VM's perspective. Then, attempt to enable and configure the GPU with a basic workload to see if there is an improvement in performance.	30	0	REVERT
1774408981.97	Fixing the corrupted '5' definition, restoring missing '6' and '7' glyphs, and normalizing '8'/'9' to use 'c' variable will restore shader compilation, enabling the INPUT ZONE text rendering for vision model OCR extraction of natural language commands.	5	1	KEEP
1774409006.341	Modify the GPU initialization code to ensure that the GPU is correctly initialized and accessible from within the VM. Test with a basic workload to see if there is an improvement in performance.	30	0	REVERT
1774409070.683	Modify the GPU initialization code to ensure that the GPU is correctly initialized and accessible from within the VM. Test with a basic workload to see if there is an improvement in performance.	30	0	REVERT
1774409134.809	Modify the GPU initialization code to ensure that the GPU is correctly initialized and accessible from within the VM. Test with a basic workload to see if there is an improvement in performance.	30	0	REVERT
1774409198.68	Check for and correct any missing or corrupted system libraries or drivers. Then, attempt to enable and configure the GPU with a basic workload to see if there is an improvement in performance.	30	0	REVERT
1774409262.731	Modify the GPU initialization code to ensure that the GPU is correctly initialized and accessible from within the VM. Test with a basic workload to see if there is an improvement in performance.	30	0	REVERT
1774409326.479	Review and update the environment variables and paths to ensure they are correctly configured. Test with a basic workload to see if there is an improvement in performance.	30	0	REVERT
1774409344.609	We can optimize the rendering functions by reducing redundant calculations and using more efficient data structures for the font bitmaps. This should improve performance and allow for easier updates to the font set.	5	1	KEEP
1774409390.21	Review and update the environment variables and paths to ensure they are correctly configured. Test with a basic workload to see if there is an improvement in performance.	30	0	REVERT
1774409454.396	Modify the GPU initialization code to ensure that the GPU is correctly initialized and accessible from within the VM. Test with a basic workload to see if there is an improvement in performance.	30	0	REVERT
1774409494.738	Simplify the boundary check functions and optimize the font rendering logic to reduce redundancy and improve performance.	5	1	KEEP
1774409518.513	Modify the virtual memory management settings to ensure that the virtual memory is correctly configured and accessible from within the VM. Test with a basic workload to see if there is an improvement in performance.	30	0	REVERT
1774409582.59	Modify the virtual disk management settings to ensure that the virtual disks are correctly configured and accessible from within the VM. Test with a basic workload to see if there is an improvement in performance.	30	0	REVERT
1774409589.23	Remove the incomplete duplicate get_font_column function and the orphaned duplicate code block. The proper get_font_column implementation later in the file handles full ASCII with correct 5x7 bitmap column lookups. This will fix OCR accuracy for natural language commands like 'add 5 and 3'.	5	1	KEEP
1774409646.637	Modify the network configuration to ensure that the network is correctly configured and accessible from within the VM. Test with a basic workload to see if there is an improvement in performance.	30	0	REVERT
1774409710.536	Modify the file system configuration to ensure that the file system is correctly configured and accessible from within the VM. Test with a basic workload to see if there is an improvement in performance.	30	0	REVERT
1774409749.272	We need to optimize the text rendering logic by reducing redundant calculations and simplifying conditional checks. Additionally, we should ensure that the font bitmap access is efficient and avoids unnecessary memory accesses.	5	1	KEEP
1774409774.742	Modify the environment variable settings to ensure that all necessary environment variables are correctly set and accessible from within the VM. Test with a basic workload to see if there is an improvement in performance.	30	0	REVERT
1774409838.804	Modify the boot parameters to ensure that all necessary boot parameters are correctly set for the VM to load properly. Test with a basic workload to see if there is an improvement in performance.	30	0	REVERT
1774409843.102	Remove the buggy incomplete first implementation and keep only the corrected second version with proper 5x7 font column handling (pixel_col >= 5u check) and correct spacing logic (char_row >= 7u). This will fix text rendering in INPUT ZONE for vision model OCR extraction.	5	1	KEEP
1774409902.99	Modify the virtual memory configuration to ensure that the virtual memory is correctly configured and accessible from within the VM. Test with a basic workload to see if there is an improvement in performance.	30	0	REVERT
1774409932.6	Remove the duplicate code in render_input_zone_text and fix the character row calculation to properly map 5x7 glyphs. The local_row should use modulo 7 for glyph rows 0-6, with explicit line spacing handled separately. This ensures clean text rendering for vision model OCR extraction.	5	1	KEEP
1774409967.209	Modify the CPU configuration to ensure that the CPU is correctly configured and accessible from within the VM. Test with a basic workload to see if there is an improvement in performance.	30	0	REVERT
1774410031.354	Modify the network configuration to ensure that the network is correctly configured and accessible from within the VM. Test with a basic workload to see if there is an improvement in performance.	30	0	REVERT
1774410095.649	Modify the file system configuration to ensure that the file system is correctly configured and accessible from within the VM. Test with a basic workload to see if there is an improvement in performance.	30	0	REVERT
1774410117.423	Optimize the `render_input_zone_text` function by reducing the number of individual pixel checks and use a more efficient font representation in the `get_font_column` function.	5	1	KEEP
1774410159.942	Modify the VMM configuration to ensure that the VMM is correctly configured and accessible from within the VM. Test with a basic workload to see if there is an improvement in performance.	30	0	REVERT
1774410198.029	Remove the duplicate orphaned code block after render_input_zone_text's closing brace to restore shader compilation. This will enable INPUT ZONE rendering for natural language commands like 'add 5 and 3' to be captured by qwen3-vl-8b.	5	1	KEEP
1774410224.189	Modify the VMM configuration to ensure that the VMM is correctly configured and accessible from within the VM. Test with a basic workload to see if there is an improvement in performance.	30	0	REVERT
1774410261.25	Completing the truncated '7' glyph and adding missing '8' and '9' glyphs will enable full numeric input support for natural language commands, allowing the vision model to correctly OCR user input and the LLM to generate valid opcodes.	5	1	KEEP
1774410288.326	Modify the CPU configuration to ensure that the CPU is correctly configured and accessible from within the VM. Test with a basic workload to see if there is an improvement in performance.	30	0	REVERT
1774410352.633	Modify the VMM configuration to ensure that the VMM is correctly configured and accessible from within the VM. Test with a basic workload to see if there is an improvement in performance.	30	0	REVERT
1774410416.849	Modify the memory management configuration to ensure that the memory is correctly configured and accessible from within the VM. Test with a basic workload to see if there is an improvement in performance.	30	0	REVERT
1774410427.066	We can improve the shader performance by simplifying the text rendering logic and optimizing the font column retrieval.	5	1	KEEP
1774410481.125	Modify the VMM configuration to ensure that the VMM is correctly configured and accessible from within the VM. Test with a basic workload to see if there is an improvement in performance.	30	0	REVERT
1774410531.049	Removing the duplicate code block will restore shader compilation, enabling proper INPUT ZONE text rendering so qwen3-vl-8b can extract commands like 'add 5 and 3' with 100% accuracy.	5	1	KEEP
1774410545.413	Modify the VMM configuration to ensure that the VMM is correctly configured and accessible from within the VM. Test with a basic workload to see if there is an improvement in performance.	30	0	REVERT
1774410609.656	Modify the VMM configuration to ensure that the VMM is correctly configured and accessible from within the VM. Test with a basic workload to see if there is an improvement in performance.	30	0	REVERT
1774410674.113	Modify the VMM configuration to ensure that the VMM is correctly configured and accessible from within the VM. Test with a basic workload to see if there is an improvement in performance.	30	0	REVERT
1774410731.898	Simplify the text rendering logic by reducing the number of conditional checks and minimizing the complexity of font bit extraction.	5	1	KEEP
1774410738.203	Modify the VMM configuration to ensure that the VMM is correctly configured and accessible from within the VM. Test with a basic workload to see if there is an improvement in performance.	30	0	REVERT
1774410802.012	Review and update the VM initialization scripts to ensure that all required files are present and correctly referenced. Test with a basic workload to evaluate any improvements in performance.	30	0	REVERT
1774410866.205	Review and update both the VMM settings and VM initialization scripts to ensure that all required files are present, correctly referenced, and the VMM is properly configured. Test with a basic workload to evaluate any improvements in performance.	45	0	REVERT
1774410875.086	Consolidate the duplicate/partial function implementations into a single correct render_input_zone_text function that properly handles 5x7 font rendering with line spacing for natural language input display.	5	1	KEEP
1774410930.397	Conduct a thorough check of the file system and storage subsystem to identify any corrupt files, inaccessible directories, or other issues. Modify the VM initialization scripts to ensure proper handling of the storage subsystem during VM startup.	60	0	REVERT
1774410968.745	Complete the render_input_zone_text function to enable natural language command rendering in INPUT ZONE (rows 450-474) with cyan color for high OCR contrast, and fix the duplicate/unreachable font code for digits 8-9.	5	1	KEEP
1774411054.505	Conduct a diagnostic scan of the disk or SSD connected to the VM using built-in tools to identify any failing sectors or bad connections. Modify the VM initialization scripts to handle potential storage subsystem failures during startup.	60	0	REVERT
1774411118.7	Conduct a diagnostic scan of the disk or SSD connected to the VM using built-in tools to identify any failing sectors or bad connections. Modify the VM initialization scripts to handle potential storage subsystem failures during startup.	60	0	REVERT
1774411168.339	Improve the efficiency of the INPUT ZONE boundary detection and optimize the font rendering logic to handle larger text inputs more effectively.	5	1	KEEP
1774411182.703	Conduct a diagnostic scan of the disk or SSD connected to the VM using built-in tools to identify any failing sectors or bad connections. Modify the VM initialization scripts to handle potential storage subsystem failures during startup.	60	0	REVERT
1774411227.765	Fix the function by properly incorporating the boundary check logic inside the function body, ensuring rows 449 (top) and 480 (bottom) return correct boundary markers for vision model detection.	5	1	KEEP
1774411246.773	Conduct a diagnostic scan of the disk or SSD connected to the VM using built-in tools to identify any failing sectors or bad connections. Modify the VM initialization scripts to handle potential storage subsystem failures during startup.	60	0	REVERT
1774411311.158	Conduct a thorough check of the network configuration and driver settings to ensure proper communication between the VM and the storage subsystem. Modify the network initialization scripts to handle potential network-related failures during startup.	60	0	REVERT
1774411367.95	Adding a dark background panel to the INPUT ZONE and a blinking cursor indicator will significantly improve OCR accuracy for qwen3-vl-8b extraction and provide better user feedback for natural language input.	5	1	KEEP
1774411375.281	Conduct a detailed review and analysis of the file system configuration and VM initialization scripts to identify any potential software-related misconfigurations. Modify the scripts to correct identified issues and ensure proper execution.	60	0	REVERT
1774411439.306	Conduct a detailed review and analysis of the file system configuration and VM initialization scripts to identify any potential software-related misconfigurations. Modify the scripts to correct identified issues and ensure proper execution.	60	0	REVERT
1774411503.757	Update the VM's firmware to the latest version and check if it resolves the 'File not found' errors. Additionally, verify if there are any available BIOS updates that can be applied to improve storage subsystem performance. Modify the VM configuration scripts to incorporate these updates during initialization.	60	0	REVERT
1774411525.771	By optimizing the text rendering logic and reducing redundant calculations, we can improve the overall performance of the shader.	5	1	KEEP
1774411807.952	Conduct a detailed analysis of the memory management subsystem in the VM to identify any potential issues such as misconfigured page tables, memory leaks, or other memory-related errors. Modify the memory management scripts to correct identified issues and ensure proper execution.	60	0	REVERT
1774411872.514	Conduct a thorough analysis of the virtual storage subsystem to identify any potential issues such as misconfigured disk images or file system corruption. Modify the storage initialization scripts to correct identified issues and ensure proper execution.	60	0	REVERT
1774411937.349	Conduct a detailed analysis of the VM's execution environment and runtime configuration to identify any potential issues such as incorrect environment variables, misconfigured system paths, or other runtime-related errors. Modify the VM initialization scripts to correct identified issues and ensure proper execution.	60	0	REVERT
1774412001.854	Conduct a detailed analysis of the file system permissions and access controls to identify any potential issues such as incorrect user permissions, missing directories, or other access-related errors. Modify the file system initialization scripts to correct identified issues and ensure proper execution.	60	0	REVERT
1774412066.757	Conduct a detailed analysis of the VM's logging and debugging mechanisms to identify any potential issues such as misconfigured log levels, missing log files, or other logging-related errors. Modify the VM initialization scripts to correct identified issues and ensure proper execution.	60	0	REVERT
1774412131.491	Conduct a detailed analysis of the VM's file system implementation to identify any potential issues such as bugs in the file system code, misconfigured file system parameters, or other file system-related errors. Modify the file system code to correct identified issues and ensure proper execution.	60	0	REVERT
1774412195.87	Conduct a detailed analysis of the VM's memory management to identify any potential issues such as bugs in the memory management code, misconfigured memory parameters, or other memory-related errors. Modify the memory management code to correct identified issues and ensure proper execution.	60	0	REVERT
1774412260.166	Conduct a detailed analysis of the VM's storage subsystem and virtual storage configuration to identify any potential issues such as misconfigured storage settings, missing storage volumes, or other storage-related errors. Modify the virtual storage configuration to correct identified issues and ensure proper execution.	60	0	REVERT
1774412324.455	Conduct a detailed analysis of the VM's runtime configuration and environment variables to identify any potential issues such as misconfigured environment settings, missing environment variables, or other runtime-related errors. Modify the runtime configuration and environment variables to correct identified issues and ensure proper execution.	60	0	REVERT
1774412388.507	Conduct a detailed analysis of the VM's network configuration to identify any potential issues such as misconfigured network settings, missing network interfaces, or other network-related errors. Modify the network configuration to correct identified issues and ensure proper execution.	60	0	REVERT
1774412452.951	Conduct a detailed analysis of the VM's initialization scripts to identify any potential issues such as bugs in the initialization scripts, misconfigured script parameters, or other script-related errors. Modify the initialization scripts to correct identified issues and ensure proper execution.	60	0	REVERT
1774412517.608	Conduct a detailed analysis of the VM's file system implementation to identify any potential issues such as bugs in the file system code, misconfigured file system parameters, or other file system-related errors. Modify the file system code to correct identified issues and ensure proper execution.	60	0	REVERT
1774412581.966	Conduct a detailed analysis of the VM's memory management to identify any potential issues such as bugs in the memory manager, misconfigured memory parameters, or other memory-related errors. Modify the memory management code to correct identified issues and ensure proper execution.	60	0	REVERT
1774412646.408	Conduct a detailed analysis of the VM's storage subsystem configuration to identify any potential issues such as misconfigured storage parameters, missing storage devices, or other storage-related errors. Modify the storage subsystem configuration to correct identified issues and ensure proper execution.	60	0	REVERT
1774412710.684	Conduct a detailed analysis of the VM's environment variables to identify any potential issues such as misconfigured environment variables, missing necessary environment settings, or other environment-related errors. Modify the environment variables to correct identified issues and ensure proper execution.	60	0	REVERT
1774412775.082	Conduct a detailed analysis of the VM's network configuration to identify any potential issues such as misconfigured network parameters, missing network devices, or other network-related errors. Modify the network configuration to correct identified issues and ensure proper execution.	60	0	REVERT
1774412839.557	Conduct a detailed analysis of the VM's runtime configuration to identify any potential issues such as misconfigured runtime parameters, missing necessary runtime settings, or other runtime-related errors. Modify the runtime configuration to correct identified issues and ensure proper execution.	60	0	REVERT
1774412903.975	Conduct a detailed analysis of the VM's file system implementation to identify any potential issues such as bugs in the file system code, misconfigured file system parameters, or other file system-related errors. Modify the file system code to correct identified issues and ensure proper execution.	60	0	REVERT
1774412968.192	Conduct a detailed analysis of the VM's initialization process to identify any potential issues such as misconfigured initialization parameters, missing necessary initialization steps, or other initialization-related errors. Modify the initialization process to correct identified issues and ensure proper execution.	60	0	REVERT
1774413032.786	Conduct a detailed analysis of the VM's disk I/O subsystem to identify any potential issues such as misconfigured I/O parameters, missing necessary I/O devices, or other I/O-related errors. Modify the disk I/O configuration to correct identified issues and ensure proper execution.	60	0	REVERT
1774413097.22	Conduct a detailed analysis of the VM's memory management to identify any potential issues such as memory leaks, insufficient memory allocation, or other memory-related errors. Modify the memory management code to correct identified issues and ensure proper execution.	60	0	REVERT
1774413161.622	Conduct a detailed analysis of the VM's network subsystem to identify any potential issues such as misconfigured network parameters, missing necessary network devices, or other network-related errors. Modify the network configuration to correct identified issues and ensure proper execution.	60	0	REVERT
1774413226.025	Conduct a detailed analysis of the VM's file system implementation to identify any potential issues such as bugs in the file system code, misconfigured file system parameters, or other file system-related errors. Modify the file system code to correct identified issues and ensure proper execution.	60	0	REVERT
