timestamp	hypothesis	baseline	metric	status
1774461673.131	Centering the 7-pixel tall text vertically within the 25-row INPUT ZONE (rows 450-474) and clamping char_row to valid 0-6 range will fix font rendering, enabling qwen3-vl-8b to achieve 100% text extraction accuracy for natural language commands.	5	1	KEEP
1774461713.323	Refactor the VM's codebase to reduce memory usage. This should help in improving overall performance by optimizing resource utilization during high load demands.	60	0	REVERT
1774461778.023	Refactor the VM's codebase to implement caching for frequently accessed data. This should help in improving overall performance by reducing disk I/O and optimizing resource utilization during high load demands.	60	0	REVERT
1774461842.445	Refactor the VM's codebase to implement parallel processing for various tasks. This should help in improving overall performance by reducing contention and optimizing resource utilization during high load demands.	60	0	REVERT
1774461879.372	Standardizing all INPUT ZONE backgrounds to pure black (0,0,0) will maximize OCR contrast ratio and improve vision model extraction accuracy toward the 100% target.	5	1	KEEP
1774461906.539	Refactor the VM's codebase to optimize file system operations. This should help in improving overall performance by reducing contention and optimizing resource utilization during high load demands.	60	0	REVERT
1774461970.77	Refactor the VM's codebase to simplify complex code paths. This should help in improving overall performance by reducing complexity and minimizing bottlenecks during high load demands.	60	0	REVERT
1774462011.376	We need to add a pipeline that extracts text from the input zone using the vision model, translates the extracted text into VM opcodes using the LLM, and then patches the agent's memory atomically. This should be done in a way that minimizes latency and maintains performance.	5	1	KEEP
1774462034.66	Refactor the VM's codebase to enhance inter-component communication and coordination mechanisms. This should help in improving overall performance by reducing bottlenecks during high load demands.	60	0	REVERT
1774462098.458	Refactor the VM's codebase to reduce unnecessary memory allocations. This should help in improving overall performance by freeing up resources for other critical processes during high load demands.	60	0	REVERT
1774462120.48	Complete the render_patch_status function with full status message rendering (N/A, PATCH_SUCCESS, PATCH_FAILED) with appropriate color coding. Also optimize get_font_column by caching the bit-shift result to reduce ALU operations per-pixel from 4 to 3 shifts.	5	1	KEEP
1774462162.563	Refactor the VM's codebase to implement caching mechanisms for frequently accessed files. This should help in improving overall performance by reducing disk I/O and optimizing resource utilization during high load demands.	60	0	REVERT
1774462226.211	Refactor the VM's codebase to parallelize operations. This should help in improving overall performance by distributing workload across multiple CPU cores during high load demands.	60	0	REVERT
1774462256.191	Improving the `render_input_zone_text` function to handle edge cases more robustly and ensuring consistent text rendering will enhance the OCR accuracy and overall performance of the shader.	5	1	KEEP
1774462290.223	Refactor the VM's codebase to optimize algorithms for file access operations. This should help in improving overall performance by reducing execution time and minimizing resource contention during high load demands.	60	0	REVERT
1774462354.422	Refactor the VM's codebase to simplify complex code paths, particularly those related to file access operations. This should help in improving overall performance by reducing complexity and minimizing potential bottlenecks during high load demands.	60	0	REVERT
1774462418.682	Refactor the VM's codebase to implement an advanced caching strategy that includes both in-memory caching and disk-based caching with efficient eviction policies. This should help in improving overall performance by reducing disk I/O and optimizing resource utilization during high load demands.	60	0	REVERT
1774462483.27	Refactor the VM's codebase to implement an advanced memory management strategy that includes both local and global memory pools with efficient allocation and deallocation policies. This should help in improving overall performance by reducing memory fragmentation and optimizing resource utilization during high load demands.	60	0	REVERT
1774462547.288	Refactor the VM's codebase to reduce memory usage. This should help in improving overall performance by minimizing resource contention and reducing overhead during high load demands.	60	0	REVERT
1774462611.097	Refactor the VM's codebase to parallelize operations where possible. This should help in improving overall performance by reducing execution time during high load demands.	60	0	REVERT
1774462675.164	Refactor the VM's codebase to optimize data structures used for file system operations. This should help in improving overall performance by reducing memory usage and improving access times during high load demands.	60	0	REVERT
1774462738.841	Implement a more robust inter-component communication protocol that ensures efficient data exchange and reduces contention. This should help in improving overall performance by making better use of available resources.	60	0	REVERT
1774462802.844	Refactor the VM's codebase to simplify complex code paths. This should help in improving overall performance by reducing complexity and improving execution efficiency during high load demands.	60	0	REVERT
1774462866.608	Implement a caching mechanism for frequently accessed files and data within the VM. This should help in improving overall performance by reducing disk I/O and increasing access times during high load demands.	60	0	REVERT
1774462930.29	Refactor the VM's codebase to reduce unnecessary memory allocations. This should help in improving overall performance by freeing up resources for more efficient execution during high load demands.	60	0	REVERT
1774462994.353	Implement parallel processing in the file system operations within the VM. This should help in improving overall performance by reducing contention and allowing for concurrent execution, thus making better use of available resources during high load demands.	60	0	REVERT
1774463058.024	Refactor and optimize the algorithms used for VM execution. This should help in improving overall performance by reducing complexity and improving efficiency during high load demands.	60	0	REVERT
1774463121.75	Refactor the VM's inter-component communication mechanisms to reduce contention and improve efficiency. This should help in improving overall performance by making better use of available resources during high load demands.	60	0	REVERT
1774463172.891	Remove the orphaned duplicate code block that exists outside function scope. This will restore shader compilation and enable the INPUT ZONE rendering pipeline.	5	1	KEEP
1774463185.519	Refactor the VM's codebase to simplify complex code paths. This should help in improving overall performance by reducing complexity and increasing efficiency during high load demands.	60	0	REVERT
1774463249.55	Implement caching mechanisms within the VM's file system to reduce disk I/O operations during high load demands. This should help in improving overall performance by making better use of available resources and reducing latency associated with frequent disk accesses.	60	0	REVERT
1774463313.391	Refactor the VM's memory management system to improve efficiency. This should help in improving overall performance by reducing contention and making better use of available resources during high load demands.	60	0	REVERT
1774463377.124	Refactor the VM to enable parallel processing of tasks. This should help in improving overall performance by utilizing multiple processing units simultaneously and reducing execution time during high load demands.	60	0	REVERT
1774463441.299	Refactor the VM's data structures to be more efficient, focusing on reducing contention and improving access times. This should help in improving overall performance by making better use of available resources during high load demands.	60	0	REVERT
1774463505.546	Implement caching mechanisms within the VM's file system in combination with an optimized memory management strategy. This should help in improving overall performance by reducing contention, improving access times, and making better use of available resources during high load demands.	60	0	REVERT
1774463569.278	Refactor the VM's file system operations to simplify code paths. This should help in improving overall performance by reducing complexity and potentially improving execution efficiency.	60	0	REVERT
1774463633.316	Refactor the VM to reduce memory usage by optimizing data structures and eliminating unnecessary allocations. This should help in improving overall performance by freeing up resources for other critical operations during high load demands.	60	0	REVERT
1774463697.729	Refactor the VM's task scheduling algorithm to be more efficient. This should help in improving overall performance by ensuring that tasks are executed in an optimal order, reducing contention, and improving access times during high load demands.	60	0	REVERT
1774463761.834	Implement parallel processing capabilities within the VM's file system operations. This should help in improving overall performance by reducing contention, allowing for better use of available resources during high load demands, and potentially improving execution efficiency.	60	0	REVERT
1774463826.137	Implement caching mechanisms within the VM's file system in combination with an optimized task scheduling algorithm. This should help in improving overall performance by reducing contention, improving access times, and making better use of available resources during high load demands.	60	0	REVERT
1774463889.974	Refactor the VM's file system operations to simplify code paths. This should help in improving overall performance by reducing complexity and potentially improving execution efficiency.	60	0	REVERT
1774463953.671	Refactor the VM's memory management algorithms to be more efficient. This should help in improving overall performance by ensuring efficient use of resources and reducing contention.	60	0	REVERT
1774464017.547	Refactor the VM's data structures to reduce memory usage. This should help in improving overall performance by ensuring efficient use of resources and reducing contention.	60	0	REVERT
1774464081.357	Refactor the VM's task scheduler to simplify code paths. This should help in improving overall performance by reducing complexity and potentially improving execution efficiency.	60	0	REVERT
1774464145.422	Implement parallel processing for operations within the VM's file system. This should help in improving overall performance by reducing contention, improving access times, and making better use of available resources during high load demands.	60	0	REVERT
1774464209.437	Add caching mechanisms to the VM's file system. This should help in improving overall performance by reducing the number of disk accesses, improving access times, and making better use of available resources during high load demands.	60	0	REVERT
1774464273.247	Refactor the VM's communication protocols to optimize inter-component coordination. This should help in improving overall performance by reducing contention and improving access times, thereby making better use of available resources during high load demands.	60	0	REVERT
1774464294.088	Removing the orphaned duplicate code block will restore shader compilation, enabling GPU pipeline and INPUT ZONE text rendering for vision-to-opcode pipeline	5	1	KEEP
1774464337.31	Implement caching mechanisms along with parallel processing for operations within the VM's file system. This should help in improving overall performance by reducing contention, improving access times, and making better use of available resources during high load demands.	60	0	REVERT
1774464401.484	Refactor the VM's memory management data structures to optimize resource allocation and deallocation. This should help in improving overall performance by reducing contention, improving access times, and making better use of available resources during high load demands.	60	0	REVERT
1774464465.568	Refactor the VM's file system operations to simplify code paths. This should help in improving overall performance by reducing complexity, improving access times, and making better use of available resources during high load demands.	60	0	REVERT
1774464529.743	Refactor the VM's memory management system to incorporate caching mechanisms. This should help in improving overall performance by reducing contention, improving access times, and making better use of available resources during high load demands.	60	0	REVERT
1774464594.028	Refactor the VM's communication protocols to optimize inter-component coordination. This should help in improving overall performance by reducing contention and improving access times, thereby making better use of available resources during high load demands.	60	0	REVERT
1774464658.146	Optimize memory usage in the VM's architecture. This should help in reducing contention, improving access times, and making better use of available resources during high load demands.	60	0	REVERT
1774464723.256	Refactor the VM's operation execution to enable parallel processing. This should help in improving overall performance by reducing contention, improving access times, and making better use of available resources during high load demands.	60	0	REVERT
1774464754.384	Simplify the `render_input_zone_text` function by removing redundant checks and optimizing the `get_font_column` function for faster execution.	5	1	KEEP
1774464787.243	Refactor the VM's file system to simplify data structures. This should help in improving overall performance by reducing complexity, improving access times, and making better use of available resources during high load demands.	60	0	REVERT
1774464797.406	Removing the duplicate orphaned code block will restore shader compilation. The original function is complete and correct; the duplicate is likely a copy-paste artifact that was partially deleted but not fully removed.	5	1	KEEP
1774464851.183	Refactor the VM's scheduling algorithm to implement an efficient prioritization strategy. This should help in improving overall performance by optimizing task prioritization, thereby reducing contention during high load demands.	60	0	REVERT
1774464868.366	Remove orphaned duplicate code block to restore valid WGSL syntax, enabling proper INPUT ZONE rendering for qwen3-vl-8b text extraction and LLM opcode generation pipeline	5	1	KEEP
1774464907.363	Removing the corrupted duplicate closing block will restore shader compilation and enable the INPUT ZONE text rendering pipeline for vision-to-opcode extraction.	5	1	KEEP
1774464915.838	Refactor the VM's communication protocols to optimize inter-component coordination. This should help in improving overall performance by reducing contention and improving access times, thereby making better use of available resources during high load demands.	60	0	REVERT
1774464979.624	Refactor the VM to include caching mechanisms for frequently accessed files and operations. This should help in improving overall performance by reducing redundant computations, minimizing latency, and optimizing resource usage during high load demands.	60	0	REVERT
1774465043.323	Refactor the VM's memory allocation strategy to optimize resource usage. This should help in improving overall performance by reducing fragmentation, optimizing access times, and making better use of available resources during high load demands.	60	0	REVERT
1774465107.209	Implement parallel processing capabilities within the VM. This should help in improving overall performance by utilizing available resources more efficiently during high load demands.	60	0	REVERT
1774465141.878	Adding an early row-range check at the start of get_input_zone_boundary will eliminate boundary computation for 95%+ of pixels (those outside rows 448-481), reducing per-pixel ALU by ~10 ops and improving render loop throughput to maintain 60 FPS while the vision-to-opcode pipeline runs.	5	1	KEEP
1774465171.023	Refactor the VM's code paths to simplify complex operations. This should help in improving overall performance by reducing complexity, thereby minimizing execution time during high load demands.	60	0	REVERT
1774465234.943	Refactor the VM's data structures to optimize concurrent access. This should help in improving overall performance by reducing contention and improving access times, thereby making better use of available resources during high load demands.	60	0	REVERT
1774465270.381	Refine the early-out checks and optimize the font rendering logic to improve performance and maintain 60 FPS in the GPU render loop.	5	1	KEEP
1774465299.131	Implement a JIT compiler within the VM to optimize code at runtime based on actual execution patterns. This should help in improving overall performance by reducing the overhead of static compilation and improving resource utilization during high load demands.	60	0	REVERT
1774465331.914	Remove the orphaned duplicate code block (duplicate of get_input_zone_boundary body) and truncated function stub to restore valid WGSL syntax. The get_font_column function is already properly defined earlier in the file.	5	1	KEEP
1774465362.937	Implement caching mechanisms within the VM. This should help in improving overall performance by reducing redundant calculations and data retrieval times, thereby making better use of available resources during high load demands.	60	0	REVERT
1774465403.295	Remove the corrupted duplicate function and properly declare font_atlas binding at module scope. The first get_font_column definition is correct; the second is garbage that breaks shader compilation and causes GPU OFFLINE status.	5	1	KEEP
1774465426.819	Optimize memory usage within the VM. This should help in improving overall performance by freeing up resources for other operations, thereby making better use of available resources during high load demands.	60	0	REVERT
1774465471.363	Remove the duplicate function definition and enhance the single render_input_zone_text function to support multi-line text rendering (up to 3 lines of input) within rows 450-474, improving OCR extraction accuracy while maintaining 60 FPS performance through early-out optimizations.	5	1	KEEP
1774465491.055	Refactor the VM's code paths to enable parallel execution of tasks. This should help in improving overall performance by utilizing multiple cores or threads more efficiently, thereby making better use of available resources during high load demands.	60	0	REVERT
1774465555.143	Integrate caching mechanisms within the VM and optimize the data structures used for concurrent access. This should help in improving overall performance by reducing redundant calculations and data retrieval times, thereby making better use of available resources during high load demands.	60	0	REVERT
1774465618.934	Refactor the VM's code paths to simplify them. This should help in improving overall performance by reducing complexity and improving resource utilization, thereby making better use of available resources during high load demands.	60	0	REVERT
1774465683.133	Integrate caching mechanisms within the VM and enable parallel execution of tasks. This should help in improving overall performance by reducing redundant calculations and data retrieval times, thereby making better use of available resources during high load demands.	60	0	REVERT
1774465690.096	We need to add a pipeline that extracts text from the INPUT ZONE using the vision model, converts the extracted text into valid VM opcodes using an LLM, and then patches the agent's memory atomically to display the result in the HUD zone.	5	1	KEEP
1774465746.941	Enable GPU support within the VM to leverage its parallel processing capabilities. This should help in improving overall performance, especially during high load demands involving concurrent file access operations.	60	0	REVERT
1774465810.807	Refactor the VM's code to optimize memory management. This should help in improving overall performance by reducing resource contention and making better use of available resources during high load demands involving concurrent file access operations.	60	0	REVERT
1774465875.514	Integrate caching mechanisms within the VM, optimize the data structures used for concurrent access, and enable parallel execution of tasks. This should help in improving overall performance by reducing redundant calculations and data retrieval times, thereby making better use of available resources during high load demands.	60	0	REVERT
1774465908.523	Remove the erroneous duplicate function definition with placeholder host-side logic. The first render_input_zone_text implementation is complete and correct - it properly extracts chars from packed input_buffer, renders 5x7 font with OCR-optimized contrast (pure white on black), and includes blinking cursor. Host system reads input_buffer binding directly for vision model extraction.	5	1	KEEP
1774465939.327	Refactor the VM's code to parallelize operations. This should help in improving overall performance by efficiently utilizing multiple cores or threads, thereby making better use of available resources during high load demands involving concurrent file access operations.	60	0	REVERT
1774466003.372	Refactor the VM's code to implement a more sophisticated scheduling algorithm. This should help in improving overall performance by making better use of available resources during high load demands involving concurrent file access operations.	60	0	REVERT
1774466029.308	Improving the early-out checks and optimizing the font rendering logic can help reduce ALU usage and improve overall performance.	5	1	KEEP
