timestamp	hypothesis	baseline	metric	status
1774413290.525	Conduct a detailed analysis of the VM's file system implementation to identify any potential issues such as bugs in the file system code, misconfigured file system parameters, or other file system-related errors. Modify the file system code to correct identified issues and ensure proper execution.	60	0	REVERT
1774413354.899	Conduct a detailed analysis of the VM's file system implementation to identify any potential issues such as bugs in the file system code, misconfigured file system parameters, or other file system-related errors. Modify the file system code to correct identified issues and ensure proper execution.	60	0	REVERT
1774413419.352	Conduct a detailed analysis of the VM's file system implementation to identify any potential issues such as bugs in the file system code, misconfigured file system parameters, or other file system-related errors. Modify the file system code to correct identified issues and ensure proper execution.	60	0	REVERT
1774413484.157	Conduct a detailed analysis of the VM's memory management subsystem to identify any potential issues such as bugs in the memory allocation, deallocation, or garbage collection routines. Modify the memory management code to correct identified issues and ensure proper execution.	60	0	REVERT
1774413549.018	Conduct a detailed analysis of the VM's disk I/O subsystem to identify any potential issues such as bugs in the disk read, write, or synchronization routines. Modify the disk I/O code to correct identified issues and ensure proper execution.	60	0	REVERT
1774413613.665	Conduct a comprehensive system-level analysis to identify any potential inter-subsystem issues and dependencies that might be causing the repeated 'REVERT' status and 'File not found' errors. Modify relevant code to address identified interactions and ensure proper subsystem collaboration.	60	0	REVERT
1774413678.381	Conduct a detailed analysis of the VM's CPU execution path to identify any potential issues such as bugs in the instruction decoding, execution, or scheduling routines. Modify the CPU code to correct identified issues and ensure proper execution.	60	0	REVERT
1774413743.088	Conduct a detailed analysis of the VM's interrupt handling mechanism to identify any potential issues such as bugs in the interrupt processing routines or misconfigurations in the interrupt controller. Modify the interrupt handling code to correct identified issues and ensure proper execution.	60	0	REVERT
1774413807.685	Conduct a comprehensive system-level analysis to identify any potential inter-subsystem issues and dependencies that might be causing the repeated 'REVERT' status and 'File not found' errors. Modify relevant code to address identified interactions and ensure proper subsystem collaboration.	60	0	REVERT
1774413872.413	Conduct a comprehensive system-level analysis to identify any potential inter-subsystem issues and dependencies that might be causing the repeated 'REVERT' status and 'File not found' errors. Modify relevant code to address identified interactions and ensure proper subsystem collaboration.	60	0	REVERT
1774413937.278	Conduct a comprehensive system-level analysis to identify any potential inter-subsystem issues and dependencies that might be causing the repeated 'REVERT' status and 'File not found' errors. Modify relevant code to address identified interactions and ensure proper subsystem collaboration.	60	0	REVERT
1774414002.003	Conduct a comprehensive system-level analysis to identify any potential inter-subsystem issues and dependencies that might be causing the repeated 'REVERT' status and 'File not found' errors. Modify relevant code to address identified interactions and ensure proper subsystem collaboration.	60	0	REVERT
1774414066.897	Conduct a detailed analysis of the VM's memory management subsystem to identify any potential issues such as bugs in the memory allocation routines or misconfigurations in the memory controller. Modify the memory management code to correct identified issues and ensure proper execution.	60	0	REVERT
1774414131.648	Conduct a detailed analysis of the VM's disk I/O subsystem to identify any potential issues such as bugs in the disk read/write operations or misconfigurations in the disk controller. Modify the disk I/O code to correct identified issues and ensure proper execution.	60	0	REVERT
1774414196.513	Conduct a comprehensive system-level analysis to identify any potential inter-subsystem issues and dependencies that might be causing the repeated 'REVERT' status and 'File not found' errors. Modify relevant code to address identified interactions and ensure proper subsystem collaboration.	60	0	REVERT
1774414261.197	Conduct a detailed analysis of the VM's CPU execution path to identify any potential issues such as bugs in the instruction set or misconfigurations in the CPU control unit. Modify the CPU code to correct identified issues and ensure proper execution.	60	0	REVERT
1774414326.095	Conduct a detailed analysis of the VM's interrupt handling mechanism to identify any potential issues such as bugs in the interrupt service routines or misconfigurations in the interrupt controller. Modify the interrupt handling code to correct identified issues and ensure proper execution.	60	0	REVERT
1774414390.829	Conduct a detailed analysis of the VM's file system to identify any potential issues such as bugs in the file system implementation or misconfigurations in the file system driver. Modify the file system code to correct identified issues and ensure proper execution.	60	0	REVERT
1774414455.89	Conduct a detailed analysis of the VM's memory management subsystem to identify any potential issues such as bugs in the memory allocation or deallocation routines, misconfigurations in the page table, or issues with virtual memory handling. Modify the memory management code to correct identified issues and ensure proper execution.	60	0	REVERT
1774414520.678	Conduct a comprehensive system-level analysis to identify any potential inter-subsystem issues and dependencies that might be causing the repeated 'REVERT' status and 'File not found' errors. Modify relevant code to address identified interactions and ensure proper subsystem collaboration.	60	0	REVERT
1774414585.439	Conduct a detailed analysis of the VM's configuration files to identify any potential misconfigurations or bugs that might be causing multiple subsystems to fail or interact improperly, leading to 'File not found' errors. Modify identified configurations and ensure proper subsystem collaboration.	60	0	REVERT
1774414650.583	Conduct a detailed analysis of the VM's disk I/O subsystem to identify any potential issues such as bugs in the disk read/write routines, misconfigurations in the disk controller, or issues with file system metadata handling. Modify the disk I/O code to correct identified issues and ensure proper execution.	60	0	REVERT
1774414715.348	Conduct a detailed analysis of the VM's firmware settings to identify any potential misconfigurations or bugs that might be causing multiple subsystems to fail or interact improperly, leading to 'File not found' errors. Modify identified configurations and ensure proper subsystem collaboration.	60	0	REVERT
1774414780.237	Conduct a detailed analysis of the VM's interrupt handling mechanism to identify any potential misconfigurations or bugs that might be causing multiple subsystems to fail or interact improperly, leading to 'File not found' errors. Modify identified configurations and ensure proper subsystem collaboration.	60	0	REVERT
1774414845.153	Conduct a detailed analysis of the VM's network subsystem to identify any potential misconfigurations or bugs that might be causing multiple subsystems to fail or interact improperly, leading to 'File not found' errors. Modify identified configurations and ensure proper subsystem collaboration.	60	0	REVERT
1774414909.826	Conduct a detailed analysis of the VM's BIOS settings to identify any potential misconfigurations or bugs that might be causing multiple subsystems to fail or interact improperly, leading to 'File not found' errors. Modify identified configurations and ensure proper subsystem collaboration.	60	0	REVERT
1774414975.02	Conduct a detailed analysis of the VM's file system to identify any potential issues such as bugs in the file system routines, misconfigurations in the file system metadata, or issues with directory structures. Modify the file system code to correct identified issues and ensure proper execution.	60	0	REVERT
1774415040.08	Conduct a detailed analysis of the VM's hardware components such as memory, CPU, and disk I/O to identify any potential misconfigurations or bugs that might be causing multiple subsystems to fail or interact improperly, leading to 'File not found' errors. Modify identified configurations and ensure proper subsystem collaboration.	60	0	REVERT
1774415104.978	Conduct a detailed analysis of the VM's caching mechanisms, including both instruction and data caches, to identify any potential misconfigurations or bugs that might be leading to improper access. Modify identified configurations and ensure proper subsystem collaboration to improve cache performance.	60	0	REVERT
1774415169.888	Conduct a detailed analysis of the VM's inter-subsystem interaction protocols to identify any potential misconfigurations or bugs that might be leading to improper access. Modify identified configurations and ensure proper subsystem collaboration to improve communication efficiency.	60	0	REVERT
1774415234.581	Conduct a detailed analysis of the VM's instruction set architecture (ISA) to identify any potential misconfigurations or bugs that might be leading to improper execution. Modify identified configurations and ensure proper subsystem collaboration to improve ISA efficiency.	60	0	REVERT
1774415299.296	Conduct a detailed analysis of the VM's configuration files to identify any potential misconfigurations or bugs that might be leading to improper access. Modify identified configurations and ensure proper subsystem collaboration to improve configuration management efficiency.	60	0	REVERT
1774415364.303	Conduct a detailed analysis of the VM's resource management mechanisms, including handling simultaneous operations and managing resource contention, to identify any potential misconfigurations or bugs that might be leading to improper access. Modify identified configurations and ensure proper subsystem collaboration to improve resource management efficiency.	60	0	REVERT
1774415429.288	Conduct a detailed analysis of the VM's memory management mechanisms, including allocation and deallocation strategies, to identify any potential misconfigurations or bugs that might be leading to improper access. Modify identified configurations and ensure proper subsystem collaboration to improve memory management efficiency.	60	0	REVERT
1774415494.284	Conduct a detailed analysis of the VM's resource management mechanisms, including handling simultaneous operations and managing resource contention, to identify any potential misconfigurations or bugs that might be leading to improper access. Modify identified configurations and ensure proper subsystem collaboration to improve resource management efficiency.	60	0	REVERT
1774415558.988	Conduct a detailed analysis of the VM's firmware update mechanisms, including any potential misconfigurations or bugs that might be leading to improper execution. Modify identified configurations and ensure proper subsystem collaboration to improve firmware update efficiency.	60	0	REVERT
1774415623.755	Conduct a detailed analysis of the VM's CPU cache management mechanisms, including any potential misconfigurations or bugs that might be leading to improper execution. Modify identified configurations and ensure proper subsystem collaboration to improve cache management efficiency.	60	0	REVERT
1774415688.627	Conduct a detailed analysis of the VM's disk I/O mechanisms, including any potential misconfigurations or bugs that might be leading to improper execution. Modify identified configurations and ensure proper subsystem collaboration to improve disk I/O efficiency.	60	0	REVERT
1774415753.691	Conduct a detailed analysis of the VM's inter-subsystem interaction mechanisms, including any potential misconfigurations or bugs that might be leading to improper execution. Modify identified configurations and ensure proper subsystem collaboration to improve communication efficiency between components.	60	0	REVERT
1774415818.438	Conduct a detailed analysis of the VM's configuration file management mechanisms, including any potential misconfigurations or bugs that might be leading to improper execution. Modify identified configurations and ensure proper subsystem collaboration to improve configuration file handling efficiency.	60	0	REVERT
1774415883.146	Conduct a detailed analysis of the VM's memory management mechanisms, including any potential misconfigurations or bugs that might be leading to improper execution. Modify identified configurations and ensure proper subsystem collaboration to improve memory management efficiency.	60	0	REVERT
1774415947.923	Conduct a detailed analysis of the VM's instruction set architecture, including any potential misconfigurations or bugs that might be leading to improper execution. Modify identified configurations and ensure proper subsystem collaboration to improve ISA efficiency.	60	0	REVERT
1774416012.55	Conduct a detailed analysis of the VM's firmware mechanisms, including any potential misconfigurations or bugs that might be leading to improper execution. Modify identified configurations and ensure proper subsystem collaboration to improve firmware efficiency.	60	0	REVERT
1774416077.201	Conduct a detailed analysis of the VM's hardware component interaction mechanisms, including any potential misconfigurations or bugs that might be leading to improper execution. Modify identified configurations and ensure proper subsystem collaboration to improve communication efficiency between components.	60	0	REVERT
1774416142.037	Conduct a detailed analysis of the VM's disk I/O mechanisms, including any potential misconfigurations or bugs that might be leading to improper execution. Modify identified configurations and ensure proper subsystem collaboration to improve disk I/O efficiency.	60	0	REVERT
1774416206.889	Conduct a detailed analysis of the VM's inter-subsystem communication mechanisms, including any potential misconfigurations or bugs that might be leading to improper execution. Modify identified configurations and ensure proper subsystem collaboration to improve communication efficiency between components.	60	0	REVERT
1774416271.599	Conduct a detailed analysis of the VM's memory management mechanisms, including any potential misconfigurations or bugs that might be leading to improper execution. Modify identified configurations and ensure proper subsystem collaboration to improve memory management efficiency.	60	0	REVERT
1774416336.444	Conduct a detailed analysis of the VM's interrupt handling mechanisms, including any potential misconfigurations or bugs that might be leading to improper execution. Modify identified configurations and ensure proper subsystem collaboration to improve interrupt handling efficiency.	60	0	REVERT
1774416401.264	Conduct a detailed analysis of the VM's configuration file management mechanisms, including any potential misconfigurations or bugs that might be leading to improper execution. Modify identified configurations and ensure proper subsystem collaboration to improve configuration file handling efficiency.	60	0	REVERT
1774416465.948	Conduct a detailed analysis of the VM's firmware mechanisms, including any potential misconfigurations or bugs that might be leading to improper execution. Modify identified configurations and ensure proper subsystem collaboration to improve firmware efficiency.	60	0	REVERT
1774416530.684	Conduct a detailed analysis of the VM's disk I/O handling mechanisms, including any potential misconfigurations or bugs that might be leading to improper execution. Modify identified configurations and ensure proper subsystem collaboration to improve disk I/O efficiency.	60	0	REVERT
1774416595.484	Conduct a detailed analysis of the VM's hardware component interaction mechanisms, including any potential misconfigurations or bugs that might be leading to improper execution. Modify identified configurations and ensure proper subsystem collaboration to improve hardware component interactions efficiency.	60	0	REVERT
1774416660.236	Conduct a detailed analysis of the VM's memory management mechanisms, including any potential misconfigurations or bugs that might be leading to improper execution. Modify identified configurations and ensure proper subsystem collaboration to improve memory management efficiency.	60	0	REVERT
1774416725.049	Conduct a detailed analysis of the VM's cache management mechanisms, including any potential misconfigurations or bugs that might be leading to improper execution. Modify identified configurations and ensure proper subsystem collaboration to improve cache efficiency.	60	0	REVERT
1774416789.764	Conduct a detailed analysis of the VM's interrupt handling mechanism, including any potential misconfigurations or bugs that might be leading to improper execution. Modify identified configurations and ensure proper subsystem collaboration to improve interrupt handling efficiency.	60	0	REVERT
1774416854.42	Conduct a detailed analysis of the VM's network handling mechanisms, including any potential misconfigurations or bugs that might be leading to improper execution. Modify identified configurations and ensure proper subsystem collaboration to improve network efficiency.	60	0	REVERT
1774416919.407	Conduct a detailed analysis of the VM's disk I/O handling mechanism, including any potential misconfigurations or bugs that might be leading to improper execution. Modify identified configurations and ensure proper subsystem collaboration to improve disk I/O efficiency.	60	0	REVERT
1774416984.304	Conduct a detailed analysis of the VM's CPU execution path and instruction set architecture (ISA) handling mechanisms, including any potential misconfigurations or bugs that might be leading to improper execution. Modify identified configurations and ensure proper subsystem collaboration to improve CPU execution efficiency.	60	0	REVERT
1774417049.005	Conduct a detailed analysis of the VM's configuration files and firmware handling mechanism, including any potential misconfigurations or bugs that might be leading to improper execution. Modify identified configurations and ensure proper subsystem collaboration to improve configuration and firmware efficiency.	60	0	REVERT
1774417113.862	Conduct a detailed analysis of the VM's cache handling mechanism, including any potential misconfigurations or bugs that might be leading to improper execution. Modify identified configurations and ensure proper subsystem collaboration to improve cache efficiency.	60	0	REVERT
1774417178.814	Conduct a detailed analysis of the VM's memory management mechanism, including any potential misconfigurations or bugs that might be leading to improper execution. Modify identified configurations and ensure proper subsystem collaboration to improve memory management efficiency.	60	0	REVERT
1774417243.69	Conduct a detailed analysis of the VM's inter-subsystem interaction mechanisms, including any potential misconfigurations or bugs that might be leading to improper execution. Modify identified configurations and ensure proper subsystem collaboration to improve inter-subsystem efficiency.	60	0	REVERT
1774417308.435	Conduct a detailed analysis of the VM's interrupt handling mechanism, including any potential misconfigurations or bugs that might be leading to improper execution. Modify identified configurations and ensure proper subsystem collaboration to improve interrupt handling efficiency.	60	0	REVERT
1774417373.222	Conduct a detailed analysis of the VM's task scheduling mechanism, including any potential misconfigurations or bugs that might be leading to improper execution. Modify identified configurations and ensure proper subsystem collaboration to improve task scheduling efficiency.	60	0	REVERT
1774417437.962	Conduct a detailed analysis of the VM's resource management mechanism, including any potential misconfigurations or bugs that might be leading to improper execution. Modify identified configurations and ensure proper subsystem collaboration to improve resource management efficiency.	60	0	REVERT
1774417503.114	Conduct a detailed analysis of the VM's data structures and algorithms used for memory management, task scheduling, cache operations, interrupt handling, resource allocation, and disk I/O. Identify any inefficiencies or misconfigurations and optimize them to improve overall performance.	60	0	REVERT
1774417567.94	Conduct a detailed analysis of the VM's file system mechanism, including any potential misconfigurations or bugs that might be leading to improper execution. Modify identified configurations and ensure proper subsystem collaboration to improve file system efficiency.	60	0	REVERT
1774417632.502	Conduct a detailed analysis of the VM's memory management mechanism, including any potential misconfigurations or inefficiencies that might be leading to improper execution. Modify identified configurations and ensure proper subsystem collaboration to improve memory management efficiency.	60	0	REVERT
1774417696.946	Conduct a detailed analysis of the VM's concurrency mechanisms, including any potential misconfigurations or bugs that might be leading to improper execution. Modify identified configurations and ensure proper subsystem collaboration to improve concurrency efficiency.	60	0	REVERT
