timestamp	hypothesis	baseline	metric	status
1774469591.717	Optimize the interaction between the CPU and disk I/O operations by implementing a more efficient algorithm for managing disk buffer cache and data read/write patterns. This should help in reducing conflicts and improving overall VM performance during high load demands involving concurrent file access operations with multiple tasks, including high load demands.	60	0	REVERT
1774469657.599	Optimize the interaction between the CPU and memory subsystems by implementing more efficient algorithms for managing memory allocation and deallocation patterns, as well as optimizing data access patterns. This should help in reducing conflicts and improving overall VM performance during high load demands involving concurrent operations.	60	0	REVERT
1774469722.503	Optimize the task scheduling subsystem by implementing a more efficient algorithm for managing task prioritization and resource allocation patterns. This should help in reducing conflicts and improving overall VM performance during high load demands involving concurrent operations, including high load demands.	60	0	REVERT
1774469788.543	Optimize the interaction between the CPU and file system operations by implementing more efficient algorithms for managing file buffer cache and data read/write patterns. This should help in reducing conflicts and improving overall VM performance during high load demands involving concurrent file access operations with multiple tasks, including high load demands.	60	0	REVERT
1774469853.775	Optimize the interaction between the CPU and network subsystem by implementing more efficient algorithms for managing network buffer cache and data transmission patterns. This should help in reducing conflicts and improving overall VM performance during high load demands involving concurrent file access operations over a network.	60	0	REVERT
1774469919.652	Optimize the interaction between the CPU and disk I/O operations by implementing a more efficient algorithm for managing disk buffer cache and data read/write patterns. This should help in reducing conflicts and improving overall VM performance during high load demands involving concurrent file access operations with multiple tasks, including high load demands.	60	0	REVERT
1774469984.851	Optimize the interaction between the CPU and GPU subsystems by implementing more efficient algorithms for managing GPU memory allocation and deallocation patterns, as well as optimizing data access patterns. This should help in reducing conflicts and improving overall VM performance during high load demands involving concurrent operations with GPU-intensive tasks.	60	0	REVERT
1774470050.845	Optimize the memory management subsystem by implementing a more efficient algorithm for managing memory allocation and deallocation patterns, as well as optimizing data access patterns. This should help in reducing conflicts and improving overall VM performance during high load demands involving concurrent operations with multiple tasks, including high load demands.	60	0	REVERT
1774470115.805	Implement a more efficient scheduling algorithm for the pxOS task scheduler, focusing on reducing context-switching and optimizing resource allocation to tasks. This should help in reducing conflicts and improving overall VM performance during high load demands involving concurrent operations with multiple tasks, including high load demands.	60	0	REVERT
1774470181.646	Optimize the file system caching mechanism by implementing a more efficient algorithm for managing cache eviction and hit rates, as well as optimizing data access patterns. This should help in reducing conflicts and improving overall VM performance during high load demands involving concurrent file access operations with multiple tasks, including high load demands.	60	0	REVERT
1774470222.65	We can improve the performance of the text rendering by reducing the number of pixel checks and optimizing the font lookup process. Additionally, we can simplify the logic to make it more readable and maintainable.	5	1	KEEP
1774470247.772	Optimize the interaction between the CPU and memory subsystems by implementing more efficient algorithms for managing memory allocation and deallocation patterns, as well as optimizing data access patterns. This should help in reducing conflicts and improving overall VM performance during high load demands involving concurrent operations with multiple tasks, including high load demands.	60	0	REVERT
1774470313.097	Optimize the interaction between the CPU and file system subsystems by implementing more efficient algorithms for managing file access patterns and optimizing data transfer rates. This should help in reducing conflicts and improving overall VM performance during high load demands involving concurrent file access operations with multiple tasks, including high load demands.	60	0	REVERT
1774470379.146	Optimize the interaction between the CPU and I/O subsystems by implementing more efficient algorithms for managing I/O access patterns and optimizing data transfer rates. This should help in reducing conflicts and improving overall VM performance during high load demands involving concurrent I/O operations with multiple tasks, including high load demands.	60	0	REVERT
1774470444.709	Optimize the interaction between the CPU and GPU subsystems by implementing more efficient algorithms for managing graphical rendering patterns and optimizing data transfer rates. This should help in reducing conflicts and improving overall VM performance during high load demands involving concurrent graphical operations with multiple tasks, including high load demands.	60	0	REVERT
1774470486.063	Removing the orphan duplicate code block will restore shader compilation, enabling GPU rendering and INPUT ZONE text display for vision model OCR extraction.	5	1	KEEP
1774470510.408	Implement and optimize more efficient task scheduling algorithms that prioritize tasks based on their importance and resource requirements. This should help in reducing conflicts and improving overall VM performance during high load demands involving concurrent operations with multiple tasks, including high load demands.	60	0	REVERT
1774470551.074	Replace invalid string-based text rendering with const character code arrays that WGSL can compile, enabling PATCH_SUCCESS/PATCH_FAIL display for the vision-to-opcode feedback loop.	5	1	KEEP
1774470575.651	Optimize the interaction between the CPU and network subsystems by implementing more efficient algorithms for managing network data transfer patterns and optimizing packet handling rates. This should help in reducing conflicts and improving overall VM performance during high load demands involving concurrent network operations with multiple tasks, including high load demands.	60	0	REVERT
1774470641.374	Optimize the interaction between the CPU and memory subsystems by implementing more efficient algorithms for managing memory access patterns and optimizing data transfer rates. This should help in reducing conflicts and improving overall VM performance during high load demands involving concurrent memory operations with multiple tasks, including high load demands.	60	0	REVERT
1774470672.431	Optimize the `get_input_zone_boundary` function to reduce redundant calculations and streamline the `render_input_zone_text` function for faster text rendering.	5	1	KEEP
1774470707.427	Optimize the interaction between the CPU and I/O subsystems by implementing more efficient algorithms for managing I/O access patterns and optimizing data transfer rates. This should help in reducing conflicts and improving overall VM performance during high load demands involving concurrent I/O operations with multiple tasks, including high load demands.	60	0	REVERT
1774470772.593	Optimize the interaction between the CPU and file system subsystems by implementing more efficient algorithms for managing file access patterns and optimizing data transfer rates. This should help in reducing conflicts and improving overall VM performance during high load demands involving concurrent file operations with multiple tasks, including high load demands.	60	0	REVERT
1774470795.359	By removing redundant checks and optimizing the text rendering logic, we can improve the performance of the INPUT ZONE and font rendering.	5	1	KEEP
1774470838.533	Optimize the interaction between the CPU and file system subsystems by implementing more efficient algorithms for managing file access patterns and optimizing data transfer rates. This should help in reducing conflicts and improving overall VM performance during high load demands involving concurrent file operations with multiple tasks, including high load demands.	60	0	REVERT
1774470904.672	Optimize the interaction between the CPU and file system subsystems by implementing more efficient algorithms for managing file access patterns and optimizing data transfer rates. This should help in reducing conflicts and improving overall VM performance during high load demands involving concurrent file operations with multiple tasks, including high load demands.	60	0	REVERT
1774470969.925	Optimize the interaction between the CPU and network subsystems by implementing more efficient algorithms for managing network access patterns and optimizing data transfer rates. This should help in reducing conflicts and improving overall VM performance during high load demands involving concurrent network operations with multiple tasks, including high load demands.	60	0	REVERT
1774471004.084	Removing the orphaned duplicate code block will restore shader compilation, allowing the GPU to come online. This is a copy-paste artifact that creates invalid WGSL syntax.	5	1	KEEP
1774471036.085	Optimize the interaction between the CPU and memory subsystems by implementing more efficient algorithms for managing memory access patterns and optimizing data transfer rates. This should help in reducing conflicts and improving overall VM performance during high load demands involving concurrent memory operations with multiple tasks, including high load demands.	60	0	REVERT
1774471054.971	Complete the cursor_blink_active() function with a proper 32-frame cycle implementation using config.frame, and add defensive bounds checking to get_font_column() to prevent out-of-bounds font_atlas access during OCR extraction.	5	1	KEEP
1774471102.148	Optimize the interaction between the CPU and memory subsystems by implementing more efficient algorithms for managing memory access patterns and optimizing data transfer rates. This should help in reducing conflicts and improving overall VM performance during high load demands involving concurrent memory operations with multiple tasks, including high load demands.	60	0	REVERT
1774471159.286	Adding the missing helper functions will enable proper text cursor visualization for user feedback and ensure input length is correctly computed for the vision-to-opcode pipeline. The cursor blink uses frame counter for 60fps timing.	5	1	KEEP
1774471167.875	Optimize the interaction between the CPU and memory subsystems by implementing more efficient algorithms for managing memory access patterns and optimizing data transfer rates. This should help in reducing conflicts and improving overall VM performance during high load demands involving concurrent memory operations with multiple tasks, including high load demands.	60	0	REVERT
1774471200.24	Fix the truncated cursor_blink_active() function to restore compilation and ensure proper 32-frame blink cycle. Optimize by pre-computing the blink state once per frame rather than per-pixel.	5	1	KEEP
1774471233.254	Optimize the interaction between the CPU and disk subsystems by implementing more efficient algorithms for managing disk access patterns and optimizing data transfer rates. This should help in reducing conflicts and improving overall VM performance during high load demands involving concurrent disk operations with multiple tasks, including high load demands.	60	0	REVERT
1774471299.147	Optimize the interaction between the CPU and network subsystems by implementing more efficient algorithms for managing network access patterns and optimizing data transfer rates. This should help in reducing conflicts and improving overall VM performance during high load demands involving concurrent network operations with multiple tasks, including high load demands.	60	0	REVERT
1774471363.203	We need to add a new function to process the input text from rows 450-479, convert it into valid VM opcodes using a language model, and then atomically patch the agent's memory with these opcodes. Additionally, we need to ensure that the existing font rendering functions are optimized for performance.	5	1	KEEP
1774471364.725	Optimize the interaction between the CPU and disk subsystems by implementing more efficient algorithms for managing disk access patterns and optimizing data transfer rates. This should help in reducing conflicts and improving overall VM performance during high load demands involving concurrent disk operations with multiple tasks, including high load demands.	60	0	REVERT
1774471430.116	Optimize the interaction between the CPU and disk subsystems by implementing more efficient algorithms for managing disk access patterns and optimizing data transfer rates. This should help in reducing conflicts and improving overall VM performance during high load demands involving concurrent disk operations with multiple tasks, including high load demands.	60	0	REVERT
1774471496.073	Optimize the interaction between the CPU and disk subsystems by implementing more efficient algorithms for managing disk access patterns and optimizing data transfer rates. This should help in reducing conflicts and improving overall VM performance during high load demands involving concurrent disk operations with multiple tasks, including high load demands.	60	0	REVERT
1774471536.381	Adding the missing helper functions before get_input_zone_boundary and fixing the unqualified 'width' reference to 'config.width' will restore GPU shader compilation, enabling INPUT ZONE rendering for vision model OCR extraction at 60 FPS.	5	1	KEEP
1774471562.945	Optimize the interaction between the CPU and memory subsystems by implementing more efficient algorithms for managing memory access patterns and optimizing data transfer rates. This should help in reducing conflicts and improving overall VM performance during high load demands involving concurrent memory operations with multiple tasks, including high load demands.	60	0	REVERT
1774471628.521	Optimize the CPU's task scheduling algorithm by implementing more efficient algorithms for managing task priorities and optimizing context switches. This should help in reducing conflicts and improving overall VM performance during high load demands.	60	0	REVERT
1774471693.729	Optimize the interaction between the CPU and disk subsystems by implementing more efficient algorithms for managing disk access patterns and optimizing data transfer rates. This should help in reducing conflicts and improving overall VM performance during high load demands involving concurrent disk operations with multiple tasks, including high load demands.	60	0	REVERT
1774471759.441	Optimize the CPU's cache coherence protocol by implementing more efficient algorithms for managing cache coherency and reducing cache misses. This should help in reducing conflicts and improving overall VM performance during high load demands involving concurrent operations with multiple tasks, including high load demands.	60	0	REVERT
1774471825.951	Optimize the interaction between the CPU and disk subsystems by implementing more efficient algorithms for managing disk access patterns and optimizing data transfer rates. This should help in reducing conflicts and improving overall VM performance during high load demands involving concurrent disk operations with multiple tasks, including high load demands.	60	0	REVERT
1774471891.122	Optimize the CPU's cache coherence protocol by implementing more efficient algorithms for managing cache coherency and reducing cache misses. This should help in reducing conflicts and improving overall VM performance during high load demands involving concurrent operations with multiple tasks, including high load demands.	60	0	REVERT
1774471956.983	Optimize the interaction between the CPU and memory subsystems by implementing more efficient algorithms for managing memory access patterns and optimizing data transfer rates. This should help in reducing conflicts and improving overall VM performance during high load demands involving concurrent memory operations with multiple tasks, including high load demands.	60	0	REVERT
1774471980.322	Add FONT_ATLAS_WORDS constant to replace magic number 119u in bounds check, improving code maintainability and making the font system more robust for OCR-critical rendering. This also makes it easier to swap font atlases if OCR accuracy needs different font metrics.	5	1	KEEP
1774472023.096	Optimize the task scheduler by implementing a more efficient algorithm for scheduling tasks and reducing context switching overheads. This should help in reducing conflicts and improving overall VM performance during high load demands involving multiple tasks, including high load demands.	60	0	REVERT
1774472055.966	Adding the missing font_atlas storage binding (binding 9) will restore GPU shader compilation. This will enable the 5x7 bitmap font renderer to function, allowing proper INPUT ZONE text display with 21:1 contrast ratio for qwen3-vl-8b OCR extraction while maintaining 60 FPS in the render loop.	5	1	KEEP
1774472088.816	Optimize the file system cache by implementing more efficient algorithms for managing cache coherency and reducing cache misses. This should help in reducing conflicts and improving overall VM performance during high load demands involving concurrent file operations with multiple tasks, including high load demands.	60	0	REVERT
1774472154.004	Optimize the interaction between the CPU and GPU subsystems by implementing more efficient algorithms for managing GPU access patterns and optimizing data transfer rates. This should help in reducing conflicts and improving overall VM performance during high load demands involving concurrent GPU operations with multiple tasks, including high load demands.	60	0	REVERT
1774472219.717	Optimize the CPU's instruction set by implementing more efficient algorithms for managing instruction execution and reducing instruction latencies. This should help in reducing conflicts and improving overall VM performance during high load demands involving concurrent operations with multiple tasks, including high load demands.	60	0	REVERT
1774472285.87	Optimize the logging subsystem by implementing a more efficient algorithm for managing log data storage and reducing the frequency of log flushes to disk. This should help in reducing conflicts and improving overall VM performance during high load demands involving multiple tasks, including high load demands.	60	0	REVERT
1774472351.344	Optimize the memory management subsystem by implementing more efficient algorithms for managing memory allocation and reducing fragmentation. This should help in reducing conflicts and improving overall VM performance during high load demands involving multiple tasks, including high load demands.	60	0	REVERT
1774472416.395	Optimize the task scheduler by implementing a more efficient algorithm for managing task prioritization and reducing context switch overheads. This should help in reducing conflicts and improving overall VM performance during high load demands involving multiple tasks, including high load demands.	60	0	REVERT
1774472482.219	Optimize the interaction between the CPU and GPU subsystems by implementing more efficient algorithms for managing GPU access patterns and optimizing data transfer rates. This should help in reducing conflicts and improving overall VM performance during high load demands involving concurrent GPU operations with multiple tasks, including high load demands.	60	0	REVERT
1774472547.972	Optimize the interaction between the CPU and GPU subsystems by implementing more efficient algorithms for managing GPU access patterns and optimizing data transfer rates. This should help in reducing conflicts and improving overall VM performance during high load demands involving concurrent GPU operations with multiple tasks, including high load demands.	60	0	REVERT
1774472613.212	Optimize the interaction between the CPU and GPU subsystems by implementing more efficient algorithms for managing GPU access patterns and optimizing data transfer rates. This should help in reducing conflicts and improving overall VM performance during high load demands involving concurrent GPU operations with multiple tasks, including high load demands.	60	0	REVERT
1774472679.028	Optimize the file system cache by implementing a more efficient caching algorithm and reducing cache misses. This should help in reducing conflicts and improving overall VM performance during high load demands involving multiple tasks, including high load demands.	60	0	REVERT
1774472745.254	Optimize the memory management subsystem by implementing a more efficient algorithm for managing memory allocation and reducing fragmentation. This should help in reducing conflicts and improving overall VM performance during high load demands involving multiple tasks, including high load demands.	60	0	REVERT
1774472810.483	Optimize the task scheduling algorithm by implementing a more efficient algorithm for managing task prioritization and resource allocation. This should help in reducing conflicts and improving overall VM performance during high load demands involving multiple tasks, including high load demands.	60	0	REVERT
