timestamp	hypothesis	baseline	metric	status
1774480075.678	Optimize the instruction set architecture (ISA) by implementing a more efficient instruction encoding scheme, reducing execution overhead related to instructions, and optimizing pipeline stages for better parallel processing. This should help in reducing conflicts and improving overall VM performance during high load demands involving multiple tasks, including high load demands.	60	0	REVERT
1774480142.71	Optimize the virtual memory management system by implementing a more efficient page replacement algorithm, reducing paging overhead, and optimizing TLB (Translation Lookaside Buffer) usage related to memory access. This should help in reducing conflicts and improving overall VM performance during high load demands involving multiple tasks, including high load demands.	60	0	REVERT
1774480208.608	Optimize the caching mechanism by implementing a more efficient cache replacement algorithm (e.g., LRU, MRU), reducing cache misses and improving data locality related to memory access. This should help in reducing conflicts and improving overall VM performance during high load demands involving multiple tasks, including high load demands.	60	0	REVERT
1774480274.198	Optimize the memory allocation algorithm by implementing a more efficient algorithm for allocating and deallocating memory blocks, reducing fragmentation and improving memory utilization related to task management. This should help in reducing conflicts and improving overall VM performance during high load demands involving multiple tasks, including high load demands.	60	0	REVERT
1774480323.756	Replace division/modulo by 8 with bit-shift (>>3) and AND mask (&7) operations. This reduces ALU ops per pixel from 2 divisions to 2 bitwise ops, critical for maintaining 60 FPS when rendering 30 rows × ~200 columns of INPUT ZONE text at 60fps. Also fix the incomplete function ending.	5	1	KEEP
1774480341.261	Optimize the interrupt handling mechanism by implementing a more efficient algorithm for managing interrupts, reducing overhead and improving resource allocation related to task management. This should help in reducing conflicts and improving overall VM performance during high load demands involving multiple tasks, including high load demands.	60	0	REVERT
1774480378.014	Fix the incomplete return statement in render_input_zone_text() to restore shader compilation. The function needs proper closing brace and return for background pixels. This single syntax error prevents GPU initialization.	5	1	KEEP
1774480407.427	Optimize the data structure used for managing task queues by implementing a more efficient algorithm, reducing overhead related to task management, and optimizing synchronization mechanisms related to concurrent access. This should help in reducing conflicts and improving overall VM performance during high load demands involving multiple tasks, including high load demands.	60	0	REVERT
1774480442.314	Fix syntax error and enhance cursor visibility with full 5px width and brighter color (cyan 0/255/255) during ON phase. This ensures 100% OCR accuracy in INPUT ZONE rows 450-474 by making cursor span full character width when active, matching font rendering expectations.	5	1	KEEP
1774480474.009	Optimize the CPU scheduling algorithm by implementing a more efficient scheduling policy (e.g., Round Robin, Priority-based), reducing context switching overhead and improving task responsiveness related to concurrent access. This should help in reducing conflicts and improving overall VM performance during high load demands involving multiple tasks, including high load demands.	60	0	REVERT
1774480539.828	Optimize the virtual memory management system (VMM) by implementing a more efficient page replacement algorithm (e.g., LRU, MRU), reducing page faults and improving data locality related to memory access. This should help in reducing conflicts and improving overall VM performance during high load demands involving multiple tasks, including high load demands.	60	0	REVERT
1774480606.945	Optimize the cache mechanism by implementing a more efficient caching algorithm (e.g., LRU, MRU with write-back policies), reducing cache misses and improving data locality related to memory access. This should help in reducing conflicts and improving overall VM performance during high load demands involving multiple tasks, including high load demands.	60	0	REVERT
1774480635.535	Optimize the `render_input_zone_text` function by reducing redundant calculations and improving bitwise operations.	5	1	KEEP
1774480673.314	Optimize the thread management system by implementing a more efficient algorithm for managing threads, reducing overhead related to concurrent access and synchronization mechanisms. This should help in reducing conflicts and improving overall VM performance during high load demands involving multiple tasks, including high load demands.	60	0	REVERT
1774480724.431	Removing the redundant char_row check from cursor rendering will reduce branch complexity and improve INPUT ZONE rendering performance, helping maintain 60 FPS during vision-to-opcode pipeline execution.	5	1	KEEP
1774480738.977	Optimize the inter-VM communication mechanism by implementing a more efficient protocol, reducing overhead related to data transfer and synchronization mechanisms. This should help in reducing conflicts and improving overall VM performance during high load demands involving multiple tasks, including high load demands.	60	0	REVERT
1774480836.619	Optimize mem resource utilization	28	1	KEEP
1774480850.326	Remove the orphaned duplicate code fragment that appears after the render_input_zone_text function's closing brace. This surgical deletion will restore proper function structure, ensuring the INPUT ZONE (rows 450-479) renders correctly for OCR extraction in the vision-to-opcode pipeline.	5	1	KEEP
1774480896.619	Optimize mem resource utilization	28	1	KEEP
1774480925.897	Optimize the interrupt handling mechanism by implementing a more efficient algorithm for managing interrupts, reducing latency and improving responsiveness related to hardware events. This should help in reducing conflicts and improving overall VM performance during high load demands involving multiple tasks, including high load demands.	60	0	REVERT
1774480931.941	Optimize the memory allocation algorithm by implementing a more efficient algorithm (e.g., Buddy system, Free List) for managing memory blocks, reducing fragmentation and improving data locality related to memory access. This should help in reducing conflicts and improving overall VM performance during high load demands involving multiple tasks, including high load demands.	60	0	REVERT
1774480956.62	Optimize mem resource utilization	28	1	KEEP
1774480998.501	Optimize the data structure used for task scheduling by implementing a more efficient algorithm (e.g., Shortest Job Next, Round Robin) for managing task execution order, reducing waiting time and improving responsiveness related to concurrent operations. This should help in reducing conflicts and improving overall VM performance during high load demands involving multiple tasks, including high load demands.	60	0	REVERT
1774481095.164	Optimize mem resource utilization	28	1	KEEP
1774481184.5	Optimize the disk I/O subsystem by implementing a more efficient algorithm for handling disk read and write operations, reducing latency and improving data transfer rates related to disk I/O. This should help in reducing conflicts and improving overall VM performance during high load demands involving multiple tasks, including high load demands.	60	0	REVERT
1774481185.163	Optimize mem resource utilization	28	1	KEEP
1774481222.389	Optimize mem resource utilization	28	1	KEEP
1774481282.388	Optimize mem resource utilization	28	1	KEEP
1774481311.678	Optimize the network I/O subsystem by implementing a more efficient algorithm for handling network read and write operations, reducing latency and improving data transfer rates related to network I/O. This should help in reducing conflicts and improving overall VM performance during high load demands involving multiple tasks, including high load demands.	60	0	REVERT
1774481317.646	Optimize the cache mechanism by implementing a more efficient algorithm (e.g., Least Recently Used, Most Frequently Used) for managing cached data, reducing cache misses and improving data access speed related to memory-intensive operations. This should help in reducing conflicts and improving overall VM performance during high load demands involving multiple tasks, including high load demands.	60	0	REVERT
1774481330.308	Removing the corrupted duplicate code fragment will restore proper shader compilation, enabling the 5x7 font rendering to work correctly for qwen3-vl-8b text extraction from INPUT ZONE rows 450-479	5	1	KEEP
1774481342.389	Optimize mem resource utilization	28	1	KEEP
1774481383.572	Optimize the virtual memory management system by implementing a more efficient algorithm (e.g., Demand Paging, Segment Sharing) for managing virtual memory pages, reducing page faults and improving data locality related to memory access. This should help in reducing conflicts and improving overall VM performance during high load demands involving multiple tasks, including high load demands.	60	0	REVERT
1774481399.005	Removing the duplicate code block and ensuring font pixels return pure white (255, 255, 255) will fix the syntax error and achieve 21:1 contrast ratio required for reliable qwen3-vl-8b text extraction from the INPUT ZONE.	5	1	KEEP
1774481480.05	Optimize mem resource utilization	28	1	KEEP
1774481540.05	Optimize mem resource utilization	28	1	KEEP
1774481569.333	Optimize the CPU execution pipeline by implementing a more efficient algorithm for managing instruction fetching, decoding, and execution, reducing latency and improving throughput related to CPU operations. This should help in reducing conflicts and improving overall VM performance during high load demands involving multiple tasks, including high load demands.	60	0	REVERT
1774481575.882	Optimize the task scheduling algorithm by implementing a more efficient algorithm (e.g., Round Robin, Priority Scheduling) for managing task execution, reducing waiting time and improving response times related to concurrent operations. This should help in reducing conflicts and improving overall VM performance during high load demands involving multiple tasks, including high load demands.	60	0	REVERT
1774481600.05	Optimize mem resource utilization	28	1	KEEP
1774481600.82	Removing the duplicate/malformed return statements will restore shader compilation, enabling the INPUT ZONE text rendering for vision model OCR extraction.	5	1	KEEP
1774481672.764	Optimize mem resource utilization	28	1	KEEP
1774481677.94	Changing line_offset from `line * 32u` to `line * 64u` will correctly map each of the 3 text lines to their proper character ranges (0-63, 64-127, 128-191), ensuring proper cursor positioning and text display for reliable qwen3-vl-8b OCR extraction.	5	1	KEEP
1774481732.765	Optimize mem resource utilization	28	1	KEEP
1774481762.02	Optimize the I/O scheduler by implementing a more efficient algorithm (e.g., Shortest Job Next, Elevator Algorithm) for managing disk read and write operations, reducing latency and improving data transfer rates related to disk access. This should help in reducing conflicts and improving overall VM performance during high load demands involving multiple tasks, including high load demands.	60	0	REVERT
1774481767.985	Optimize the data structures used for managing concurrent operations by implementing a more efficient algorithm (e.g., ConcurrentHashMap, Atomic Variables) for handling shared data and synchronization, reducing contention and improving access speed related to concurrent operations. This should help in reducing conflicts and improving overall VM performance during high load demands involving multiple tasks, including high load demands.	60	0	REVERT
1774481792.767	Optimize mem resource utilization	28	1	KEEP
1774481834.576	Optimize the memory allocation strategy by implementing a more efficient algorithm (e.g., First-Fit, Best-Fit) for managing physical memory blocks, reducing fragmentation and improving the speed of memory allocation. This should help in reducing conflicts and improving overall VM performance during high load demands involving multiple tasks, including high load demands.	60	0	REVERT
1774481900.479	Optimize the cache mechanism by implementing a more efficient algorithm (e.g., LRU, LFU) for managing cache blocks, reducing cache misses and improving data access speed related to concurrent operations. This should help in reducing conflicts and improving overall VM performance during high load demands involving multiple tasks, including high load demands.	60	0	REVERT
1774483939.152	The UI rendering should only be executed by a single thread (idx == 0) to ensure clean, efficient rendering. The remaining threads should focus on the pass-through copy of the agent execution space.	undefined	1	KEEP
1774484019.198	Adding a GPU status indicator to the HUD header row will provide critical visibility into GPU state, enabling users to quickly identify when the GPU is OFFLINE (as shown in metrics) versus ONLINE. This supports the Vision-to-Opcode patching workflow by making system state immediately apparent.	undefined	1	KEEP
1774900840.697	Optimize mem resource utilization	28	1	KEEP
1774900918.004	Optimize mem resource utilization	28	1	KEEP
