timestamp	hypothesis	baseline	metric	status
1774472875.209	Optimize the resource management subsystem by implementing a more efficient algorithm for managing system resources and reducing contention. This should help in reducing conflicts and improving overall VM performance during high load demands involving multiple tasks, including high load demands.	60	0	REVERT
1774472940.617	Optimize the logging subsystem by implementing a more efficient logging algorithm and reducing log file size. This should help in reducing conflicts and improving overall VM performance during high load demands involving multiple tasks, including high load demands.	60	0	REVERT
1774472959.501	Merging cursor rendering into the character render path eliminates redundant pixel operations and function calls. Cursor should only appear when no character exists at that position (i.e., at end of input). This reduces branch divergence and improves render pass efficiency for the 60 FPS target while maintaining OCR-friendly pure white text on black background.	5	1	KEEP
1774473006.578	Optimize the task context switching mechanism by implementing a more efficient algorithm for managing task transitions and reducing overhead. This should help in reducing conflicts and improving overall VM performance during high load demands involving multiple tasks, including high load demands.	60	0	REVERT
1774473010.17	Complete the process_input_text() function with proper bounds checking and fix the input length extraction to use the full u32 value for reliable text-to-opcode pipeline initialization.	5	1	KEEP
1774473071.968	Optimize the file system caching mechanism by implementing a more efficient algorithm for managing cache eviction and hit rates. This should help in reducing conflicts and improving overall VM performance during high load demands involving multiple tasks, including high load demands.	60	0	REVERT
1774473136.694	Optimize the memory handling subsystem by implementing a more efficient algorithm for managing system memory and reducing contention. This should help in reducing conflicts and improving overall VM performance during high load demands involving multiple tasks, including high load demands.	60	0	REVERT
1774473202.056	Optimize the task scheduler by implementing a more efficient algorithm for managing task scheduling and reducing overhead. This should help in reducing conflicts and improving overall VM performance during high load demands involving multiple tasks, including high load demands.	60	0	REVERT
1774473231.508	Reduce inter-line gaps from 2px to 1px and shift Line 2 and Line 3 row mappings earlier. This ensures all 3 lines (21 rows total + 2 gaps = 23 rows) fit completely within rows 452-474, leaving rows 475-479 untouched for PATCH_STATUS display.	5	1	KEEP
1774473268.026	Optimize the resource allocation mechanism by implementing a more efficient algorithm for managing system resources and reducing contention. This should help in reducing conflicts and improving overall VM performance during high load demands involving multiple tasks, including high load demands.	60	0	REVERT
1774473284.708	Fix the missing char_row calculation by deriving it from local_row using modulo arithmetic for the 7-pixel font height, enabling proper bit extraction from the font atlas for OCR-ready display.	5	1	KEEP
1774473332.995	Optimize the logging subsystem by implementing a more efficient algorithm for managing log data and reducing overhead. This should help in reducing conflicts and improving overall VM performance during high load demands involving multiple tasks, including high load demands.	60	0	REVERT
1774473340.522	Adding +1 offset to char_byte_pos calculation will align text rendering with the actual buffer layout where byte 0 stores length and bytes 1+ store text content. This ensures 100% vision model extraction accuracy by rendering characters at their correct positions.	5	1	KEEP
1774473397.829	Optimize the GPU usage by implementing a more efficient algorithm for managing GPU resources and reducing contention. This should help in reducing conflicts and improving overall VM performance during high load demands involving multiple tasks, including high load demands.	60	0	REVERT
1774473452.984	Complete the truncated process_input_text() function and optimize get_font_column by removing redundant bounds checks since the caller already validates inputs. This reduces per-pixel overhead in the text rendering path while maintaining safety.	5	1	KEEP
1774473463.324	Optimize the file system caching mechanism by implementing a more efficient algorithm for managing cache data and reducing contention. This should help in reducing conflicts and improving overall VM performance during high load demands involving multiple tasks, including high load demands.	60	0	REVERT
1774473529.159	Optimize the memory handling mechanism by implementing a more efficient algorithm for managing memory allocation and reducing fragmentation. This should help in reducing conflicts and improving overall VM performance during high load demands involving multiple tasks, including high load demands.	60	0	REVERT
1774473593.9	Optimize the task scheduling algorithm by implementing a more efficient algorithm for managing task execution and reducing contention. This should help in reducing conflicts and improving overall VM performance during high load demands involving multiple tasks, including high load demands.	60	0	REVERT
1774473659.47	Optimize the CPU usage by implementing a more efficient algorithm for managing CPU resources and reducing contention. This should help in reducing conflicts and improving overall VM performance during high load demands involving multiple tasks, including high load demands.	60	0	REVERT
1774473725.219	Optimize the logging mechanism by implementing a more efficient algorithm for managing log data and reducing I/O contention. This should help in reducing conflicts and improving overall VM performance during high load demands involving multiple tasks, including high load demands.	60	0	REVERT
1774473790.061	Optimize the GPU usage by implementing a more efficient algorithm for managing GPU resources and reducing contention. This should help in reducing conflicts and improving overall VM performance during high load demands involving multiple tasks, including high load demands.	60	0	REVERT
1774473855.622	Optimize the file system caching mechanism by implementing a more efficient algorithm for managing cache data and reducing I/O contention. This should help in reducing conflicts and improving overall VM performance during high load demands involving multiple tasks, including high load demands.	60	0	REVERT
1774473921.486	Optimize the memory management algorithm by implementing a more efficient algorithm for managing memory allocation and reducing fragmentation. This should help in reducing conflicts and improving overall VM performance during high load demands involving multiple tasks, including high load demands.	60	0	REVERT
1774473986.258	Optimize the task scheduler by implementing a more efficient algorithm for managing task priorities and reducing contention. This should help in reducing conflicts and improving overall VM performance during high load demands involving multiple tasks, including high load demands.	60	0	REVERT
1774474051.88	Optimize the file system caching mechanism by implementing a more efficient algorithm for managing cache data and reducing I/O contention. This should help in reducing conflicts and improving overall VM performance during high load demands involving multiple tasks, including high load demands.	60	0	REVERT
1774474098.449	Adding an overflow guard to skip rendering when local_row >= 24 will prevent the wraparound artifact, ensuring clean 3-line text display with proper boundaries for vision model extraction.	5	1	KEEP
1774474117.347	Optimize the virtual memory (VM) paging mechanism by implementing a more efficient algorithm for managing page allocation and reducing fragmentation. This should help in reducing conflicts and improving overall VM performance during high load demands involving multiple tasks, including high load demands.	60	0	REVERT
1774474183.385	Optimize the logging mechanism by implementing a more efficient algorithm for managing log data and reducing I/O contention. This should help in reducing conflicts and improving overall VM performance during high load demands involving multiple tasks, including high load demands.	60	0	REVERT
1774474248.431	Optimize the virtual memory (VM) paging mechanism by implementing a more efficient algorithm for managing page allocation and reducing fragmentation. This should help in reducing conflicts and improving overall VM performance during high load demands involving multiple tasks, including high load demands.	60	0	REVERT
1774474313.81	Optimize the task scheduler by implementing a more efficient algorithm for managing task priorities and reducing contention. This should help in reducing conflicts and improving overall VM performance during high load demands involving multiple tasks, including high load demands.	60	0	REVERT
1774474379.093	Optimize the virtual memory (VM) paging mechanism by implementing a more efficient algorithm for managing page allocation and reducing fragmentation. This should help in reducing conflicts and improving overall VM performance during high load demands involving multiple tasks, including high load demands.	60	0	REVERT
1774474445.062	Optimize the file system caching mechanism by implementing a more efficient algorithm for managing cache data and reducing I/O contention. This should help in reducing conflicts and improving overall VM performance during high load demands involving multiple tasks, including high load demands.	60	0	REVERT
1774474509.841	Optimize the task scheduler by implementing a more efficient algorithm for managing task priorities and reducing contention. This should help in reducing conflicts and improving overall VM performance during high load demands involving multiple tasks, including high load demands.	60	0	REVERT
1774474575.382	Optimize the memory handling mechanism by implementing a more efficient algorithm for managing memory allocation and reducing fragmentation. This should help in reducing conflicts and improving overall VM performance during high load demands involving multiple tasks, including high load demands.	60	0	REVERT
1774474640.602	Optimize the logging mechanism by implementing a more efficient data structure for storing log entries and reducing disk I/O contention. This should help in reducing conflicts and improving overall VM performance during high load demands involving multiple tasks, including high load demands.	60	0	REVERT
1774474705.28	Optimize the task scheduler by implementing a more efficient algorithm for managing task priorities and reducing contention. This should help in reducing conflicts and improving overall VM performance during high load demands involving multiple tasks, including high load demands.	60	0	REVERT
1774474770.858	Optimize the GPU status by implementing a more efficient algorithm for managing GPU resources and reducing contention. This should help in reducing conflicts and improving overall VM performance during high load demands involving multiple tasks, including high load demands.	60	0	REVERT
1774474836.09	Optimize the file system caching mechanism by implementing a more efficient algorithm for managing cache entries and reducing disk I/O contention. This should help in reducing conflicts and improving overall VM performance during high load demands involving multiple tasks, including high load demands.	60	0	REVERT
1774474902.193	Optimize the concurrency control mechanism by implementing a more efficient algorithm for managing thread synchronization and reducing contention. This should help in reducing conflicts and improving overall VM performance during high load demands involving multiple tasks, including high load demands.	60	0	REVERT
1774474967.344	Optimize the memory handling mechanism by implementing more efficient data structures and algorithms for managing memory allocation and deallocation. This should help in reducing conflicts and improving overall VM performance during high load demands involving multiple tasks, including high load demands.	60	0	REVERT
1774475032.576	Optimize the logging mechanism by implementing a more efficient algorithm for managing log entries and reducing disk I/O contention. This should help in reducing conflicts and improving overall VM performance during high load demands involving multiple tasks, including high load demands.	60	0	REVERT
1774475098.562	Optimize the task scheduling mechanism by implementing a more efficient algorithm for managing task priorities and reducing context switching. This should help in reducing conflicts and improving overall VM performance during high load demands involving multiple tasks, including high load demands.	60	0	REVERT
1774475163.733	Optimize the GPU status management by implementing a more efficient algorithm for managing GPU resources and reducing contention. This should help in reducing conflicts and improving overall VM performance during high load demands involving multiple tasks, including high load demands.	60	0	REVERT
1774475229.286	Optimize the file system caching mechanism by implementing a more efficient algorithm for managing cache entries and reducing disk I/O contention. This should help in reducing conflicts and improving overall VM performance during high load demands involving multiple tasks, including high load demands.	60	0	REVERT
1774475295.255	Optimize the concurrency control mechanism by implementing a more efficient algorithm for managing concurrent access and reducing contention. This should help in reducing conflicts and improving overall VM performance during high load demands involving multiple tasks, including high load demands.	60	0	REVERT
1774475360.176	Optimize the memory handling mechanism by implementing a more efficient algorithm for managing memory allocation and reducing fragmentation. This should help in reducing conflicts and improving overall VM performance during high load demands involving multiple tasks, including high load demands.	60	0	REVERT
1774475425.492	Optimize the logging mechanism by implementing a more efficient algorithm for managing log entries and reducing disk I/O contention. This should help in reducing conflicts and improving overall VM performance during high load demands involving multiple tasks, including high load demands.	60	0	REVERT
1774475459.495	Extend the vertical edge marker range from rows 450-474 to rows 450-479 to provide consistent boundary markers for all 4 lines of text. This ensures the qwen3-vl-8b vision model has clear visual alignment cues across the entire INPUT ZONE text area, improving text extraction accuracy from 95%+ to 100%.	5	1	KEEP
1774475491.614	Optimize the task scheduling mechanism by implementing a more efficient algorithm for managing task priorities and reducing contention. This should help in reducing conflicts and improving overall VM performance during high load demands involving multiple tasks, including high load demands.	60	0	REVERT
1774475557.501	Optimize the task scheduling mechanism by implementing a more efficient algorithm for managing task priorities and reducing contention. This should help in reducing conflicts and improving overall VM performance during high load demands involving multiple tasks, including high load demands.	60	0	REVERT
1774475622.687	Optimize the file system caching mechanism by implementing a more efficient algorithm for managing cache entries and reducing disk I/O contention. This should help in reducing conflicts and improving overall VM performance during high load demands involving multiple tasks, including high load demands.	60	0	REVERT
1774475686.507	Completing the `process_input_text()` function with proper WGSL syntax and adding a defensive clamp in `get_font_column` will ensure shader compiles correctly and prevent memory access violations during atomic patching operations.	5	1	KEEP
1774475687.932	Optimize the concurrency control mechanism by implementing a more efficient algorithm for managing concurrent access and reducing lock contention. This should help in reducing conflicts and improving overall VM performance during high load demands involving multiple tasks, including high load demands.	60	0	REVERT
1774475753.892	Optimize the memory management mechanism by implementing a more efficient algorithm for managing memory allocation and deallocation. This should help in reducing conflicts and improving overall VM performance during high load demands involving multiple tasks, including high load demands.	60	0	REVERT
1774475819.558	Optimize the logging mechanism by implementing a more efficient algorithm for managing log entries and reducing disk I/O contention. This should help in reducing conflicts and improving overall VM performance during high load demands involving multiple tasks, including high load demands.	60	0	REVERT
1774475884.53	Optimize the GPU status handling by implementing a more efficient algorithm for managing GPU resources and reducing contention events. This should help in reducing conflicts and improving overall VM performance during high load demands involving multiple tasks, including high load demands.	60	0	REVERT
1774475949.917	Optimize the task scheduling mechanism by implementing a more efficient algorithm for managing task priorities and reducing task contention events. This should help in reducing conflicts and improving overall VM performance during high load demands involving multiple tasks, including high load demands.	60	0	REVERT
1774476015.707	Optimize the data structures used for managing tasks by replacing or refining them with more efficient alternatives. This should help in reducing conflicts and improving overall VM performance during high load demands involving multiple tasks, including high load demands.	60	0	REVERT
1774476053.52	Improve cursor visibility by: 1) Increasing width from 2px to 3px for better OCR segmentation, 2) Reducing blink cycle from 32 to 20 frames (333ms) for more frequent visibility, 3) Boosting brightness to pure green (0,255,0) for maximum contrast against white text and black background.	5	1	KEEP
1774476081.29	Optimize the concurrency control mechanism by implementing a more efficient algorithm for managing concurrent operations and reducing contention events. This should help in reducing conflicts and improving overall VM performance during high load demands involving multiple tasks, including high load demands.	60	0	REVERT
1774476146.278	Optimize the memory handling mechanism by implementing a more efficient algorithm for managing memory allocation and reducing fragmentation events. This should help in reducing conflicts and improving overall VM performance during high load demands involving multiple tasks, including high load demands.	60	0	REVERT
1774476211.569	Optimize the file system caching mechanism by implementing a more efficient algorithm for managing cache entries and reducing cache contention events. This should help in reducing conflicts and improving overall VM performance during high load demands involving multiple tasks, including high load demands.	60	0	REVERT
1774476277.372	Optimize the logging mechanism by implementing a more efficient algorithm for managing log entries and reducing log contention events. This should help in reducing conflicts and improving overall VM performance during high load demands involving multiple tasks, including high load demands.	60	0	REVERT
1774476343.099	Optimize the GPU handling mechanism by implementing a more efficient algorithm for managing GPU resources and reducing contention events. This should help in reducing conflicts and improving overall VM performance during high load demands involving multiple tasks, including high load demands.	60	0	REVERT
1774476408.31	Optimize the task scheduling algorithm by implementing a more efficient and fair scheduling mechanism that minimizes contention events and maximizes resource utilization. This should help in reducing conflicts and improving overall VM performance during high load demands involving multiple tasks, including high load demands.	60	0	REVERT
1774476474.06	Optimize the concurrency control mechanism by implementing a more efficient algorithm for managing concurrent operations and reducing contention events. This should help in reducing conflicts and improving overall VM performance during high load demands involving multiple tasks, including high load demands.	60	0	REVERT
1774476492.065	We need to add a function that processes the input buffer and generates valid VM opcodes based on the extracted text. This function should be called at each frame update and its results should be used to patch the agent's memory atomically.	5	1	KEEP
1774476539.712	Optimize the memory management mechanism by implementing a more efficient algorithm for managing memory allocations and reducing fragmentation events. This should help in reducing conflicts and improving overall VM performance during high load demands involving multiple tasks, including high load demands.	60	0	REVERT
1774476604.941	Optimize the file system caching mechanism by implementing a more efficient algorithm for managing cache entries and reducing cache contention events. This should help in reducing conflicts and improving overall VM performance during high load demands involving multiple tasks, including high load demands.	60	0	REVERT
1774476657.223	Add a render_patch_status function to display 'PATCH_SUCCESS' (green) or 'PATCH_FAIL' (red) in rows 475-479, enabling the host system to provide atomic feedback after memory patching operations.	5	1	KEEP
