timestamp	hypothesis	baseline	metric	status
1774170729.8808894	Cache OP_NAMES lookup for faster dispatch	4041170.0	3903217.0	REVERT
1774171526.4528685	Cache OP_NAMES lookup for faster dispatch	56	56	REVERT
1774171588.4896111	Cache OP_NAMES lookup for faster dispatch	91	91	KEEP
1774171730.4571776	Cache OP_NAMES lookup for faster dispatch	91	91	KEEP
1774172111.8653412	Add SPARKLINE formula function for metric history	91	91	KEEP
1774179103.5822182	Cache opcode names for faster VM dispatch	92	92	KEEP
1774179134.3648944	Add formula for GPU performance tracking	92	92	KEEP
1774181421.2911735	Add formula for GPU performance tracking	94	94	KEEP
1774182027.146937	inline function call for faster execution	94	94	KEEP
1774182135.7351825	implement new opcode for experimental features	94	94	KEEP
1774182390.6178625	add logging for better debugging	94	94	KEEP
1774182426.129701	add try-catch error handling	94	94	KEEP
1774182523.8265555	add utility method to VMState for tracking	94	94	KEEP
1774182546.5254881	add performance counter to track ops	94	94	KEEP
1774184844.6633494	Add a reset method to VMState class	87	87	KEEP
1774184916.7344038	Add a reset method to VMState class	87	87	KEEP
1774184981.3847413	Add a reset method to VMState class	87	87	KEEP
1774186877.377	Add a reset method to VMState class	100 iterations	100	KEEP
1774209738.28	Test Bridge Optimization	10ms	1	KEEP
1774231703.634	Optimize mem resource utilization	28	1	KEEP
1774231763.634	Optimize mem resource utilization	28	1	KEEP
1774231823.634	Optimize mem resource utilization	28	1	KEEP
1774231883.635	Optimize mem resource utilization	28	1	KEEP
1774231943.635	Optimize mem resource utilization	28	1	KEEP
1774231964.919	Optimize mem resource utilization	28	1	KEEP
1774232003.637	Optimize mem resource utilization	28	1	KEEP
1774232024.919	Optimize mem resource utilization	28	1	KEEP
1774232063.639	Optimize mem resource utilization	28	1	KEEP
1774232084.919	Optimize mem resource utilization	28	1	KEEP
1774232123.639	Optimize mem resource utilization	28	1	KEEP
1774232144.919	Optimize mem resource utilization	28	1	KEEP
1774232183.673	Optimize mem resource utilization	28	1	KEEP
1774232204.919	Optimize mem resource utilization	28	1	KEEP
1774232243.726	Optimize mem resource utilization	28	1	KEEP
1774232264.92	Optimize mem resource utilization	28	1	KEEP
1774232303.777	Optimize mem resource utilization	28	1	KEEP
1774232324.92	Optimize mem resource utilization	28	1	KEEP
1774232363.817	Optimize mem resource utilization	28	1	KEEP
1774232384.923	Optimize mem resource utilization	28	1	KEEP
1774232423.872	Optimize mem resource utilization	28	1	KEEP
1774232444.977	Optimize mem resource utilization	28	1	KEEP
1774232483.927	Optimize mem resource utilization	28	1	KEEP
1774232504.99	Optimize mem resource utilization	28	1	KEEP
1774232543.97	Optimize mem resource utilization	28	1	KEEP
1774232565.018	Optimize mem resource utilization	28	1	KEEP
1774232603.998	Optimize mem resource utilization	28	1	KEEP
1774232625.046	Optimize mem resource utilization	28	1	KEEP
1774232664.033	Optimize mem resource utilization	28	1	KEEP
1774232685.099	Optimize mem resource utilization	28	1	KEEP
1774232724.087	Optimize mem resource utilization	28	1	KEEP
1774232745.148	Optimize mem resource utilization	28	1	KEEP
1774232784.141	Optimize mem resource utilization	28	1	KEEP
1774232805.203	Optimize mem resource utilization	28	1	KEEP
1774232844.195	Optimize mem resource utilization	28	1	KEEP
1774232865.258	Optimize mem resource utilization	28	1	KEEP
1774232904.25	Optimize mem resource utilization	28	1	KEEP
1774232925.311	Optimize mem resource utilization	28	1	KEEP
1774232964.305	Optimize mem resource utilization	28	1	KEEP
1774232985.365	Optimize mem resource utilization	28	1	KEEP
1774233024.323	Optimize mem resource utilization	28	1	KEEP
1774233045.408	Optimize mem resource utilization	28	1	KEEP
1774233084.367	Optimize mem resource utilization	28	1	KEEP
1774233105.462	Optimize mem resource utilization	28	1	KEEP
1774233144.423	Optimize mem resource utilization	28	1	KEEP
1774233165.495	Optimize mem resource utilization	28	1	KEEP
1774233204.478	Optimize mem resource utilization	28	1	KEEP
1774233225.54	Optimize mem resource utilization	28	1	KEEP
1774233264.533	Optimize mem resource utilization	28	1	KEEP
1774233285.584	Optimize mem resource utilization	28	1	KEEP
1774233324.588	Optimize mem resource utilization	28	1	KEEP
1774233345.62	Optimize mem resource utilization	28	1	KEEP
1774233384.619	Optimize mem resource utilization	28	1	KEEP
1774233405.674	Optimize mem resource utilization	28	1	KEEP
1774233444.657	Optimize mem resource utilization	28	1	KEEP
1774233465.73	Optimize mem resource utilization	28	1	KEEP
1774233504.711	Optimize mem resource utilization	28	1	KEEP
1774233525.785	Optimize mem resource utilization	28	1	KEEP
1774233564.754	Optimize mem resource utilization	28	1	KEEP
1774233585.837	Optimize mem resource utilization	28	1	KEEP
1774233624.786	Optimize mem resource utilization	28	1	KEEP
1774233645.893	Optimize mem resource utilization	28	1	KEEP
1774233684.824	Optimize mem resource utilization	28	1	KEEP
1774233705.93	Optimize mem resource utilization	28	1	KEEP
1774233744.863	Optimize mem resource utilization	28	1	KEEP
1774233765.972	Optimize mem resource utilization	28	1	KEEP
1774233804.917	Optimize mem resource utilization	28	1	KEEP
1774233826.027	Optimize mem resource utilization	28	1	KEEP
1774233864.948	Optimize mem resource utilization	28	1	KEEP
1774233886.082	Optimize mem resource utilization	28	1	KEEP
1774233924.981	Optimize mem resource utilization	28	1	KEEP
1774233946.116	Optimize mem resource utilization	28	1	KEEP
1774233985.01	Optimize mem resource utilization	28	1	KEEP
1774234045.064	Optimize mem resource utilization	28	1	KEEP
1774234105.12	Optimize mem resource utilization	28	1	KEEP
1774234165.174	Optimize mem resource utilization	28	1	KEEP
1774234225.229	Optimize mem resource utilization	28	1	KEEP
1774234285.284	Optimize mem resource utilization	28	1	KEEP
1774234345.336	Optimize mem resource utilization	28	1	KEEP
1774234405.362	Optimize mem resource utilization	28	1	KEEP
1774234465.418	Optimize mem resource utilization	28	1	KEEP
1774234525.463	Optimize mem resource utilization	28	1	KEEP
1774234585.517	Optimize mem resource utilization	28	1	KEEP
1774234674.722	Optimize mem resource utilization	28	1	KEEP
1774257058.795	Optimize mem resource utilization	28	1	KEEP
1774257118.795	Optimize mem resource utilization	28	1	KEEP
1774257208.795	Optimize mem resource utilization	28	1	KEEP
1774257268.795	Optimize mem resource utilization	28	1	KEEP
1774257328.796	Optimize mem resource utilization	28	1	KEEP
1774257388.796	Optimize mem resource utilization	28	1	KEEP
1774257478.796	Optimize mem resource utilization	28	1	KEEP
1774257538.829	Optimize mem resource utilization	28	1	KEEP
1774257598.833	Optimize mem resource utilization	28	1	KEEP
1774257658.865	Optimize mem resource utilization	28	1	KEEP
1774257718.917	Optimize mem resource utilization	28	1	KEEP
1774257778.95	Optimize mem resource utilization	28	1	KEEP
1774257838.991	Optimize mem resource utilization	28	1	KEEP
1774257899.044	Optimize mem resource utilization	28	1	KEEP
1774257959.075	Optimize mem resource utilization	28	1	KEEP
1774258019.107	Optimize mem resource utilization	28	1	KEEP
1774258079.137	Optimize mem resource utilization	28	1	KEEP
1774258139.187	Optimize mem resource utilization	28	1	KEEP
1774258199.241	Optimize mem resource utilization	28	1	KEEP
1774258259.295	Optimize mem resource utilization	28	1	KEEP
1774258319.339	Optimize mem resource utilization	28	1	KEEP
1774258379.394	Optimize mem resource utilization	28	1	KEEP
1774258439.442	Optimize mem resource utilization	28	1	KEEP
1774258499.477	Optimize mem resource utilization	28	1	KEEP
1774258559.519	Optimize mem resource utilization	28	1	KEEP
1774258619.558	Optimize mem resource utilization	28	1	KEEP
1774258679.599	Optimize mem resource utilization	28	1	KEEP
1774258739.653	Optimize mem resource utilization	28	1	KEEP
1774258799.706	Optimize mem resource utilization	28	1	KEEP
1774258859.758	Optimize mem resource utilization	28	1	KEEP
1774258919.813	Optimize mem resource utilization	28	1	KEEP
1774258979.868	Optimize mem resource utilization	28	1	KEEP
1774259039.912	Optimize mem resource utilization	28	1	KEEP
1774259099.965	Optimize mem resource utilization	28	1	KEEP
1774259160.019	Optimize mem resource utilization	28	1	KEEP
1774259220.049	Optimize mem resource utilization	28	1	KEEP
1774259280.104	Optimize mem resource utilization	28	1	KEEP
1774259340.14	Optimize mem resource utilization	28	1	KEEP
1774259400.195	Optimize mem resource utilization	28	1	KEEP
1774259460.245	Optimize mem resource utilization	28	1	KEEP
1774259520.263	Optimize mem resource utilization	28	1	KEEP
1774259580.319	Optimize mem resource utilization	28	1	KEEP
1774259640.351	Optimize mem resource utilization	28	1	KEEP
1774259700.405	Optimize mem resource utilization	28	1	KEEP
1774259760.454	Optimize mem resource utilization	28	1	KEEP
1774259820.506	Optimize mem resource utilization	28	1	KEEP
1774259880.534	Optimize mem resource utilization	28	1	KEEP
1774259940.588	Optimize mem resource utilization	28	1	KEEP
1774260000.628	Optimize mem resource utilization	28	1	KEEP
1774260060.656	Optimize mem resource utilization	28	1	KEEP
1774260120.682	Optimize mem resource utilization	28	1	KEEP
1774260180.737	Optimize mem resource utilization	28	1	KEEP
1774260240.792	Optimize mem resource utilization	28	1	KEEP
1774260300.827	Optimize mem resource utilization	28	1	KEEP
1774260360.881	Optimize mem resource utilization	28	1	KEEP
1774260420.923	Optimize mem resource utilization	28	1	KEEP
1774260480.955	Optimize mem resource utilization	28	1	KEEP
1774260483.672	Optimize mem resource utilization	28	1	KEEP
1774260541.01	Optimize mem resource utilization	28	1	KEEP
1774260543.672	Optimize mem resource utilization	28	1	KEEP
1774260601.064	Optimize mem resource utilization	28	1	KEEP
1774260603.673	Optimize mem resource utilization	28	1	KEEP
1774260661.12	Optimize mem resource utilization	28	1	KEEP
1774260663.673	Optimize mem resource utilization	28	1	KEEP
1774260721.155	Optimize mem resource utilization	28	1	KEEP
1774260723.673	Optimize mem resource utilization	28	1	KEEP
1774260781.211	Optimize mem resource utilization	28	1	KEEP
1774260783.673	Optimize mem resource utilization	28	1	KEEP
1774260841.266	Optimize mem resource utilization	28	1	KEEP
1774260843.673	Optimize mem resource utilization	28	1	KEEP
1774260901.321	Optimize mem resource utilization	28	1	KEEP
1774260903.676	Optimize mem resource utilization	28	1	KEEP
1774260961.35	Optimize mem resource utilization	28	1	KEEP
1774260963.729	Optimize mem resource utilization	28	1	KEEP
1774261021.404	Optimize mem resource utilization	28	1	KEEP
1774261023.783	Optimize mem resource utilization	28	1	KEEP
1774261081.46	Optimize mem resource utilization	28	1	KEEP
1774261083.838	Optimize mem resource utilization	28	1	KEEP
1774261141.515	Optimize mem resource utilization	28	1	KEEP
1774261143.892	Optimize mem resource utilization	28	1	KEEP
1774261201.57	Optimize mem resource utilization	28	1	KEEP
1774261203.923	Optimize mem resource utilization	28	1	KEEP
1774261261.626	Optimize mem resource utilization	28	1	KEEP
1774261263.976	Optimize mem resource utilization	28	1	KEEP
1774261321.667	Optimize mem resource utilization	28	1	KEEP
1774261324.009	Optimize mem resource utilization	28	1	KEEP
1774261381.686	Optimize mem resource utilization	28	1	KEEP
1774261384.035	Optimize mem resource utilization	28	1	KEEP
1774261441.741	Optimize mem resource utilization	28	1	KEEP
1774261444.09	Optimize mem resource utilization	28	1	KEEP
1774261501.777	Optimize mem resource utilization	28	1	KEEP
1774261504.141	Optimize mem resource utilization	28	1	KEEP
1774261561.833	Optimize mem resource utilization	28	1	KEEP
1774261564.185	Optimize mem resource utilization	28	1	KEEP
1774261621.889	Optimize mem resource utilization	28	1	KEEP
1774261624.24	Optimize mem resource utilization	28	1	KEEP
1774261681.944	Optimize mem resource utilization	28	1	KEEP
1774261684.296	Optimize mem resource utilization	28	1	KEEP
1774261741.973	Optimize mem resource utilization	28	1	KEEP
1774261744.35	Optimize mem resource utilization	28	1	KEEP
1774261802.028	Optimize mem resource utilization	28	1	KEEP
1774261804.404	Optimize mem resource utilization	28	1	KEEP
1774261862.055	Optimize mem resource utilization	28	1	KEEP
1774261864.461	Optimize mem resource utilization	28	1	KEEP
1774261922.097	Optimize mem resource utilization	28	1	KEEP
1774261924.501	Optimize mem resource utilization	28	1	KEEP
1774261982.153	Optimize mem resource utilization	28	1	KEEP
1774261984.549	Optimize mem resource utilization	28	1	KEEP
1774262042.208	Optimize mem resource utilization	28	1	KEEP
1774262044.601	Optimize mem resource utilization	28	1	KEEP
1774262102.263	Optimize mem resource utilization	28	1	KEEP
1774262104.646	Optimize mem resource utilization	28	1	KEEP
1774262162.318	Optimize mem resource utilization	28	1	KEEP
1774262164.701	Optimize mem resource utilization	28	1	KEEP
1774262222.373	Optimize mem resource utilization	28	1	KEEP
1774262224.734	Optimize mem resource utilization	28	1	KEEP
1774262282.414	Optimize mem resource utilization	28	1	KEEP
1774262284.79	Optimize mem resource utilization	28	1	KEEP
1774262342.46	Optimize mem resource utilization	28	1	KEEP
1774262344.845	Optimize mem resource utilization	28	1	KEEP
1774262402.506	Optimize mem resource utilization	28	1	KEEP
1774262404.9	Optimize mem resource utilization	28	1	KEEP
1774262462.561	Optimize mem resource utilization	28	1	KEEP
1774262464.955	Optimize mem resource utilization	28	1	KEEP
1774262522.615	Optimize mem resource utilization	28	1	KEEP
1774262524.972	Optimize mem resource utilization	28	1	KEEP
1774262582.667	Optimize mem resource utilization	28	1	KEEP
1774262584.998	Optimize mem resource utilization	28	1	KEEP
1774262642.705	Optimize mem resource utilization	28	1	KEEP
1774262645.054	Optimize mem resource utilization	28	1	KEEP
1774262702.761	Optimize mem resource utilization	28	1	KEEP
1774262705.09	Optimize mem resource utilization	28	1	KEEP
1774262762.816	Optimize mem resource utilization	28	1	KEEP
1774262765.123	Optimize mem resource utilization	28	1	KEEP
1774262822.862	Optimize mem resource utilization	28	1	KEEP
1774262825.156	Optimize mem resource utilization	28	1	KEEP
1774262881.926	Directly write bootstrap bytecode to VM memory at execution address	5	0	REVERT
1774262882.917	Optimize mem resource utilization	28	1	KEEP
1774262885.205	Optimize mem resource utilization	28	1	KEEP
1774262942.952	Optimize mem resource utilization	28	1	KEEP
1774262945.233	Optimize mem resource utilization	28	1	KEEP
1774263002.991	Optimize mem resource utilization	28	1	KEEP
1774263005.275	Optimize mem resource utilization	28	1	KEEP
1774263063.045	Optimize mem resource utilization	28	1	KEEP
1774263065.33	Optimize mem resource utilization	28	1	KEEP
1774263123.1	Optimize mem resource utilization	28	1	KEEP
1774263125.385	Optimize mem resource utilization	28	1	KEEP
1774263183.138	Optimize mem resource utilization	28	1	KEEP
1774263185.437	Optimize mem resource utilization	28	1	KEEP
1774263243.193	Optimize mem resource utilization	28	1	KEEP
1774263245.492	Optimize mem resource utilization	28	1	KEEP
1774263303.248	Optimize mem resource utilization	28	1	KEEP
1774263305.51	Optimize mem resource utilization	28	1	KEEP
1774263363.303	Optimize mem resource utilization	28	1	KEEP
1774263365.546	Optimize mem resource utilization	28	1	KEEP
1774263423.359	Optimize mem resource utilization	28	1	KEEP
1774263425.6	Optimize mem resource utilization	28	1	KEEP
1774263483.395	Optimize mem resource utilization	28	1	KEEP
1774263485.644	Optimize mem resource utilization	28	1	KEEP
1774263543.449	Optimize mem resource utilization	28	1	KEEP
1774263545.688	Optimize mem resource utilization	28	1	KEEP
1774263603.504	Optimize mem resource utilization	28	1	KEEP
1774263605.743	Optimize mem resource utilization	28	1	KEEP
1774263663.56	Optimize mem resource utilization	28	1	KEEP
1774263665.792	Optimize mem resource utilization	28	1	KEEP
1774263723.615	Optimize mem resource utilization	28	1	KEEP
1774263725.831	Optimize mem resource utilization	28	1	KEEP
1774263783.669	Optimize mem resource utilization	28	1	KEEP
1774263785.873	Optimize mem resource utilization	28	1	KEEP
1774263843.719	Optimize mem resource utilization	28	1	KEEP
1774263845.928	Optimize mem resource utilization	28	1	KEEP
1774263903.773	Optimize mem resource utilization	28	1	KEEP
1774263905.983	Optimize mem resource utilization	28	1	KEEP
1774263963.828	Optimize mem resource utilization	28	1	KEEP
1774263966.021	Optimize mem resource utilization	28	1	KEEP
1774264023.861	Optimize mem resource utilization	28	1	KEEP
1774264026.048	Optimize mem resource utilization	28	1	KEEP
1774264083.913	Optimize mem resource utilization	28	1	KEEP
1774264086.078	Optimize mem resource utilization	28	1	KEEP
1774264128.02	Trigger VM initialization using standard boot/initialize command	10	0	REVERT
1774264143.969	Optimize mem resource utilization	28	1	KEEP
1774264146.133	Optimize mem resource utilization	28	1	KEEP
1774264203.98	Optimize mem resource utilization	28	1	KEEP
1774264206.158	Optimize mem resource utilization	28	1	KEEP
1774264264.035	Optimize mem resource utilization	28	1	KEEP
1774264266.213	Optimize mem resource utilization	28	1	KEEP
1774264324.09	Optimize mem resource utilization	28	1	KEEP
1774264326.245	Optimize mem resource utilization	28	1	KEEP
1774264384.146	Optimize mem resource utilization	28	1	KEEP
1774264386.301	Optimize mem resource utilization	28	1	KEEP
1774264444.202	Optimize mem resource utilization	28	1	KEEP
1774264446.356	Optimize mem resource utilization	28	1	KEEP
1774264504.257	Optimize mem resource utilization	28	1	KEEP
1774264506.385	Optimize mem resource utilization	28	1	KEEP
1774264564.29	Optimize mem resource utilization	28	1	KEEP
1774264566.417	Optimize mem resource utilization	28	1	KEEP
1774264624.344	Optimize mem resource utilization	28	1	KEEP
1774264626.451	Optimize mem resource utilization	28	1	KEEP
1774264684.387	Optimize mem resource utilization	28	1	KEEP
1774264686.479	Optimize mem resource utilization	28	1	KEEP
1774264744.441	Optimize mem resource utilization	28	1	KEEP
1774264746.532	Optimize mem resource utilization	28	1	KEEP
1774264804.47	Optimize mem resource utilization	28	1	KEEP
1774264806.565	Optimize mem resource utilization	28	1	KEEP
1774264864.517	Optimize mem resource utilization	28	1	KEEP
1774264866.619	Optimize mem resource utilization	28	1	KEEP
1774264924.565	Optimize mem resource utilization	28	1	KEEP
1774264926.675	Optimize mem resource utilization	28	1	KEEP
1774264984.62	Optimize mem resource utilization	28	1	KEEP
1774264986.688	Optimize mem resource utilization	28	1	KEEP
1774265044.674	Optimize mem resource utilization	28	1	KEEP
1774265046.735	Optimize mem resource utilization	28	1	KEEP
1774265104.716	Optimize mem resource utilization	28	1	KEEP
1774265106.762	Optimize mem resource utilization	28	1	KEEP
1774265164.754	Optimize mem resource utilization	28	1	KEEP
1774265166.817	Optimize mem resource utilization	28	1	KEEP
1774265224.786	Optimize mem resource utilization	28	1	KEEP
1774265226.871	Optimize mem resource utilization	28	1	KEEP
1774265284.834	Optimize mem resource utilization	28	1	KEEP
1774265286.91	Optimize mem resource utilization	28	1	KEEP
1774265344.877	Optimize mem resource utilization	28	1	KEEP
1774265346.965	Optimize mem resource utilization	28	1	KEEP
1774265404.923	Optimize mem resource utilization	28	1	KEEP
1774265407.02	Optimize mem resource utilization	28	1	KEEP
1774265464.956	Optimize mem resource utilization	28	1	KEEP
1774265467.058	Optimize mem resource utilization	28	1	KEEP
1774265525.005	Optimize mem resource utilization	28	1	KEEP
1774265527.101	Optimize mem resource utilization	28	1	KEEP
1774265585.061	Optimize mem resource utilization	28	1	KEEP
1774265587.155	Optimize mem resource utilization	28	1	KEEP
1774265645.116	Optimize mem resource utilization	28	1	KEEP
1774265647.198	Optimize mem resource utilization	28	1	KEEP
1774265705.17	Optimize mem resource utilization	28	1	KEEP
1774265707.252	Optimize mem resource utilization	28	1	KEEP
1774265765.226	Optimize mem resource utilization	28	1	KEEP
1774265767.308	Optimize mem resource utilization	28	1	KEEP
1774265825.281	Optimize mem resource utilization	28	1	KEEP
1774265827.363	Optimize mem resource utilization	28	1	KEEP
1774265885.313	Optimize mem resource utilization	28	1	KEEP
1774265887.418	Optimize mem resource utilization	28	1	KEEP
1774265945.368	Optimize mem resource utilization	28	1	KEEP
1774265947.473	Optimize mem resource utilization	28	1	KEEP
1774266005.423	Optimize mem resource utilization	28	1	KEEP
1774266007.51	Optimize mem resource utilization	28	1	KEEP
1774266065.477	Optimize mem resource utilization	28	1	KEEP
1774266067.566	Optimize mem resource utilization	28	1	KEEP
1774266125.533	Optimize mem resource utilization	28	1	KEEP
1774266127.614	Optimize mem resource utilization	28	1	KEEP
1774266185.585	Optimize mem resource utilization	28	1	KEEP
1774266187.668	Optimize mem resource utilization	28	1	KEEP
1774266245.64	Optimize mem resource utilization	28	1	KEEP
1774266247.704	Optimize mem resource utilization	28	1	KEEP
1774266305.666	Optimize mem resource utilization	28	1	KEEP
1774266307.735	Optimize mem resource utilization	28	1	KEEP
1774266365.68	Optimize mem resource utilization	28	1	KEEP
1774266367.769	Optimize mem resource utilization	28	1	KEEP
1774266425.734	Optimize mem resource utilization	28	1	KEEP
1774266427.824	Optimize mem resource utilization	28	1	KEEP
1774266485.789	Optimize mem resource utilization	28	1	KEEP
1774266487.878	Optimize mem resource utilization	28	1	KEEP
1774266545.845	Optimize mem resource utilization	28	1	KEEP
1774266547.934	Optimize mem resource utilization	28	1	KEEP
1774266605.85	Optimize mem resource utilization	28	1	KEEP
1774266607.988	Optimize mem resource utilization	28	1	KEEP
