timestamp	hypothesis	baseline	metric	status
1774426786.519	Conduct a detailed analysis of the VM's context switching mechanism during concurrent operations. Identify any potential misconfigurations or bugs that might be leading to improper execution and modify them to ensure proper handling of context switching to improve performance.	60	0	REVERT
1774426851.339	Conduct a detailed analysis of the VM's memory management mechanism during concurrent operations. Identify any potential misconfigurations or bugs that might be leading to improper execution and modify them to ensure proper handling of memory management to improve performance.	60	0	REVERT
1774426916.39	Conduct a detailed analysis of the VM's task scheduling mechanism during concurrent operations. Identify any potential misconfigurations or bugs that might be leading to improper execution and modify them to ensure proper handling of task scheduling to improve performance.	60	0	REVERT
1774426981.69	Conduct a detailed analysis of the VM's thread synchronization mechanism during concurrent operations. Identify any potential misconfigurations or bugs that might be leading to improper execution and modify them to ensure proper handling of thread synchronization to improve performance.	60	0	REVERT
1774427046.724	Conduct a detailed analysis of the VM's resource contention mechanism during concurrent operations. Identify any potential misconfigurations or bugs that might be leading to improper execution and modify them to ensure proper handling of resource contention to improve performance.	60	0	REVERT
1774427111.809	Conduct a detailed analysis of the VM's system call handling mechanism during concurrent operations. Identify any potential misconfigurations or bugs that might be leading to improper execution and modify them to ensure proper handling of system calls to improve performance.	60	0	REVERT
1774427176.766	Conduct a detailed analysis of the VM's context switching mechanism during concurrent operations. Identify any potential misconfigurations or bugs that might be leading to improper execution and modify them to ensure proper handling of context switching to improve performance.	60	0	REVERT
1774427241.52	Conduct a detailed analysis of the VM's resource allocation and deallocation mechanism during concurrent operations. Identify any potential misconfigurations or bugs that might be leading to improper execution and modify them to ensure proper handling of resource management to improve performance.	60	0	REVERT
1774427306.447	Conduct a detailed analysis of the VM's task management mechanism during concurrent operations. Identify any potential misconfigurations or bugs in process scheduling and thread management that might be leading to improper execution and modify them to ensure proper handling of task management to improve performance.	60	0	REVERT
1774427371.543	Conduct a detailed analysis of the VM's memory management mechanism during concurrent operations. Identify any potential misconfigurations or bugs that might be leading to improper execution and modify them to ensure proper handling of memory management to improve performance.	60	0	REVERT
1774427436.941	Conduct a detailed analysis of the VM's thread synchronization mechanism during concurrent operations. Identify any potential misconfigurations or bugs that might be leading to improper execution and modify them to ensure proper handling of thread synchronization to improve performance.	60	0	REVERT
1774427501.857	Conduct a detailed analysis of the VM's system call handling mechanism during concurrent operations. Identify any potential misconfigurations or bugs that might be leading to improper execution and modify them to ensure proper handling of system call management to improve performance.	60	0	REVERT
1774427566.45	Conduct a detailed analysis of the VM's context switching mechanism during concurrent operations. Identify any potential misconfigurations or bugs that might be leading to improper execution and modify them to ensure proper handling of context switching to improve performance.	60	0	REVERT
1774427630.989	Conduct a detailed analysis of the VM's resource management mechanism during concurrent operations. Identify any potential misconfigurations or bugs that might be leading to improper execution and modify them to ensure proper handling of resource management to improve performance.	60	0	REVERT
1774427695.874	Conduct a detailed analysis of the VM's task scheduling mechanism during concurrent operations. Identify any potential misconfigurations or bugs that might be leading to improper execution and modify them to ensure proper handling of task scheduling to improve performance.	60	0	REVERT
1774427760.661	Conduct a detailed analysis of the VM's memory management mechanism during concurrent operations. Identify any potential misconfigurations or bugs that might be leading to improper execution and modify them to ensure proper handling of memory management to improve performance.	60	0	REVERT
1774427825.301	Conduct a detailed analysis of the VM's inter-core communication mechanism during concurrent operations. Identify any potential misconfigurations or bugs that might be leading to improper execution and modify them to ensure proper handling of inter-core communication to improve performance.	60	0	REVERT
1774427889.766	Conduct a detailed analysis of the VM's cache coherence mechanism during concurrent operations. Identify any potential misconfigurations or bugs that might be leading to improper execution and modify them to ensure proper handling of cache coherence to improve performance.	60	0	REVERT
1774427954.337	Conduct a detailed analysis of the VM's concurrent memory access mechanism during operations. Identify any potential misconfigurations or bugs that might be leading to improper execution and modify them to ensure proper handling of concurrent memory access to improve performance.	60	0	REVERT
1774428019.19	Conduct a detailed analysis of the VM's task scheduling mechanism during concurrent operations. Identify any potential misconfigurations or bugs that might be leading to improper execution and modify them to ensure proper handling of task scheduling to improve performance.	60	0	REVERT
1774428083.85	Conduct a detailed analysis of the VM's resource management mechanism during concurrent operations. Identify any potential misconfigurations or bugs that might be leading to improper execution and modify them to ensure proper handling of resource management to improve performance.	60	0	REVERT
1774428148.501	Conduct a detailed analysis of the VM's thread synchronization mechanism during concurrent operations. Identify any potential misconfigurations or bugs that might be leading to improper execution and modify them to ensure proper handling of thread synchronization to improve performance.	60	0	REVERT
1774428212.962	Conduct a detailed analysis of the VM's memory management mechanism during concurrent operations. Identify any potential misconfigurations or bugs that might be leading to improper execution and modify them to ensure proper handling of memory management to improve performance.	60	0	REVERT
1774428277.594	Conduct a holistic analysis of the VM's memory access and synchronization mechanisms, focusing on their interactions and potential bottlenecks. Identify any misconfigurations or inefficiencies that might be causing improper execution and modify them to ensure proper handling of these mechanisms to improve performance.	60	0	REVERT
1774428342.167	Conduct a detailed analysis of the interactions between the VM's resource management and thread synchronization mechanisms during concurrent operations. Identify any potential misconfigurations or inefficiencies that might be causing improper execution and modify them to ensure proper handling of these mechanisms to improve performance.	60	0	REVERT
1774428406.583	Conduct a detailed analysis of the interactions between the VM's memory management and thread synchronization mechanisms during concurrent operations. Identify any potential misconfigurations or inefficiencies that might be causing improper execution and modify them to ensure proper handling of these mechanisms to improve performance.	60	0	REVERT
1774428470.917	Conduct a detailed analysis of the VM's caching mechanisms during concurrent operations with memory-intensive workloads. Identify any potential misconfigurations or inefficiencies that might be causing improper execution and modify them to ensure proper handling of caching to improve performance.	60	0	REVERT
1774428535.242	Conduct a detailed analysis of the VM's scheduling and thread management mechanisms during concurrent operations with high resource demands. Identify any potential misconfigurations or inefficiencies that might be causing improper execution and modify them to ensure proper handling of these mechanisms to improve performance.	60	0	REVERT
1774428599.879	Conduct a detailed analysis of the interactions between the VM's memory access and thread synchronization mechanisms during concurrent operations with heavy memory usage. Identify any potential misconfigurations or inefficiencies that might be causing improper execution and modify them to ensure proper handling of these mechanisms to improve performance.	60	0	REVERT
1774428664.15	Conduct a detailed analysis of the VM's context switching mechanism during concurrent operations with high context switching demands. Identify any potential misconfigurations or inefficiencies that might be causing improper execution and modify them to ensure proper handling of these mechanisms to improve performance.	60	0	REVERT
1774428728.587	Conduct a detailed analysis of the VM's data structures used for handling concurrent operations. Identify any potential misconfigurations or inefficiencies that might be causing improper execution and modify them to ensure proper handling of these structures to improve performance.	60	0	REVERT
1774428792.882	Conduct a detailed analysis of the VM's communication protocols used for handling concurrent operations. Identify any potential misconfigurations or inefficiencies that might be causing improper execution and modify them to ensure proper handling of these protocols to improve performance.	60	0	REVERT
1774428857.149	Conduct a detailed analysis of the interactions between the VM's caching mechanisms during concurrent operations with heavy memory usage. Identify any potential misconfigurations or inefficiencies that might be causing improper execution and modify them to ensure proper handling of these mechanisms to improve performance.	60	0	REVERT
1774428921.682	Conduct a detailed analysis of the VM's scheduling and preemption mechanisms during concurrent operations with high load demands. Identify any potential misconfigurations or inefficiencies that might be causing improper execution and modify them to ensure proper handling of these mechanisms to improve performance.	60	0	REVERT
1774428986.162	Conduct a detailed analysis of the VM's memory management and allocation mechanisms during concurrent operations with heavy memory usage. Identify any potential misconfigurations or inefficiencies that might be causing improper execution and modify them to ensure proper handling of these mechanisms to improve performance.	60	0	REVERT
1774429050.665	Conduct a detailed analysis of the VM's instruction execution and cache coherence mechanisms during concurrent operations with high load demands. Identify any potential misconfigurations or inefficiencies that might be causing improper execution and modify them to ensure proper handling of these mechanisms to improve performance.	60	0	REVERT
1774429115.211	Conduct a detailed analysis of the VM's interrupt handling and scheduling mechanisms during concurrent operations with high load demands. Identify any potential misconfigurations or inefficiencies that might be causing improper execution and modify them to ensure proper handling of these mechanisms to improve performance.	60	0	REVERT
1774429180.009	Conduct a detailed analysis of the VM's CPU and memory allocation mechanisms during concurrent operations with heavy memory usage. Identify any potential misconfigurations or inefficiencies that might be causing improper execution and modify them to ensure proper handling of these mechanisms to improve performance.	60	0	REVERT
1774429244.802	Conduct a detailed analysis of the VM's thread and task management mechanisms during concurrent operations with high load demands. Identify any potential misconfigurations or inefficiencies that might be causing improper execution and modify them to ensure proper handling of these mechanisms to improve performance.	60	0	REVERT
1774429309.441	Conduct a detailed analysis of the VM's context switching mechanism during concurrent operations with high load demands. Identify any potential misconfigurations or inefficiencies that might be causing improper execution and modify them to ensure proper handling of this mechanism to improve performance.	60	0	REVERT
1774429373.966	Conduct a detailed analysis of the VM's synchronization mechanisms during concurrent operations with high load demands. Identify any potential misconfigurations or inefficiencies that might be causing improper execution and modify them to ensure proper handling of these mechanisms to improve performance.	60	0	REVERT
1774429438.552	Conduct a detailed analysis of the VM's interrupt handling and scheduling mechanisms during concurrent operations with high load demands. Identify any potential misconfigurations or inefficiencies that might be causing improper execution and modify them to ensure proper handling of these mechanisms to improve performance.	60	0	REVERT
1774429503.428	Conduct a detailed analysis of the VM's page table management and memory allocation mechanisms during concurrent operations with heavy memory usage. Identify any potential misconfigurations or inefficiencies that might be causing improper execution and modify them to ensure proper handling of these mechanisms to improve performance.	60	0	REVERT
1774429568.173	Conduct a detailed analysis of the VM's thread and task management mechanisms during concurrent operations with high load demands. Identify any potential misconfigurations or inefficiencies that might be causing improper execution and modify them to ensure proper handling of these mechanisms to improve performance.	60	0	REVERT
1774429632.992	Conduct a detailed analysis of the VM's cache management mechanisms during concurrent operations with high load demands. Identify any potential misconfigurations or inefficiencies that might be causing improper execution and modify them to ensure proper handling of these mechanisms to improve performance.	60	0	REVERT
1774429697.637	Conduct a detailed analysis of the VM's interrupt handling and scheduling mechanisms during concurrent operations with high load demands. Identify any potential misconfigurations or inefficiencies that might be causing improper execution and modify them to ensure proper handling of these mechanisms to improve performance.	60	0	REVERT
1774429762.616	Conduct a detailed analysis of the VM's instruction set architecture (ISA) and related execution mechanisms during concurrent operations with high load demands. Identify any potential misconfigurations or inefficiencies that might be causing improper execution and modify them to ensure proper handling of these mechanisms to improve performance.	60	0	REVERT
1774429827.374	Conduct a detailed analysis of the VM's memory management and allocation strategies during concurrent operations with high memory demands. Identify any potential misconfigurations or inefficiencies that might be causing improper execution and modify them to ensure proper handling of these mechanisms to improve performance.	60	0	REVERT
1774429891.938	Conduct a detailed analysis of the VM's data structures and algorithms used for handling concurrent operations. Identify any potential misconfigurations or inefficiencies that might be causing improper execution and modify them to ensure proper handling of these mechanisms to improve performance.	60	0	REVERT
1774429956.492	Conduct a detailed analysis of the VM's synchronization mechanisms during concurrent operations with high load demands. Identify any potential misconfigurations or inefficiencies that might be causing improper execution and modify them to ensure proper handling of these mechanisms to improve performance.	60	0	REVERT
1774430021.033	Conduct a detailed analysis of the VM's context switching mechanism during concurrent operations with high load demands. Identify any potential misconfigurations or inefficiencies that might be causing improper execution and modify them to ensure proper handling of these mechanisms to improve performance.	60	0	REVERT
1774430085.795	Conduct a detailed analysis of the VM's interrupt handling mechanism during concurrent operations with high load demands. Identify any potential misconfigurations or inefficiencies that might be causing improper execution and modify them to ensure proper handling of these mechanisms to improve performance.	60	0	REVERT
1774430150.593	Conduct a detailed analysis of the VM's memory management and allocation strategies during concurrent operations with high memory demands. Identify any potential misconfigurations or inefficiencies that might be causing improper execution and modify them to ensure proper handling of these mechanisms to improve performance.	60	0	REVERT
1774430215.248	Conduct a detailed analysis of the VM's data structures and algorithms used for handling concurrent operations. Identify any potential misconfigurations or inefficiencies that might be causing improper execution and modify them to ensure proper handling of these mechanisms to improve performance.	60	0	REVERT
1774430279.984	Conduct a detailed analysis of the VM's task scheduling and execution flow during concurrent operations with high load demands. Identify any potential misconfigurations or inefficiencies that might be causing improper execution and modify them to ensure proper handling of these mechanisms to improve performance.	60	0	REVERT
1774430344.662	Conduct a detailed analysis of the VM's task preemption mechanism during concurrent operations with high load demands. Identify any potential misconfigurations or inefficiencies that might be causing improper execution and modify them to ensure proper handling of these mechanisms to improve performance.	60	0	REVERT
1774430409.066	Conduct a detailed analysis of the VM's cache management during concurrent operations with high load demands. Identify any potential misconfigurations or inefficiencies that might be causing improper execution and modify them to ensure proper handling of these mechanisms to improve performance.	60	0	REVERT
1774430473.813	Conduct a detailed analysis of the VM's memory management and allocation strategies during concurrent operations with high memory demands. Identify any potential misconfigurations or inefficiencies that might be causing improper execution and modify them to ensure proper handling of these mechanisms to improve performance.	60	0	REVERT
1774430538.325	Conduct a detailed analysis of the VM's concurrency control mechanisms, including synchronization and locking strategies. Identify any potential misconfigurations or inefficiencies that might be causing improper execution and modify them to ensure proper handling of these mechanisms to improve performance.	60	0	REVERT
1774430603.018	Conduct a detailed analysis of the VM's communication and inter-component interaction mechanisms. Identify any potential misconfigurations or inefficiencies that might be causing improper execution and modify them to ensure proper handling of these mechanisms to improve performance.	60	0	REVERT
1774430667.744	Conduct a detailed analysis of the VM's task scheduling and load balancing algorithms. Identify any potential misconfigurations or inefficiencies that might be causing improper execution and modify them to ensure proper handling of these mechanisms to improve performance.	60	0	REVERT
1774430732.759	Conduct a detailed analysis of the VM's file system management, focusing on how it handles concurrent read and write operations during high load demands. Identify any potential misconfigurations or inefficiencies that might be causing improper execution and modify them to ensure proper handling of these mechanisms to improve performance.	60	0	REVERT
1774430797.755	Conduct a detailed analysis of the VM's cache mechanisms, including memory caching and data buffering strategies. Identify any potential misconfigurations or inefficiencies that might be causing improper execution and modify them to ensure proper handling of these mechanisms to improve performance.	60	0	REVERT
1774430862.439	Conduct a detailed analysis of the VM's task management, focusing on how it handles process creation and termination during high load demands. Identify any potential misconfigurations or inefficiencies that might be causing improper execution and modify them to ensure proper handling of these mechanisms to improve performance.	60	0	REVERT
1774430927.187	Conduct a detailed analysis of the VM's memory management, focusing on how it handles memory allocation and deallocation. Implement more efficient data structures and algorithms for these operations and evaluate their impact on VM performance under heavy load conditions.	60	0	REVERT
1774430992.356	Conduct a detailed analysis of the VM's communication protocols, focusing on how it handles inter-process and inter-thread communication during high load demands. Identify any potential misconfigurations or inefficiencies that might be causing improper execution and modify them to ensure proper handling of these mechanisms to improve performance.	60	0	REVERT
