timestamp	hypothesis	baseline	metric	status
1774422230.851	Conduct a detailed analysis of the VM's subsystem initialization and shutdown sequence. Identify any potential misconfigurations or bugs that might be leading to improper execution. Modify identified configurations and ensure proper subsystem collaboration during initialization and shutdown sequences to improve performance.	60	0	REVERT
1774422295.849	Conduct a detailed analysis of the VM's memory management subsystem, including how memory allocation and deallocation are handled during concurrent operations. Identify any potential misconfigurations or bugs that might be leading to improper execution. Modify identified configurations and ensure proper memory management to improve performance.	60	0	REVERT
1774422360.884	Conduct a detailed analysis of the VM's task scheduling algorithm, including any potential misconfigurations or bugs that might be leading to improper execution. Modify identified configurations and ensure proper task scheduling to improve performance.	60	0	REVERT
1774422426.111	Conduct a detailed analysis of the VM's subsystem initialization and shutdown sequence. Identify any potential misconfigurations or bugs that might be leading to improper execution. Modify identified configurations and ensure proper subsystem collaboration during initialization and shutdown sequences to improve performance.	60	0	REVERT
1774422491.287	Conduct a detailed analysis of the VM's subsystem initialization and shutdown sequence. Identify any potential misconfigurations or bugs that might be leading to improper execution. Modify identified configurations and ensure proper subsystem collaboration during initialization and shutdown sequences to improve performance.	60	0	REVERT
1774422556.367	Conduct a detailed analysis of the VM's inter-subsystem communication mechanisms, including any potential misconfigurations or bugs that might be leading to improper execution. Modify identified configurations and ensure proper inter-subsystem collaboration to improve performance.	60	0	REVERT
1774422620.979	Conduct a detailed analysis of the VM's context switching mechanism, including any potential misconfigurations or bugs that might be leading to improper execution. Modify identified configurations and ensure proper context management to improve performance.	60	0	REVERT
1774422685.664	Conduct a detailed analysis of the VM's system call handling mechanism, including any potential misconfigurations or bugs that might be leading to improper execution. Modify identified configurations and ensure proper handling of system calls to improve performance.	60	0	REVERT
1774422750.092	Conduct a detailed analysis of the VM's resource allocation mechanism, including any potential misconfigurations or bugs that might be leading to improper execution. Modify identified configurations and ensure proper resource management to improve performance.	60	0	REVERT
1774422814.898	Conduct a detailed analysis of the VM's task scheduling algorithm, including any potential misconfigurations or bugs that might be leading to improper execution. Modify identified configurations and ensure proper task management to improve performance.	60	0	REVERT
1774422880.046	Conduct a detailed analysis of the VM's initialization/shutdown sequences, including any potential misconfigurations or bugs that might be leading to improper execution. Modify identified configurations and ensure proper handling of these sequences to improve performance.	60	0	REVERT
1774422944.96	Conduct a detailed analysis of the VM's inter-subsystem communication mechanism, including any potential misconfigurations or bugs that might be leading to improper execution. Modify identified configurations and ensure proper communication between subsystems to improve performance.	60	0	REVERT
1774423009.711	Conduct a detailed analysis of the VM's context switching mechanism, including any potential misconfigurations or bugs that might be leading to improper execution. Modify identified configurations and ensure proper handling of context switching to improve performance.	60	0	REVERT
1774423074.666	Conduct a detailed analysis of the VM's system call handling mechanism, including any potential misconfigurations or bugs that might be leading to improper execution. Modify identified configurations and ensure proper handling of system calls to improve performance.	60	0	REVERT
1774423139.878	Conduct a detailed analysis of the VM's resource allocation mechanism, including any potential misconfigurations or bugs that might be leading to improper execution. Modify identified configurations and ensure proper handling of resource allocation among different subsystems to improve performance.	60	0	REVERT
1774423205.041	Conduct a detailed analysis of the VM's memory management mechanism, including any potential misconfigurations or bugs that might be leading to improper execution. Modify identified configurations and ensure proper handling of memory allocation, deallocation, and garbage collection to improve performance.	60	0	REVERT
1774423269.96	Conduct a detailed analysis of the VM's task scheduling mechanism, including any potential misconfigurations or bugs that might be leading to improper execution. Modify identified configurations and ensure proper handling of task scheduling to improve performance.	60	0	REVERT
1774423335.217	Conduct a detailed analysis of the VM's inter-subsystem communication mechanism, including any potential misconfigurations or bugs that might be leading to improper execution. Modify identified configurations and ensure proper handling of inter-subsystem communication to improve performance.	60	0	REVERT
1774423400.164	Conduct a detailed analysis of the VM's thread synchronization mechanism, including any potential misconfigurations or bugs that might be leading to improper execution. Modify identified configurations and ensure proper handling of thread synchronization to improve performance.	60	0	REVERT
1774423464.902	Conduct a detailed analysis of the VM's context switching mechanism, including any potential misconfigurations or bugs that might be leading to improper execution. Modify identified configurations and ensure proper handling of context switching to improve performance.	60	0	REVERT
1774423530.067	Conduct a detailed analysis of the VM's resource allocation mechanism, including any potential misconfigurations or bugs that might be leading to improper execution. Modify identified configurations and ensure proper handling of resource allocation to improve performance.	60	0	REVERT
1774423595.099	Conduct a detailed analysis of the VM's memory management mechanism, including any potential misconfigurations or bugs that might be leading to improper execution. Modify identified configurations and ensure proper handling of memory management to improve performance.	60	0	REVERT
1774423660.168	Conduct a detailed analysis of the VM's task scheduling mechanism, including any potential misconfigurations or bugs that might be leading to improper execution. Modify identified configurations and ensure proper handling of task scheduling to improve performance.	60	0	REVERT
1774423725.367	Conduct a detailed analysis of the VM's inter-subsystem communication mechanism, including any potential misconfigurations or bugs that might be leading to improper execution. Modify identified configurations and ensure proper handling of inter-subsystem communication to improve performance.	60	0	REVERT
1774423790.053	Conduct a detailed analysis of the VM's thread synchronization mechanism, including any potential misconfigurations or bugs that might be leading to improper execution. Modify identified configurations and ensure proper handling of thread synchronization to improve performance.	60	0	REVERT
1774423855.131	Conduct a detailed analysis of the VM's system call handling mechanism, including any potential misconfigurations or bugs that might be leading to improper execution. Modify identified configurations and ensure proper handling of system call handling to improve performance.	60	0	REVERT
1774423919.894	Conduct a detailed analysis of the VM's context switching mechanism, including any potential misconfigurations or bugs that might be leading to improper execution. Modify identified configurations and ensure proper handling of context switching to improve performance.	60	0	REVERT
1774423984.871	Conduct a detailed analysis of the VM's resource allocation and management mechanism during concurrent operations, including any potential misconfigurations or bugs that might be leading to improper execution. Modify identified configurations and ensure proper handling of resource allocation and management to improve performance.	60	0	REVERT
1774424050.308	Conduct a detailed analysis of the interaction between the VM's memory management and system call handling subsystems. Identify any potential misconfigurations or bugs that might be leading to improper execution and modify them to ensure proper handling of these interactions to improve performance.	60	0	REVERT
1774424115.607	Conduct a detailed analysis of the VM's inter-subsystem communication mechanisms, including any potential misconfigurations or bugs that might be leading to improper execution. Modify identified configurations and ensure proper handling of inter-subsystem communication to improve performance.	60	0	REVERT
1774424180.686	Conduct a detailed analysis of the VM's memory allocation mechanism during concurrent operations. Identify any potential misconfigurations or bugs that might be leading to improper execution and modify them to ensure proper handling of memory allocation during concurrent operations to improve performance.	60	0	REVERT
1774424245.244	Conduct a detailed analysis of the VM's system call handling mechanism during concurrent operations. Identify any potential misconfigurations or bugs that might be leading to improper execution and modify them to ensure proper handling of system calls during concurrent operations to improve performance.	60	0	REVERT
1774424309.734	Conduct a detailed analysis of the VM's synchronization mechanisms among different subsystems during concurrent operations. Identify any potential race conditions, deadlocks, or bugs that might be causing improper execution. Modify identified configurations and ensure proper handling of synchronization to improve performance.	60	0	REVERT
1774424375.055	Conduct a detailed analysis of the VM's memory allocation and deallocation mechanism during concurrent operations. Identify any potential misconfigurations or bugs that might be leading to improper execution and modify them to ensure proper handling of memory allocation and deallocation during concurrent operations to improve performance.	60	0	REVERT
1774424440.828	Conduct a detailed analysis of the VM's resource contention management mechanisms during concurrent operations. Identify any potential misconfigurations or bugs that might be leading to improper execution and modify them to ensure proper handling of resource contention during concurrent operations to improve performance.	60	0	REVERT
1774424506.094	Conduct a detailed analysis of the VM's thread management mechanism during concurrent operations. Identify any potential misconfigurations or bugs that might be leading to improper execution and modify them to ensure proper handling of threads during concurrent operations to improve performance.	60	0	REVERT
1774424570.777	Conduct a detailed analysis of the VM's concurrent operation handling mechanism. Identify any potential misconfigurations or bugs that might be leading to improper execution and modify them to ensure proper handling of concurrent operations to improve performance.	60	0	REVERT
1774424635.926	Conduct a detailed analysis of the VM's system call handling mechanism during concurrent operations. Identify any potential misconfigurations or bugs that might be leading to improper execution and modify them to ensure proper handling of system calls during concurrent operations to improve performance.	60	0	REVERT
1774424700.552	Conduct a detailed analysis of the VM's synchronization mechanism during concurrent operations. Identify any potential misconfigurations or bugs that might be leading to improper execution and modify them to ensure proper handling of synchronization to improve performance.	60	0	REVERT
1774424765.819	Conduct a detailed analysis of the VM's memory management mechanism during concurrent operations. Identify any potential misconfigurations or bugs that might be leading to improper execution and modify them to ensure proper handling of memory during concurrent operations to improve performance.	60	0	REVERT
1774424830.932	Conduct a detailed analysis of the VM's context switching mechanism during concurrent operations. Identify any potential misconfigurations or bugs that might be leading to improper execution and modify them to ensure proper handling of context switching to improve performance.	60	0	REVERT
1774424895.582	Conduct a detailed analysis of the VM's task scheduling mechanism during concurrent operations. Identify any potential misconfigurations or bugs that might be leading to improper execution and modify them to ensure proper handling of task scheduling to improve performance.	60	0	REVERT
1774424960.721	Conduct a detailed analysis of the VM's thread synchronization mechanism during concurrent operations. Identify any potential misconfigurations or bugs that might be leading to improper execution and modify them to ensure proper handling of thread synchronization to improve performance.	60	0	REVERT
1774425026.039	Conduct a detailed analysis of the VM's system call handling mechanism during concurrent operations. Identify any potential misconfigurations or bugs that might be leading to improper execution and modify them to ensure proper handling of system calls to improve performance.	60	0	REVERT
1774425091.134	Conduct a detailed analysis of the VM's resource allocation mechanism during concurrent operations. Identify any potential misconfigurations or bugs that might be leading to improper execution and modify them to ensure proper handling of resource allocation to improve performance.	60	0	REVERT
1774425156.348	Conduct a detailed analysis of the VM's memory management mechanism during concurrent operations. Identify any potential misconfigurations or bugs that might be leading to improper execution and modify them to ensure proper handling of memory management to improve performance.	60	0	REVERT
1774425221.949	Conduct a detailed analysis of the VM's context switching mechanism during concurrent operations. Identify any potential misconfigurations or bugs that might be leading to improper execution and modify them to ensure proper handling of context switching to improve performance.	60	0	REVERT
1774425287.355	Conduct a detailed analysis of the VM's resource contention mechanism during concurrent operations. Identify any potential misconfigurations or bugs that might be leading to improper execution and modify them to ensure proper handling of resource contention to improve performance.	60	0	REVERT
1774425352.759	Conduct a detailed analysis of the VM's thread synchronization mechanism during concurrent operations. Identify any potential misconfigurations or bugs that might be leading to improper execution and modify them to ensure proper handling of thread synchronization to improve performance.	60	0	REVERT
1774425418.609	Conduct a detailed analysis of the VM's system call handling mechanism during concurrent operations. Identify any potential misconfigurations or bugs that might be leading to improper execution and modify them to ensure proper handling of system calls to improve performance.	60	0	REVERT
1774425483.912	Conduct a detailed analysis of the VM's task scheduling mechanism during concurrent operations. Identify any potential misconfigurations or bugs that might be leading to improper execution and modify them to ensure proper handling of task scheduling to improve performance.	60	0	REVERT
1774425549.206	Conduct a detailed analysis of the VM's memory management mechanism during concurrent operations. Identify any potential misconfigurations or bugs that might be leading to improper execution and modify them to ensure proper handling of memory management to improve performance.	60	0	REVERT
1774425614.08	Conduct a detailed analysis of the VM's context switching mechanism during concurrent operations. Identify any potential misconfigurations or bugs that might be leading to improper execution and modify them to ensure proper handling of context switching to improve performance.	60	0	REVERT
1774425679.566	Conduct a detailed analysis of the VM's process management mechanism during concurrent operations. Identify any potential misconfigurations or bugs that might be leading to improper execution and modify them to ensure proper handling of process management to improve performance.	60	0	REVERT
1774425744.262	Conduct a detailed analysis of the VM's concurrency mechanism during concurrent operations. Identify any potential misconfigurations or bugs that might be leading to improper execution and modify them to ensure proper handling of concurrency to improve performance.	60	0	REVERT
1774425808.926	Conduct a detailed analysis of the VM's thread synchronization mechanism during concurrent operations. Identify any potential misconfigurations or bugs that might be leading to improper execution and modify them to ensure proper handling of thread synchronization to improve performance.	60	0	REVERT
1774425874.225	Conduct a detailed analysis of the VM's resource contention mechanism during concurrent operations. Identify any potential misconfigurations or bugs that might be leading to improper execution and modify them to ensure proper handling of resource contention to improve performance.	60	0	REVERT
1774425939.525	Conduct a detailed analysis of the VM's system call handling mechanism during concurrent operations. Identify any potential misconfigurations or bugs that might be leading to improper execution and modify them to ensure proper handling of system calls to improve performance.	60	0	REVERT
1774426004.242	Conduct a detailed analysis of the VM's context switching mechanism during concurrent operations. Identify any potential misconfigurations or bugs that might be leading to improper execution and modify them to ensure proper handling of context switching to improve performance.	60	0	REVERT
1774426069.097	Conduct a detailed analysis of the VM's memory management mechanism during concurrent operations. Identify any potential misconfigurations or bugs that might be leading to improper execution and modify them to ensure proper handling of memory management to improve performance.	60	0	REVERT
1774426133.866	Conduct a detailed analysis of the VM's task scheduling mechanism during concurrent operations. Identify any potential misconfigurations or bugs that might be leading to improper execution and modify them to ensure proper handling of task scheduling to improve performance.	60	0	REVERT
1774426199.039	Conduct a detailed analysis of the VM's thread synchronization mechanism during concurrent operations. Identify any potential misconfigurations or bugs that might be leading to improper execution and modify them to ensure proper handling of thread synchronization to improve performance.	60	0	REVERT
1774426264.272	Conduct a detailed analysis of the VM's resource contention mechanism during concurrent operations. Identify any potential misconfigurations or bugs that might be leading to improper execution and modify them to ensure proper handling of resource contention to improve performance.	60	0	REVERT
1774426329.532	Conduct a detailed analysis of the VM's system call handling mechanism during concurrent operations. Identify any potential misconfigurations or bugs that might be leading to improper execution and modify them to ensure proper handling of system calls to improve performance.	60	0	REVERT
1774426394.843	Conduct a detailed analysis of the VM's context switching mechanism during concurrent operations. Identify any potential misconfigurations or bugs that might be leading to improper execution and modify them to ensure proper handling of context switching to improve performance.	60	0	REVERT
1774426459.923	Conduct a detailed analysis of the VM's memory management mechanism during concurrent operations. Identify any potential misconfigurations or bugs that might be leading to improper execution and modify them to ensure proper handling of memory management to improve performance.	60	0	REVERT
1774426525.342	Conduct a detailed analysis of the VM's task scheduling mechanism during concurrent operations. Identify any potential misconfigurations or bugs that might be leading to improper execution and modify them to ensure proper handling of task scheduling to improve performance.	60	0	REVERT
1774426590.667	Conduct a detailed analysis of the VM's thread synchronization mechanism during concurrent operations. Identify any potential misconfigurations or bugs that might be leading to improper execution and modify them to ensure proper handling of thread synchronization to improve performance.	60	0	REVERT
1774426655.86	Conduct a detailed analysis of the VM's resource contention mechanism during concurrent operations. Identify any potential misconfigurations or bugs that might be leading to improper execution and modify them to ensure proper handling of resource contention to improve performance.	60	0	REVERT
1774426721.079	Conduct a detailed analysis of the VM's system call handling mechanism during concurrent operations. Identify any potential misconfigurations or bugs that might be leading to improper execution and modify them to ensure proper handling of system call handling to improve performance.	60	0	REVERT
